{"attempts": null, "batch": 2, "context": ["focus", "history", "inspirations"], "cost_source": "provider", "cost_usd": 0.015034, "event": "candidate", "explore_p": null, "feasible": false, "feedback": {"certified": 0, "failures": [{"base_deficit": 3.0, "case": {"blocks": 4, "id": "k4-mask312-order21771", "mask": 312, "order_index": 21771}, "generated_profiles": [{"base": 67, "gamma": [15, 12, 9, 0]}, {"base": 68, "gamma": [11, 9, 10, 7]}, {"base": 118, "gamma": [18, 21, 24, 10]}, {"base": 191, "gamma": [28, 25, 26, 17]}, {"base": 191, "gamma": [28, 25, 26, 17]}, {"base": 95, "gamma": [12, 13, 13, 8]}, {"base": 108, "gamma": [12, 16, 13, 8]}, {"base": 129, "gamma": [15, 14, 13, 10]}]}, {"base_deficit": 2.4285714285714306, "case": {"blocks": 4, "id": "k4-mask78-order9701", "mask": 78, "order_index": 9701}, "generated_profiles": [{"base": 98, "gamma": [21, 18, 15, 6]}, {"base": 96, "gamma": [14, 13, 13, 10]}, {"base": 97, "gamma": [15, 16, 21, 5]}, {"base": 228, "gamma": [36, 33, 30, 25]}, {"base": 205, "gamma": [22, 30, 27, 22]}, {"base": 173, "gamma": [20, 17, 18, 16]}, {"base": 150, "gamma": [14, 15, 19, 10]}, {"base": 214, "gamma": [23, 22, 21, 18]}]}, {"base_deficit": 1.5, "case": {"blocks": 5, "id": "k5-mask310-order4691", "mask": 310, "order_index": 4691}, "generated_profiles": [{"base": 90, "gamma": [22, 19, 13, 10, 1]}, {"base": 106, "gamma": [15, 12, 11, 14, 11]}, {"base": 99, "gamma": [13, 14, 20, 0, 9]}, {"base": 90, "gamma": [22, 19, 13, 10, 1]}, {"base": 162, "gamma": [30, 27, 21, 18, 9]}, {"base": 187, "gamma": [19, 27, 25, 22, 17]}, {"base": 167, "gamma": [18, 15, 16, 17, 16]}, {"base": 170, "gamma": [15, 16, 17, 14, 13]}]}, {"base_deficit": 1.5, "case": {"blocks": 6, "id": "k6-mask442-order5461", "mask": 442, "order_index": 5461}, "generated_profiles": [{"base": 85, "gamma": [21, 17, 12, 9, 3, 2]}, {"base": 90, "gamma": [13, 12, 9, 6, 6, 9]}, {"base": 96, "gamma": [13, 17, 20, 0, 6, 9]}, {"base": 72, "gamma": [7, 12, 9, 6, 2, 3]}, {"base": 359, "gamma": [43, 41, 38, 35, 29, 26]}, {"base": 208, "gamma": [16, 25, 22, 19, 17, 14]}, {"base": 107, "gamma": [10, 12, 12, 9, 7, 8]}, {"base": 153, "gamma": [12, 14, 14, 11, 9, 10]}]}], "graphs": [{"failures": 4, "feedback": true, "graph": "k4", "role": "train", "score": -4007.211904761905}, {"failures": 8, "feedback": true, "graph": "k5", "role": "train", "score": -8005.315367965368}, {"failures": 7, "feedback": true, "graph": "k6", "role": "train", "score": -7003.353186813187}, {"failures": 9, "feedback": true, "graph": "k7", "role": "train", "score": -9004.62849083162}, {"failures": 6, "feedback": true, "graph": "k8", "role": "train", "score": -6002.735524600847}], "interpretation": "Misses do not prove infeasibility; equal base threshold is insufficient. Every slope must be <=6.", "missed": 34, "score": -115657.24447497292}, "finish_reason": "stop", "focus": "k7", "graphs": [{"excess_T": null, "failures": 4, "gap_mean": null, "graph": "k4", "incomplete": null, "score": -4007.211904761905, "value_max": null}, {"excess_T": null, "failures": 8, "gap_mean": null, "graph": "k5", "incomplete": null, "score": -8005.315367965368, "value_max": null}, {"excess_T": null, "failures": 7, "gap_mean": null, "graph": "k6", "incomplete": null, "score": -7003.353186813187, "value_max": null}, {"excess_T": null, "failures": 9, "gap_mean": null, "graph": "k7", "incomplete": null, "score": -9004.62849083162, "value_max": null}, {"excess_T": null, "failures": 6, "gap_mean": null, "graph": "k8", "incomplete": null, "score": -6002.735524600847, "value_max": null}], "hash": "dd42067bb5247987", "id": 3, "instances": {"k4": -4007.211904761905, "k5": -8005.315367965368, "k6": -7003.353186813187, "k7": -9004.62849083162, "k8": -6002.735524600847}, "island": 0, "kind": "mixture_policy", "llm_seconds": 15.9, "mode": "exploit", "model_reasoning": "The user wants me to return a JSON object that is a mixture policy for word construction. This is a mathematical/combinatorial optimization task related to LRX families and pancake-like sorting with z...", "model_text": "{\"kind\":\"mixture_policy\",\"name\":\"complementary flat-slope adjacent inversion\",\"rules\":[{\"cuts\":[0,4,8,12],\"weights\":{\"rotation\":1,\"zero_rotation\":2,\"zero_swap\":-6,\"position\":0,\"rank_gap\":-8},\"direction\":\"shortest\",\"tie\":\"left\"},{\"cuts\":[1,3,6,10],\"weights\":{\"rotation\":-2,\"zero_rotation\":5,\"zero_swap\":1,\"position\":-4,\"rank_gap\":6},\"direction\":\"left\",\"tie\":\"right\"},{\"cuts\":[0,6,11,15],\"weights\":{\"rotation\":2,\"zero_rotation\":-4,\"zero_swap\":5,\"position\":2,\"rank_gap\":-7},\"direction\":\"right\",\"tie\":\"left\"},{\"cuts\":[2,5,9,13],\"weights\":{\"rotation\":0,\"zero_rotation\":3,\"zero_swap\":-5,\"position\":1,\"rank_gap\":-6},\"direction\":\"shortest\",\"tie\":\"right\"},{\"cuts\":[0,7,14],\"weights\":{\"rotation\":3,\"zero_rotation\":1,\"zero_swap\":-8,\"position\":-1,\"rank_gap\":4},\"direction\":\"left\",\"tie\":\"left\"},{\"cuts\":[3,8,12,16],\"weights\":{\"rotation\":-3,\"zero_rotation\":6,\"zero_swap\":2,\"position\":4,\"rank_gap\":-5},\"direction\":\"shortest\",\"tie\":\"left\"},{\"cuts\":[1,6,11],\"weights\":{\"rotation\":4,\"zero_rotation\":-2,\"zero_swap\":0,\"position\":-5,\"rank_gap\":8},\"direction\":\"right\",\"tie\":\"right\"},{\"cuts\":[0,5,10,15],\"weights\":{\"rotation\":1,\"zero_rotation\":4,\"zero_swap\":-1,\"position\":3,\"rank_gap\":-9},\"direction\":\"shortest\",\"tie\":\"left\"}]}", "parents": [2], "prompt_messages": [{"content": "{\"task\": \"Improve a reusable word-construction policy to certify additional infinite LRX families.\", \"mode\": \"exploit\", \"parents\": [[{\"kind\": \"mixture_policy\", \"name\": \"complementary slope-bounded adjacent inversion\", \"rules\": [{\"cuts\": [0, 3, 7, 11], \"weights\": {\"rotation\": 2, \"zero_rotation\": 3, \"zero_swap\": -2, \"position\": 1, \"rank_gap\": -4}, \"direction\": \"shortest\", \"tie\": \"left\"}, {\"cuts\": [0, 5, 9, 14], \"weights\": {\"rotation\": 1, \"zero_rotation\": -2, \"zero_swap\": 4, \"position\": -1, \"rank_gap\": 3}, \"direction\": \"left\", \"tie\": \"right\"}, {\"cuts\": [1, 4, 8, 12], \"weights\": {\"rotation\": 0, \"zero_rotation\": 2, \"zero_swap\": -3, \"position\": 2, \"rank_gap\": -5}, \"direction\": \"right\", \"tie\": \"left\"}, {\"cuts\": [0, 2, 6, 13], \"weights\": {\"rotation\": 3, \"zero_rotation\": 1, \"zero_swap\": -1, \"position\": -2, \"rank_gap\": 2}, \"direction\": \"shortest\", \"tie\": \"right\"}, {\"cuts\": [2, 6, 10], \"weights\": {\"rotation\": -1, \"zero_rotation\": 4, \"zero_swap\": 2, \"position\": 0, \"rank_gap\": -3}, \"direction\": \"left\", \"tie\": \"left\"}, {\"cuts\": [0, 8, 15], \"weights\": {\"rotation\": 2, \"zero_rotation\": -1, \"zero_swap\": 3, \"position\": -3, \"rank_gap\": 1}, \"direction\": \"shortest\", \"tie\": \"left\"}, {\"cuts\": [1, 5, 9, 16], \"weights\": {\"rotation\": 1, \"zero_rotation\": 0, \"zero_swap\": -4, \"position\": 3, \"rank_gap\": -2}, \"direction\": \"right\", \"tie\": \"right\"}, {\"cuts\": [0, 4, 7, 12], \"weights\": {\"rotation\": 4, \"zero_rotation\": -3, \"zero_swap\": 1, \"position\": 1, \"rank_gap\": -1}, \"direction\": \"shortest\", \"tie\": \"left\"}]}, {\"score\": -108853.65014531268, \"certified\": 2, \"missed\": 32, \"graphs\": [{\"graph\": \"k4\", \"score\": -4007.211904761905, \"failures\": 4, \"role\": \"train\", \"feedback\": true}, {\"graph\": \"k5\", \"score\": -7003.857149416241, \"failures\": 7, \"role\": \"train\", \"feedback\": true}, {\"graph\": \"k6\", \"score\": -7003.353186813187, \"failures\": 7, \"role\": \"train\", \"feedback\": true}, {\"graph\": \"k7\", \"score\": -9004.62849083162, \"failures\": 9, \"role\": \"train\", \"feedback\": true}, {\"graph\": \"k8\", \"score\": -5002.5994134897355, \"failures\": 5, \"role\": \"train\", \"feedback\": true}], \"failures\": [{\"case\": {\"id\": \"k4-mask312-order21771\", \"mask\": 312, \"order_index\": 21771, \"blocks\": 4}, \"base_deficit\": 3.0, \"generated_profiles\": [{\"base\": 67, \"gamma\": [15, 12, 9, 2]}, {\"base\": 71, \"gamma\": [15, 12, 13, 4]}, {\"base\": 87, \"gamma\": [16, 17, 3, 6]}, {\"base\": 67, \"gamma\": [15, 12, 9, 2]}, {\"base\": 119, \"gamma\": [23, 20, 17, 8]}, {\"base\": 208, \"gamma\": [23, 23, 24, 19]}, {\"base\": 143, \"gamma\": [15, 16, 12, 11]}, {\"base\": 239, \"gamma\": [35, 32, 33, 24]}]}, {\"case\": {\"id\": \"k4-mask78-order9701\", \"mask\": 78, \"order_index\": 9701, \"blocks\": 4}, \"base_deficit\": 2.4285714285714306, \"generated_profiles\": [{\"base\": 96, \"gamma\": [20, 17, 14, 5]}, {\"base\": 71, \"gamma\": [11, 15, 12, 9]}, {\"base\": 89, \"gamma\": [16, 15, 18, 8]}, {\"base\": 65, \"gamma\": [6, 14, 11, 2]}, {\"base\": 228, \"gamma\": [37, 34, 31, 22]}, {\"base\": 144, \"gamma\": [18, 15, 19, 14]}, {\"base\": 144, \"gamma\": [14, 15, 19, 10]}, {\"base\": 177, \"gamma\": [15, 27, 24, 19]}]}, {\"case\": {\"id\": \"k5-mask310-order4691\", \"mask\": 310, \"order_index\": 4691, \"blocks\": 5}, \"base_deficit\": 1.5, \"generated_profiles\": [{\"base\": 89, \"gamma\": [21, 18, 12, 9, 0]}, {\"base\": 86, \"gamma\": [14, 14, 14, 9, 8]}, {\"base\": 118, \"gamma\": [16, 15, 21, 5, 14]}, {\"base\": 71, \"gamma\": [7, 13, 7, 6, 5]}, {\"base\": 240, \"gamma\": [36, 33, 27, 24, 15]}, {\"base\": 165, \"gamma\": [18, 15, 20, 21, 16]}, {\"base\": 195, \"gamma\": [17, 18, 20, 12, 15]}, {\"base\": 240, \"gamma\": [36, 33, 27, 24, 15]}]}, {\"case\": {\"id\": \"k6-mask442-order5461\", \"mask\": 442, \"order_index\": 5461, \"blocks\": 6}, \"base_deficit\": 1.5, \"generated_profiles\": [{\"base\": 87, \"gamma\": [21, 15, 12, 9, 3, 2]}, {\"base\": 66, \"gamma\": [5, 12, 9, 6, 8, 3]}, {\"base\": 110, \"gamma\": [12, 18, 21, 5, 5, 8]}, {\"base\": 60, \"gamma\": [7, 12, 9, 6, 2, 5]}, {\"base\": 239, \"gamma\": [36, 30, 27, 24, 18, 15]}, {\"base\": 259, \"gamma\": [23, 21, 25, 22, 20, 21]}, {\"base\": 242, \"gamma\": [19, 21, 22, 14, 16, 17]}, {\"base\": 319, \"gamma\": [26, 28, 27, 26, 24, 23]}]}], \"interpretation\": \"Misses do not prove infeasibility; equal base threshold is insufficient. Every slope must be <=6.\"}]], \"engine_context\": {\"history\": [{\"id\": 2, \"mode\": \"exploit\", \"parents\": [0], \"status\": \"keep\", \"score\": -108853.65014531268, \"parent_score\": -115657.60811133657, \"problem_graphs\": [{\"graph\": \"k4\", \"score\": -4007.211904761905, \"failures\": 4}, {\"graph\": \"k5\", \"score\": -7003.857149416241, \"failures\": 7}, {\"graph\": \"k6\", \"score\": -7003.353186813187, \"failures\": 7}, {\"graph\": \"k7\", \"score\": -9004.62849083162, \"failures\": 9}], \"focus\": \"k7\"}, {\"id\": 1, \"mode\": \"exploit\", \"parents\": [0], \"status\": \"discard\", \"score\": -115657.60811133657, \"parent_score\": -115657.60811133657, \"problem_graphs\": [{\"graph\": \"k4\", \"score\": -4007.211904761905, \"failures\": 4}, {\"graph\": \"k5\", \"score\": -8005.679004329004, \"failures\": 8}, {\"graph\": \"k6\", \"score\": -7003.353186813187, \"failures\": 7}, {\"graph\": \"k7\", \"score\": -9004.62849083162, \"failures\": 9}], \"focus\": \"k7\"}], \"inspirations\": [{\"id\": 0, \"score\": -115657.60811133657, \"graph_scores\": {\"k4\": -4007.211904761905, \"k5\": -8005.679004329004, \"k6\": -7003.353186813187, \"k7\": -9004.62849083162, \"k8\": -6002.735524600847}, \"spec\": {\"kind\": \"mixture_policy\", \"name\": \"nearest adjacent inversion, three cuts\", \"rules\": [{\"cuts\": [0, 4, 8], \"weights\": {\"rotation\": 1, \"zero_rotation\": 0, \"zero_swap\": 0, \"position\": 0, \"rank_gap\": 0}, \"direction\": \"shortest\", \"tie\": \"left\"}]}}], \"focus\": {\"graph\": \"k7\", \"parent_score\": -9004.62849083162, \"archive_best\": -9004.62849083162}}, \"unverified_hypotheses\": \"\", \"context_sha256\": \"83a280095959be0ee17113ba4e6fea85215d14e850cdceb1550146f143ccdbe3\"}", "role": "user"}], "prompt_system_sha": "5823c3ab836265bb", "proposal": 3, "proposer_error": null, "reasoning_tokens": 832, "repairs_used": null, "score": -115657.24447497292, "seconds": 0.3565842079988215, "spec": {"kind": "mixture_policy", "name": "complementary flat-slope adjacent inversion", "rules": [{"cuts": [0, 4, 8, 12], "direction": "shortest", "tie": "left", "weights": {"position": 0, "rank_gap": -8, "rotation": 1, "zero_rotation": 2, "zero_swap": -6}}, {"cuts": [1, 3, 6, 10], "direction": "left", "tie": "right", "weights": {"position": -4, "rank_gap": 6, "rotation": -2, "zero_rotation": 5, "zero_swap": 1}}, {"cuts": [0, 6, 11, 15], "direction": "right", "tie": "left", "weights": {"position": 2, "rank_gap": -7, "rotation": 2, "zero_rotation": -4, "zero_swap": 5}}, {"cuts": [2, 5, 9, 13], "direction": "shortest", "tie": "right", "weights": {"position": 1, "rank_gap": -6, "rotation": 0, "zero_rotation": 3, "zero_swap": -5}}, {"cuts": [0, 7, 14], "direction": "left", "tie": "left", "weights": {"position": -1, "rank_gap": 4, "rotation": 3, "zero_rotation": 1, "zero_swap": -8}}, {"cuts": [3, 8, 12, 16], "direction": "shortest", "tie": "left", "weights": {"position": 4, "rank_gap": -5, "rotation": -3, "zero_rotation": 6, "zero_swap": 2}}, {"cuts": [1, 6, 11], "direction": "right", "tie": "right", "weights": {"position": -5, "rank_gap": 8, "rotation": 4, "zero_rotation": -2, "zero_swap": 0}}, {"cuts": [0, 5, 10, 15], "direction": "shortest", "tie": "left", "weights": {"position": 3, "rank_gap": -9, "rotation": 1, "zero_rotation": 4, "zero_swap": -1}}]}, "status": "discard", "t": 36.41, "tactic": null, "tokens_in": 4562, "tokens_out": 1273, "valid": true}
{"batch": 2, "best_id": 2, "best_score": -108853.65014531268, "completed": 3, "eval_seconds": 0.36, "event": "batch", "inflight": 0, "proposals": 3, "propose_seconds": 15.9, "requests": [{"explore_p": null, "focus": "k7", "island": 0, "mode": "exploit", "parents": [2], "proposal": 3, "tactic": null}], "since_improvement": 0, "strategy": {"focus": true, "history": 4, "inspiration_pool": "top", "inspirations": 1, "modes": {"exploit": 1.0}, "parent": "best", "tactic": null}, "t": 36.41, "usage": {"billing_verified": false, "estimated_usd": 0.03422, "failed_requests": 0, "input_tokens": 11617, "max_spend_usd": 2.0, "output_tokens": 2695, "provider_costed_requests": 3, "requests": 3, "usage_overruns": 0}}
{"J": 0.033964, "delta": 6803.958, "end": -108853.65014531268, "event": "strategy_window", "proposals": 3, "start": -115657.60811133657, "strategy": {"focus": true, "history": 4, "inspiration_pool": "top", "inspirations": 1, "modes": {"exploit": 1.0}, "parent": "best", "tactic": null}, "t": 36.41}
