{"cost_usd": 0.01303, "error": null, "event": "reflection", "llm_seconds": 8.0, "prompt_messages": [{"content": "{\"task\": \"strategy\", \"allowed_kinds\": [\"mixture_policy\"], \"proposals\": 9, \"remaining_proposals\": 3, \"best\": [{\"spec\": {\"kind\": \"mixture_policy\", \"name\": \"even-cut low-gap complementary adjacent inversion\", \"rules\": [{\"cuts\": [0, 4, 8, 12], \"weights\": {\"rotation\": 1, \"zero_rotation\": 1, \"zero_swap\": 0, \"position\": 2, \"rank_gap\": -1}, \"direction\": \"shortest\", \"tie\": \"left\"}, {\"cuts\": [1, 5, 9, 13], \"weights\": {\"rotation\": 1, \"zero_rotation\": -1, \"zero_swap\": 2, \"position\": -2, \"rank_gap\": 1}, \"direction\": \"left\", \"tie\": \"right\"}, {\"cuts\": [2, 6, 10, 14], \"weights\": {\"rotation\": 0, \"zero_rotation\": 2, \"zero_swap\": -2, \"position\": 1, \"rank_gap\": -1}, \"direction\": \"right\", \"tie\": \"left\"}, {\"cuts\": [0, 3, 6, 10], \"weights\": {\"rotation\": 2, \"zero_rotation\": 0, \"zero_swap\": 1, \"position\": -1, \"rank_gap\": 0}, \"direction\": \"shortest\", \"tie\": \"right\"}, {\"cuts\": [0, 5, 11], \"weights\": {\"rotation\": -1, \"zero_rotation\": 3, \"zero_swap\": -1, \"position\": 0, \"rank_gap\": -2}, \"direction\": \"left\", \"tie\": \"left\"}, {\"cuts\": [1, 7, 12], \"weights\": {\"rotation\": 2, \"zero_rotation\": -2, \"zero_swap\": 3, \"position\": -3, \"rank_gap\": 2}, \"direction\": \"shortest\", \"tie\": \"left\"}, {\"cuts\": [3, 8, 13, 16], \"weights\": {\"rotation\": 1, \"zero_rotation\": 1, \"zero_swap\": -3, \"position\": 3, \"rank_gap\": -1}, \"direction\": \"right\", \"tie\": \"right\"}, {\"cuts\": [0, 2, 8, 15], \"weights\": {\"rotation\": 3, \"zero_rotation\": -1, \"zero_swap\": 1, \"position\": 1, \"rank_gap\": 0}, \"direction\": \"shortest\", \"tie\": \"left\"}]}, \"feedback\": {\"score\": -102048.48907522252, \"certified\": 4, \"missed\": 30, \"graphs\": [{\"graph\": \"k4\", \"score\": -4004.7166666666667, \"failures\": 4, \"role\": \"train\", \"feedback\": true}, {\"graph\": \"k5\", \"score\": -6004.1150793650795, \"failures\": 6, \"role\": \"train\", \"feedback\": true}, {\"graph\": \"k6\", \"score\": -6002.853186813187, \"failures\": 6, \"role\": \"train\", \"feedback\": true}, {\"graph\": \"k7\", \"score\": -9004.135284443411, \"failures\": 9, \"role\": \"train\", \"feedback\": true}, {\"graph\": \"k8\", \"score\": -5002.668857934181, \"failures\": 5, \"role\": \"train\", \"feedback\": true}], \"failures\": [{\"case\": {\"id\": \"k4-mask78-order9701\", \"mask\": 78, \"order_index\": 9701, \"blocks\": 4}, \"base_deficit\": 2.4285714285714306, \"generated_profiles\": [{\"base\": 94, \"gamma\": [20, 17, 14, 5]}, {\"base\": 88, \"gamma\": [14, 13, 13, 8]}, {\"base\": 95, \"gamma\": [12, 15, 18, 4]}, {\"base\": 176, \"gamma\": [32, 29, 26, 21]}, {\"base\": 108, \"gamma\": [15, 12, 16, 11]}, {\"base\": 96, \"gamma\": [10, 11, 15, 6]}, {\"base\": 103, \"gamma\": [11, 11, 10, 11]}, {\"base\": 129, \"gamma\": [23, 22, 25, 15]}]}, {\"case\": {\"id\": \"k5-mask310-order4691\", \"mask\": 310, \"order_index\": 4691, \"blocks\": 5}, \"base_deficit\": 1.5, \"generated_profiles\": [{\"base\": 89, \"gamma\": [21, 18, 12, 9, 0]}, {\"base\": 95, \"gamma\": [14, 13, 10, 13, 10]}, {\"base\": 100, \"gamma\": [12, 15, 21, 1, 10]}, {\"base\": 89, \"gamma\": [21, 18, 12, 9, 0]}, {\"base\": 149, \"gamma\": [29, 26, 20, 17, 8]}, {\"base\": 126, \"gamma\": [15, 12, 17, 18, 13]}, {\"base\": 117, \"gamma\": [11, 12, 14, 6, 9]}, {\"base\": 149, \"gamma\": [29, 26, 20, 17, 8]}]}, {\"case\": {\"id\": \"k6-mask442-order5461\", \"mask\": 442, \"order_index\": 5461, \"blocks\": 6}, \"base_deficit\": 1.5, \"generated_profiles\": [{\"base\": 83, \"gamma\": [21, 15, 12, 9, 3, 2]}, {\"base\": 78, \"gamma\": [11, 12, 9, 6, 4, 7]}, {\"base\": 96, \"gamma\": [11, 17, 20, 0, 6, 9]}, {\"base\": 62, \"gamma\": [6, 13, 10, 7, 1, 4]}, {\"base\": 233, \"gamma\": [34, 32, 29, 26, 20, 17]}, {\"base\": 203, \"gamma\": [19, 17, 21, 18, 16, 17]}, {\"base\": 120, \"gamma\": [11, 13, 14, 6, 8, 9]}, {\"base\": 155, \"gamma\": [30, 24, 21, 18, 12, 9]}]}, {\"case\": {\"id\": \"k4-mask312-order21771\", \"mask\": 312, \"order_index\": 21771, \"blocks\": 4}, \"base_deficit\": 1.3333333333333357, \"generated_profiles\": [{\"base\": 63, \"gamma\": [15, 12, 9, 2]}, {\"base\": 66, \"gamma\": [12, 10, 11, 6]}, {\"base\": 118, \"gamma\": [17, 20, 23, 9]}, {\"base\": 123, \"gamma\": [23, 20, 21, 12]}, {\"base\": 150, \"gamma\": [19, 19, 20, 15]}, {\"base\": 107, \"gamma\": [12, 13, 9, 8]}, {\"base\": 167, \"gamma\": [19, 18, 21, 18]}, {\"base\": 109, \"gamma\": [21, 24, 12, 13]}]}], \"interpretation\": \"Misses do not prove infeasibility; equal base threshold is insufficient. Every slope must be <=6.\"}}], \"recent_attempts\": [{\"id\": 9, \"mode\": \"exploit\", \"parents\": [5], \"status\": \"discard\", \"score\": -105450.012092961, \"parent_score\": -102048.48907522252, \"problem_graphs\": [{\"graph\": \"k4\", \"score\": -4004.8690476190477, \"failures\": 4}, {\"graph\": \"k5\", \"score\": -7005.359340154795, \"failures\": 7}, {\"graph\": \"k6\", \"score\": -7003.254285714285, \"failures\": 7}, {\"graph\": \"k7\", \"score\": -7002.793894872023, \"failures\": 7}], \"focus\": \"k7\"}, {\"id\": 8, \"mode\": \"exploit\", \"parents\": [5], \"status\": \"discard\", \"score\": -108852.76455282167, \"parent_score\": -102048.48907522252, \"problem_graphs\": [{\"graph\": \"k4\", \"score\": -4007.211904761905, \"failures\": 4}, {\"graph\": \"k5\", \"score\": -7003.842352092352, \"failures\": 7}, {\"graph\": \"k6\", \"score\": -7003.284897959184, \"failures\": 7}, {\"graph\": \"k7\", \"score\": -9003.756540074042, \"failures\": 9}], \"focus\": \"k7\"}, {\"id\": 7, \"mode\": \"exploit\", \"parents\": [5], \"status\": \"discard\", \"score\": -108855.51287324133, \"parent_score\": -102048.48907522252, \"problem_graphs\": [{\"graph\": \"k4\", \"score\": -4007.211904761905, \"failures\": 4}, {\"graph\": \"k5\", \"score\": -7005.650432900433, \"failures\": 7}, {\"graph\": \"k6\", \"score\": -7003.353186813187, \"failures\": 7}, {\"graph\": \"k7\", \"score\": -9004.62849083162, \"failures\": 9}], \"focus\": \"k7\"}, {\"id\": 6, \"mode\": \"exploit\", \"parents\": [5], \"status\": \"discard\", \"score\": -108853.62533355878, \"parent_score\": -102048.48907522252, \"problem_graphs\": [{\"graph\": \"k4\", \"score\": -4007.211904761905, \"failures\": 4}, {\"graph\": \"k5\", \"score\": -8005.2345598845595, \"failures\": 8}, {\"graph\": \"k6\", \"score\": -7003.353186813187, \"failures\": 7}, {\"graph\": \"k7\", \"score\": -8003.156824164952, \"failures\": 8}], \"focus\": \"k8\"}, {\"id\": 5, \"mode\": \"exploit\", \"parents\": [2], \"status\": \"keep\", \"score\": -102048.48907522252, \"parent_score\": -108853.65014531268, \"problem_graphs\": [{\"graph\": \"k4\", \"score\": -4004.7166666666667, \"failures\": 4}, {\"graph\": \"k5\", \"score\": -6004.1150793650795, \"failures\": 6}, {\"graph\": \"k6\", \"score\": -6002.853186813187, \"failures\": 6}, {\"graph\": \"k7\", \"score\": -9004.135284443411, \"failures\": 9}], \"focus\": \"k7\"}, {\"id\": 4, \"mode\": \"exploit\", \"parents\": [2], \"status\": \"discard\", \"score\": -112254.93504599144, \"parent_score\": -108853.65014531268, \"problem_graphs\": [{\"graph\": \"k4\", \"score\": -4007.211904761905, \"failures\": 4}, {\"graph\": \"k5\", \"score\": -7004.2345598845595, \"failures\": 7}, {\"graph\": \"k6\", \"score\": -7003.353186813187, \"failures\": 7}, {\"graph\": \"k7\", \"score\": -9004.62849083162, \"failures\": 9}], \"focus\": \"k7\"}, {\"id\": 3, \"mode\": \"exploit\", \"parents\": [2], \"status\": \"discard\", \"score\": -115657.24447497292, \"parent_score\": -108853.65014531268, \"problem_graphs\": [{\"graph\": \"k4\", \"score\": -4007.211904761905, \"failures\": 4}, {\"graph\": \"k5\", \"score\": -8005.315367965368, \"failures\": 8}, {\"graph\": \"k6\", \"score\": -7003.353186813187, \"failures\": 7}, {\"graph\": \"k7\", \"score\": -9004.62849083162, \"failures\": 9}], \"focus\": \"k7\"}, {\"id\": 2, \"mode\": \"exploit\", \"parents\": [0], \"status\": \"keep\", \"score\": -108853.65014531268, \"parent_score\": -115657.60811133657, \"problem_graphs\": [{\"graph\": \"k4\", \"score\": -4007.211904761905, \"failures\": 4}, {\"graph\": \"k5\", \"score\": -7003.857149416241, \"failures\": 7}, {\"graph\": \"k6\", \"score\": -7003.353186813187, \"failures\": 7}, {\"graph\": \"k7\", \"score\": -9004.62849083162, \"failures\": 9}], \"focus\": \"k7\"}], \"current_insights\": [], \"current_strategy\": {\"parent\": \"best\", \"modes\": {\"exploit\": 1.0}, \"inspirations\": 1, \"inspiration_pool\": \"top\", \"history\": 4, \"focus\": true, \"tactic\": null}, \"strategy_history\": [{\"strategy\": {\"parent\": \"best\", \"modes\": {\"exploit\": 1.0}, \"inspirations\": 1, \"inspiration_pool\": \"top\", \"history\": 4, \"focus\": true, \"tactic\": null}, \"start\": -115657.60811133657, \"end\": -108853.65014531268, \"delta\": 6803.958, \"J\": 0.033964, \"proposals\": 3}, {\"strategy\": {\"parent\": \"best\", \"modes\": {\"exploit\": 1.0}, \"inspirations\": 1, \"inspiration_pool\": \"top\", \"history\": 4, \"focus\": true, \"tactic\": null}, \"start\": -108853.65014531268, \"end\": -102048.48907522252, \"delta\": 6805.1611, \"J\": 0.036094, \"proposals\": 6}, {\"strategy\": {\"parent\": \"best\", \"modes\": {\"exploit\": 1.0}, \"inspirations\": 1, \"inspiration_pool\": \"top\", \"history\": 4, \"focus\": true, \"tactic\": null}, \"start\": -102048.48907522252, \"end\": -102048.48907522252, \"delta\": 0.0, \"J\": 0.0, \"proposals\": 9}], \"population\": {\"archive\": 10, \"best_score\": -102048.48907522252, \"median_score\": -108855.51287324133, \"front_size\": 3, \"modes\": {\"exploit\": {\"n\": 9, \"keep\": 2, \"invalid\": 0}}}}", "role": "user"}], "prompt_system_sha": "a9ad90f456e27b56", "proposals": 9, "strategy": {"focus": false, "history": 6, "inspiration_pool": "random", "inspirations": 2, "modes": {"edit": 0.25, "exploit": 0.15, "explore": 0.45, "merge": 0.15}, "parent": "top3", "tactic": "Plateaued pure exploit of the best even-cut policy; discarded children raised failures. Prefer complementary slope profiles over shorter words. Mutate cuts, rank_gap sign, and zero_rotation independently so some rules suppress high-gamma blocks while others cut base. Merge only rules whose gamma peaks sit on different blocks. Do not retune a single low-base word. A miss is not infeasibility."}, "t": 120.85, "task": "strategy", "text": "{\"parent\":\"top3\",\"modes\":{\"exploit\":0.15,\"explore\":0.45,\"edit\":0.25,\"merge\":0.15},\"inspirations\":2,\"inspiration_pool\":\"random\",\"history\":6,\"focus\":false,\"tactic\":\"Plateaued pure exploit of the best even-cut policy; discarded children raised failures. Prefer complementary slope profiles over shorter words. Mutate cuts, rank_gap sign, and zero_rotation independently so some rules suppress high-gamma blocks while others cut base. Merge only rules whose gamma peaks sit on different blocks. Do not retune a single low-base word. A miss is not infeasibility.\"}", "tokens_in": 5849, "tokens_out": 510}
