{"config": {"async": false, "batch": 1, "engine": "evox", "eval_cache": null, "eval_workers": 1, "explore_max": 0.7, "feedback_potential": true, "feedback_words": false, "final_heldout_top": 0, "focus": true, "gepa_n": 1, "history": 3, "insights_file": null, "inspirations": 1, "island_size": 6, "islands": 3, "kinds": ["mixture_policy"], "max_merges": 5, "max_proposals": 12, "max_wall_seconds": 1800, "merge_prob": 1.0, "migration_every": 12, "provider": {"api_key_env": "XAI_API_KEY", "base_url": "https://api.x.ai/v1", "idle_timeout_sec": 120, "input_usd_per_mtok": 2.2, "max_output_tokens": 2200, "max_reasoning_tokens": 16000, "max_requests": 18, "max_spend_usd": 2, "model": "grok-4.7", "output_usd_per_mtok": 6.6, "reasoning_effort": "low", "repairs": 0, "timeout_sec": 360, "type": "openai_compatible"}, "refine_mode": "exploit", "reflector": null, "seed": 409, "seeds": ["autoresearch/loop-260924-optimizer/seed.json"], "select": "score", "split": "train", "stagnation": 12, "strategy": {"focus": true, "history": 4, "inspiration_pool": "top", "inspirations": 1, "modes": {"exploit": 1.0}, "parent": "best", "tactic": null}, "tactic_trials": 3, "tactics": false, "ucb_c": 1.4142135623730951, "ucb_decay": 0.9, "window": 3}, "evaluator_sha256": "fd9ce7b1ed0eff0e", "event": "start", "git_commit": "139eeb1d037300f556eefcd402d1b1339ec9bfb1", "t": 0.02}
{"event": "candidate", "feasible": false, "feedback": {"certified": 0, "failures": [{"base_deficit": 3.0, "case": {"blocks": 4, "id": "k4-mask312-order21771", "mask": 312, "order_index": 21771}, "generated_profiles": [{"base": 61, "gamma": [15, 12, 9, 2]}, {"base": 60, "gamma": [11, 9, 10, 7]}, {"base": 108, "gamma": [18, 21, 24, 10]}]}, {"base_deficit": 2.4285714285714306, "case": {"blocks": 4, "id": "k4-mask78-order9701", "mask": 78, "order_index": 9701}, "generated_profiles": [{"base": 94, "gamma": [19, 16, 13, 4]}, {"base": 86, "gamma": [11, 10, 14, 11]}, {"base": 73, "gamma": [11, 14, 17, 3]}]}, {"base_deficit": 1.5, "case": {"blocks": 5, "id": "k5-mask310-order4691", "mask": 310, "order_index": 4691}, "generated_profiles": [{"base": 90, "gamma": [20, 17, 11, 8, 1]}, {"base": 88, "gamma": [11, 10, 11, 14, 9]}, {"base": 97, "gamma": [9, 12, 18, 2, 9]}]}, {"base_deficit": 1.5, "case": {"blocks": 6, "id": "k6-mask442-order5461", "mask": 442, "order_index": 5461}, "generated_profiles": [{"base": 83, "gamma": [21, 15, 12, 9, 3, 2]}, {"base": 72, "gamma": [9, 12, 9, 6, 4, 7]}, {"base": 88, "gamma": [11, 15, 18, 2, 6, 9]}]}], "graphs": [{"failures": 4, "feedback": true, "graph": "k4", "role": "train", "score": -4007.211904761905}, {"failures": 8, "feedback": true, "graph": "k5", "role": "train", "score": -8005.679004329004}, {"failures": 7, "feedback": true, "graph": "k6", "role": "train", "score": -7003.353186813187}, {"failures": 9, "feedback": true, "graph": "k7", "role": "train", "score": -9004.62849083162}, {"failures": 6, "feedback": true, "graph": "k8", "role": "train", "score": -6002.735524600847}], "interpretation": "Misses do not prove infeasibility; equal base threshold is insufficient. Every slope must be <=6.", "missed": 34, "score": -115657.60811133657}, "graphs": [{"excess_T": null, "failures": 4, "gap_mean": null, "graph": "k4", "incomplete": null, "score": -4007.211904761905, "value_max": null}, {"excess_T": null, "failures": 8, "gap_mean": null, "graph": "k5", "incomplete": null, "score": -8005.679004329004, "value_max": null}, {"excess_T": null, "failures": 7, "gap_mean": null, "graph": "k6", "incomplete": null, "score": -7003.353186813187, "value_max": null}, {"excess_T": null, "failures": 9, "gap_mean": null, "graph": "k7", "incomplete": null, "score": -9004.62849083162, "value_max": null}, {"excess_T": null, "failures": 6, "gap_mean": null, "graph": "k8", "incomplete": null, "score": -6002.735524600847, "value_max": null}], "hash": "d2ab64cf63614a4e", "id": 0, "instances": {"k4": -4007.211904761905, "k5": -8005.679004329004, "k6": -7003.353186813187, "k7": -9004.62849083162, "k8": -6002.735524600847}, "island": null, "kind": "mixture_policy", "mode": "seed", "parents": [], "score": -115657.60811133657, "seconds": 0.07370891701430082, "source": "autoresearch/loop-260924-optimizer/seed.json", "spec": {"kind": "mixture_policy", "name": "nearest adjacent inversion, three cuts", "rules": [{"cuts": [0, 4, 8], "direction": "shortest", "tie": "left", "weights": {"position": 0, "rank_gap": 0, "rotation": 1, "zero_rotation": 0, "zero_swap": 0}}]}, "status": "keep", "t": 0.1, "valid": true}
{"attempts": null, "batch": 0, "context": ["focus"], "cost_source": "provider", "cost_usd": 0.009128, "event": "candidate", "explore_p": null, "feasible": false, "feedback": {"certified": 0, "failures": [{"base_deficit": 3.0, "case": {"blocks": 4, "id": "k4-mask312-order21771", "mask": 312, "order_index": 21771}, "generated_profiles": [{"base": 69, "gamma": [15, 12, 9, 2]}, {"base": 77, "gamma": [15, 12, 13, 4]}, {"base": 59, "gamma": [15, 18, 8, 7]}, {"base": 85, "gamma": [15, 18, 4, 7]}, {"base": 119, "gamma": [23, 20, 17, 8]}, {"base": 148, "gamma": [18, 18, 19, 14]}, {"base": 134, "gamma": [14, 15, 16, 10]}, {"base": 101, "gamma": [11, 10, 13, 10]}]}, {"base_deficit": 2.4285714285714306, "case": {"blocks": 4, "id": "k4-mask78-order9701", "mask": 78, "order_index": 9701}, "generated_profiles": [{"base": 98, "gamma": [20, 17, 14, 5]}, {"base": 67, "gamma": [11, 15, 12, 7]}, {"base": 87, "gamma": [16, 15, 18, 8]}, {"base": 66, "gamma": [10, 11, 9, 0]}, {"base": 144, "gamma": [30, 27, 24, 15]}, {"base": 106, "gamma": [14, 11, 15, 10]}, {"base": 113, "gamma": [11, 12, 13, 7]}, {"base": 178, "gamma": [18, 17, 16, 17]}]}, {"base_deficit": 1.5, "case": {"blocks": 5, "id": "k5-mask310-order4691", "mask": 310, "order_index": 4691}, "generated_profiles": [{"base": 91, "gamma": [21, 18, 12, 9, 0]}, {"base": 79, "gamma": [11, 15, 13, 10, 7]}, {"base": 92, "gamma": [15, 12, 5, 8, 11]}, {"base": 93, "gamma": [13, 14, 20, 0, 9]}, {"base": 149, "gamma": [29, 26, 20, 17, 8]}, {"base": 126, "gamma": [15, 12, 17, 18, 13]}, {"base": 117, "gamma": [11, 12, 14, 6, 9]}, {"base": 149, "gamma": [29, 26, 20, 17, 8]}]}, {"base_deficit": 1.5, "case": {"blocks": 6, "id": "k6-mask442-order5461", "mask": 442, "order_index": 5461}, "generated_profiles": [{"base": 89, "gamma": [22, 16, 13, 10, 4, 1]}, {"base": 68, "gamma": [6, 13, 10, 7, 7, 2]}, {"base": 63, "gamma": [9, 15, 5, 2, 4, 7]}, {"base": 96, "gamma": [11, 17, 20, 0, 6, 9]}, {"base": 155, "gamma": [30, 24, 21, 18, 12, 9]}, {"base": 203, "gamma": [19, 17, 21, 18, 16, 17]}, {"base": 120, "gamma": [11, 13, 14, 6, 8, 9]}, {"base": 108, "gamma": [9, 18, 15, 12, 6, 7]}]}], "graphs": [{"failures": 4, "feedback": true, "graph": "k4", "role": "train", "score": -4007.211904761905}, {"failures": 8, "feedback": true, "graph": "k5", "role": "train", "score": -8005.679004329004}, {"failures": 7, "feedback": true, "graph": "k6", "role": "train", "score": -7003.353186813187}, {"failures": 9, "feedback": true, "graph": "k7", "role": "train", "score": -9004.62849083162}, {"failures": 6, "feedback": true, "graph": "k8", "role": "train", "score": -6002.735524600847}], "interpretation": "Misses do not prove infeasibility; equal base threshold is insufficient. Every slope must be <=6.", "missed": 34, "score": -115657.60811133657}, "finish_reason": "stop", "focus": "k7", "graphs": [{"excess_T": null, "failures": 4, "gap_mean": null, "graph": "k4", "incomplete": null, "score": -4007.211904761905, "value_max": null}, {"excess_T": null, "failures": 8, "gap_mean": null, "graph": "k5", "incomplete": null, "score": -8005.679004329004, "value_max": null}, {"excess_T": null, "failures": 7, "gap_mean": null, "graph": "k6", "incomplete": null, "score": -7003.353186813187, "value_max": null}, {"excess_T": null, "failures": 9, "gap_mean": null, "graph": "k7", "incomplete": null, "score": -9004.62849083162, "value_max": null}, {"excess_T": null, "failures": 6, "gap_mean": null, "graph": "k8", "incomplete": null, "score": -6002.735524600847, "value_max": null}], "hash": "8fe5c8d067dfb868", "id": 1, "instances": {"k4": -4007.211904761905, "k5": -8005.679004329004, "k6": -7003.353186813187, "k7": -9004.62849083162, "k8": -6002.735524600847}, "island": 0, "kind": "mixture_policy", "llm_seconds": 9.53, "mode": "exploit", "model_reasoning": "The user wants me to return one JSON object with a mixture_policy. This is a research optimization task for constructing words to certify LRX families. I need to output a valid policy JSON based on th...", "model_text": "{\"kind\":\"mixture_policy\",\"name\":\"flat complementary adjacent inversion\",\"rules\":[{\"cuts\":[0,3,6,9],\"weights\":{\"rotation\":1,\"zero_rotation\":2,\"zero_swap\":-4,\"position\":1,\"rank_gap\":-2},\"direction\":\"shortest\",\"tie\":\"left\"},{\"cuts\":[0,5,8,12],\"weights\":{\"rotation\":2,\"zero_rotation\":-1,\"zero_swap\":3,\"position\":-2,\"rank_gap\":1},\"direction\":\"left\",\"tie\":\"right\"},{\"cuts\":[1,4,7,11],\"weights\":{\"rotation\":0,\"zero_rotation\":3,\"zero_swap\":-2,\"position\":2,\"rank_gap\":-3},\"direction\":\"right\",\"tie\":\"left\"},{\"cuts\":[0,2,8,14],\"weights\":{\"rotation\":1,\"zero_rotation\":0,\"zero_swap\":1,\"position\":-3,\"rank_gap\":2},\"direction\":\"shortest\",\"tie\":\"right\"},{\"cuts\":[0,6,10],\"weights\":{\"rotation\":3,\"zero_rotation\":-2,\"zero_swap\":-1,\"position\":1,\"rank_gap\":-1},\"direction\":\"left\",\"tie\":\"left\"},{\"cuts\":[2,5,9,13],\"weights\":{\"rotation\":-1,\"zero_rotation\":1,\"zero_swap\":4,\"position\":0,\"rank_gap\":-2},\"direction\":\"shortest\",\"tie\":\"left\"},{\"cuts\":[0,4,12],\"weights\":{\"rotation\":2,\"zero_rotation\":2,\"zero_swap\":-3,\"position\":-1,\"rank_gap\":0},\"direction\":\"right\",\"tie\":\"right\"},{\"cuts\":[1,8,15],\"weights\":{\"rotation\":1,\"zero_rotation\":-3,\"zero_swap\":2,\"position\":3,\"rank_gap\":1},\"direction\":\"shortest\",\"tie\":\"left\"}]}", "parents": [0], "prompt_messages": [{"content": "{\"task\": \"Improve a reusable word-construction policy to certify additional infinite LRX families.\", \"mode\": \"exploit\", \"parents\": [[{\"kind\": \"mixture_policy\", \"name\": \"nearest adjacent inversion, three cuts\", \"rules\": [{\"cuts\": [0, 4, 8], \"weights\": {\"rotation\": 1, \"zero_rotation\": 0, \"zero_swap\": 0, \"position\": 0, \"rank_gap\": 0}, \"direction\": \"shortest\", \"tie\": \"left\"}]}, {\"score\": -115657.60811133657, \"certified\": 0, \"missed\": 34, \"graphs\": [{\"graph\": \"k4\", \"score\": -4007.211904761905, \"failures\": 4, \"role\": \"train\", \"feedback\": true}, {\"graph\": \"k5\", \"score\": -8005.679004329004, \"failures\": 8, \"role\": \"train\", \"feedback\": true}, {\"graph\": \"k6\", \"score\": -7003.353186813187, \"failures\": 7, \"role\": \"train\", \"feedback\": true}, {\"graph\": \"k7\", \"score\": -9004.62849083162, \"failures\": 9, \"role\": \"train\", \"feedback\": true}, {\"graph\": \"k8\", \"score\": -6002.735524600847, \"failures\": 6, \"role\": \"train\", \"feedback\": true}], \"failures\": [{\"case\": {\"id\": \"k4-mask312-order21771\", \"mask\": 312, \"order_index\": 21771, \"blocks\": 4}, \"base_deficit\": 3.0, \"generated_profiles\": [{\"base\": 61, \"gamma\": [15, 12, 9, 2]}, {\"base\": 60, \"gamma\": [11, 9, 10, 7]}, {\"base\": 108, \"gamma\": [18, 21, 24, 10]}]}, {\"case\": {\"id\": \"k4-mask78-order9701\", \"mask\": 78, \"order_index\": 9701, \"blocks\": 4}, \"base_deficit\": 2.4285714285714306, \"generated_profiles\": [{\"base\": 94, \"gamma\": [19, 16, 13, 4]}, {\"base\": 86, \"gamma\": [11, 10, 14, 11]}, {\"base\": 73, \"gamma\": [11, 14, 17, 3]}]}, {\"case\": {\"id\": \"k5-mask310-order4691\", \"mask\": 310, \"order_index\": 4691, \"blocks\": 5}, \"base_deficit\": 1.5, \"generated_profiles\": [{\"base\": 90, \"gamma\": [20, 17, 11, 8, 1]}, {\"base\": 88, \"gamma\": [11, 10, 11, 14, 9]}, {\"base\": 97, \"gamma\": [9, 12, 18, 2, 9]}]}, {\"case\": {\"id\": \"k6-mask442-order5461\", \"mask\": 442, \"order_index\": 5461, \"blocks\": 6}, \"base_deficit\": 1.5, \"generated_profiles\": [{\"base\": 83, \"gamma\": [21, 15, 12, 9, 3, 2]}, {\"base\": 72, \"gamma\": [9, 12, 9, 6, 4, 7]}, {\"base\": 88, \"gamma\": [11, 15, 18, 2, 6, 9]}]}], \"interpretation\": \"Misses do not prove infeasibility; equal base threshold is insufficient. Every slope must be <=6.\"}]], \"engine_context\": {\"focus\": {\"graph\": \"k7\", \"parent_score\": -9004.62849083162, \"archive_best\": -9004.62849083162}}, \"unverified_hypotheses\": \"\", \"context_sha256\": \"83a280095959be0ee17113ba4e6fea85215d14e850cdceb1550146f143ccdbe3\"}", "role": "user"}], "prompt_system_sha": "5823c3ab836265bb", "proposal": 1, "proposer_error": null, "reasoning_tokens": 332, "repairs_used": null, "score": -115657.60811133657, "seconds": 0.3539232089824509, "spec": {"kind": "mixture_policy", "name": "flat complementary adjacent inversion", "rules": [{"cuts": [0, 3, 6, 9], "direction": "shortest", "tie": "left", "weights": {"position": 1, "rank_gap": -2, "rotation": 1, "zero_rotation": 2, "zero_swap": -4}}, {"cuts": [0, 5, 8, 12], "direction": "left", "tie": "right", "weights": {"position": -2, "rank_gap": 1, "rotation": 2, "zero_rotation": -1, "zero_swap": 3}}, {"cuts": [1, 4, 7, 11], "direction": "right", "tie": "left", "weights": {"position": 2, "rank_gap": -3, "rotation": 0, "zero_rotation": 3, "zero_swap": -2}}, {"cuts": [0, 2, 8, 14], "direction": "shortest", "tie": "right", "weights": {"position": -3, "rank_gap": 2, "rotation": 1, "zero_rotation": 0, "zero_swap": 1}}, {"cuts": [0, 6, 10], "direction": "left", "tie": "left", "weights": {"position": 1, "rank_gap": -1, "rotation": 3, "zero_rotation": -2, "zero_swap": -1}}, {"cuts": [2, 5, 9, 13], "direction": "shortest", "tie": "left", "weights": {"position": 0, "rank_gap": -2, "rotation": -1, "zero_rotation": 1, "zero_swap": 4}}, {"cuts": [0, 4, 12], "direction": "right", "tie": "right", "weights": {"position": -1, "rank_gap": 0, "rotation": 2, "zero_rotation": 2, "zero_swap": -3}}, {"cuts": [1, 8, 15], "direction": "shortest", "tie": "left", "weights": {"position": 3, "rank_gap": 1, "rotation": 1, "zero_rotation": -3, "zero_swap": 2}}]}, "status": "discard", "t": 9.99, "tactic": null, "tokens_in": 3127, "tokens_out": 767, "valid": true}
{"batch": 0, "best_id": 0, "best_score": -115657.60811133657, "completed": 1, "eval_seconds": 0.35, "event": "batch", "inflight": 0, "proposals": 1, "propose_seconds": 9.53, "requests": [{"explore_p": null, "focus": "k7", "island": 0, "mode": "exploit", "parents": [0], "proposal": 1, "tactic": null}], "since_improvement": 0, "strategy": {"focus": true, "history": 4, "inspiration_pool": "top", "inspirations": 1, "modes": {"exploit": 1.0}, "parent": "best", "tactic": null}, "t": 9.99, "usage": {"billing_verified": false, "estimated_usd": 0.009128, "failed_requests": 0, "input_tokens": 3127, "max_spend_usd": 2.0, "output_tokens": 767, "provider_costed_requests": 1, "requests": 1, "usage_overruns": 0}}
