{"attempts": null, "batch": 11, "context": ["history", "inspirations", "tactic"], "cost_source": "provider", "cost_usd": 0.015552, "event": "candidate", "explore_p": null, "feasible": false, "feedback": {"certified": 2, "failures": [{"base_deficit": 3.0, "case": {"blocks": 4, "id": "k4-mask312-order21771", "mask": 312, "order_index": 21771}, "generated_profiles": [{"base": 81, "gamma": [17, 18, 11, 4]}, {"base": 64, "gamma": [11, 9, 12, 7]}, {"base": 128, "gamma": [17, 20, 25, 13]}, {"base": 119, "gamma": [22, 19, 20, 11]}, {"base": 148, "gamma": [18, 18, 19, 14]}, {"base": 107, "gamma": [12, 13, 9, 8]}, {"base": 409, "gamma": [39, 38, 41, 38]}, {"base": 217, "gamma": [30, 33, 21, 22]}]}, {"base_deficit": 2.4285714285714306, "case": {"blocks": 4, "id": "k4-mask78-order9701", "mask": 78, "order_index": 9701}, "generated_profiles": [{"base": 102, "gamma": [23, 20, 17, 8]}, {"base": 98, "gamma": [15, 12, 16, 13]}, {"base": 105, "gamma": [13, 16, 19, 5]}, {"base": 168, "gamma": [31, 28, 25, 20]}, {"base": 96, "gamma": [14, 11, 15, 10]}, {"base": 96, "gamma": [10, 11, 15, 6]}, {"base": 199, "gamma": [19, 19, 18, 19]}, {"base": 287, "gamma": [36, 35, 38, 28]}]}, {"base_deficit": 1.5, "case": {"blocks": 5, "id": "k5-mask310-order4691", "mask": 310, "order_index": 4691}, "generated_profiles": [{"base": 98, "gamma": [22, 19, 13, 10, 1]}, {"base": 104, "gamma": [13, 12, 13, 16, 13]}, {"base": 99, "gamma": [13, 14, 20, 0, 9]}, {"base": 98, "gamma": [22, 19, 13, 10, 1]}, {"base": 149, "gamma": [29, 26, 20, 17, 8]}, {"base": 126, "gamma": [15, 12, 17, 18, 13]}, {"base": 115, "gamma": [11, 12, 14, 6, 9]}, {"base": 149, "gamma": [29, 26, 20, 17, 8]}]}, {"base_deficit": 1.5, "case": {"blocks": 6, "id": "k6-mask442-order5461", "mask": 442, "order_index": 5461}, "generated_profiles": [{"base": 109, "gamma": [25, 19, 14, 13, 7, 4]}, {"base": 104, "gamma": [12, 13, 12, 11, 9, 10]}, {"base": 110, "gamma": [14, 18, 21, 1, 7, 10]}, {"base": 90, "gamma": [10, 15, 10, 7, 5, 6]}, {"base": 233, "gamma": [34, 32, 29, 26, 20, 17]}, {"base": 203, "gamma": [19, 17, 21, 18, 16, 17]}, {"base": 120, "gamma": [11, 13, 14, 6, 8, 9]}, {"base": 147, "gamma": [29, 23, 20, 17, 11, 8]}]}], "graphs": [{"failures": 4, "feedback": true, "graph": "k4", "role": "train", "score": -4007.211904761905}, {"failures": 6, "feedback": true, "graph": "k5", "role": "train", "score": -6004.215079365079}, {"failures": 7, "feedback": true, "graph": "k6", "role": "train", "score": -7003.353186813187}, {"failures": 9, "feedback": true, "graph": "k7", "role": "train", "score": -9004.62849083162}, {"failures": 6, "feedback": true, "graph": "k8", "role": "train", "score": -6002.658464941756}], "interpretation": "Misses do not prove infeasibility; equal base threshold is insufficient. Every slope must be <=6.", "missed": 32, "score": -108854.06712671355}, "finish_reason": "stop", "focus": null, "graphs": [{"excess_T": null, "failures": 4, "gap_mean": null, "graph": "k4", "incomplete": null, "score": -4007.211904761905, "value_max": null}, {"excess_T": null, "failures": 6, "gap_mean": null, "graph": "k5", "incomplete": null, "score": -6004.215079365079, "value_max": null}, {"excess_T": null, "failures": 7, "gap_mean": null, "graph": "k6", "incomplete": null, "score": -7003.353186813187, "value_max": null}, {"excess_T": null, "failures": 9, "gap_mean": null, "graph": "k7", "incomplete": null, "score": -9004.62849083162, "value_max": null}, {"excess_T": null, "failures": 6, "gap_mean": null, "graph": "k8", "incomplete": null, "score": -6002.658464941756, "value_max": null}], "hash": "8d910ad5a5934b91", "id": 12, "instances": {"k4": -4007.211904761905, "k5": -6004.215079365079, "k6": -7003.353186813187, "k7": -9004.62849083162, "k8": -6002.658464941756}, "island": 0, "kind": "mixture_policy", "llm_seconds": 12.08, "mode": "exploit", "model_reasoning": "The user wants me to return one JSON object with a mixture_policy specification. This is a research optimization task for combinatorial word construction policies, not a disallowed request. I should p...", "model_text": "{\"kind\":\"mixture_policy\",\"name\":\"split-phase complementary slope and base adjacent inversion\",\"rules\":[{\"cuts\":[0,4,8,12],\"weights\":{\"rotation\":1,\"zero_rotation\":-2,\"zero_swap\":0,\"position\":1,\"rank_gap\":-4},\"direction\":\"shortest\",\"tie\":\"left\"},{\"cuts\":[1,5,9,13],\"weights\":{\"rotation\":2,\"zero_rotation\":3,\"zero_swap\":-1,\"position\":-2,\"rank_gap\":2},\"direction\":\"left\",\"tie\":\"right\"},{\"cuts\":[2,6,10,14],\"weights\":{\"rotation\":0,\"zero_rotation\":-3,\"zero_swap\":2,\"position\":2,\"rank_gap\":-1},\"direction\":\"right\",\"tie\":\"left\"},{\"cuts\":[3,7,11,15],\"weights\":{\"rotation\":3,\"zero_rotation\":1,\"zero_swap\":-2,\"position\":-1,\"rank_gap\":4},\"direction\":\"shortest\",\"tie\":\"right\"},{\"cuts\":[0,6,11],\"weights\":{\"rotation\":-1,\"zero_rotation\":4,\"zero_swap\":1,\"position\":0,\"rank_gap\":-3},\"direction\":\"left\",\"tie\":\"left\"},{\"cuts\":[1,8,14],\"weights\":{\"rotation\":1,\"zero_rotation\":-4,\"zero_swap\":3,\"position\":-3,\"rank_gap\":1},\"direction\":\"right\",\"tie\":\"right\"},{\"cuts\":[2,9,16],\"weights\":{\"rotation\":4,\"zero_rotation\":2,\"zero_swap\":-3,\"position\":3,\"rank_gap\":0},\"direction\":\"shortest\",\"tie\":\"left\"},{\"cuts\":[0,5,10,15],\"weights\":{\"rotation\":2,\"zero_rotation\":0,\"zero_swap\":4,\"position\":-1,\"rank_gap\":-2},\"direction\":\"shortest\",\"tie\":\"right\"}]}", "parents": [9], "prompt_messages": [{"content": "{\"task\": \"Improve a reusable word-construction policy to certify additional infinite LRX families.\", \"mode\": \"exploit\", \"parents\": [[{\"kind\": \"mixture_policy\", \"name\": \"odd-stagger flat-gap complementary adjacent inversion\", \"rules\": [{\"cuts\": [0, 5, 10, 15], \"weights\": {\"rotation\": 1, \"zero_rotation\": 2, \"zero_swap\": -2, \"position\": -1, \"rank_gap\": 3}, \"direction\": \"shortest\", \"tie\": \"left\"}, {\"cuts\": [1, 4, 9, 14], \"weights\": {\"rotation\": 2, \"zero_rotation\": -2, \"zero_swap\": 1, \"position\": 2, \"rank_gap\": -3}, \"direction\": \"right\", \"tie\": \"left\"}, {\"cuts\": [2, 7, 11], \"weights\": {\"rotation\": 0, \"zero_rotation\": 3, \"zero_swap\": -1, \"position\": -2, \"rank_gap\": 2}, \"direction\": \"left\", \"tie\": \"right\"}, {\"cuts\": [3, 6, 12, 16], \"weights\": {\"rotation\": 3, \"zero_rotation\": 1, \"zero_swap\": 0, \"position\": 1, \"rank_gap\": -2}, \"direction\": \"shortest\", \"tie\": \"right\"}, {\"cuts\": [0, 7, 13], \"weights\": {\"rotation\": -2, \"zero_rotation\": 4, \"zero_swap\": 2, \"position\": 0, \"rank_gap\": 1}, \"direction\": \"left\", \"tie\": \"left\"}, {\"cuts\": [1, 8, 12], \"weights\": {\"rotation\": 1, \"zero_rotation\": -3, \"zero_swap\": 4, \"position\": -4, \"rank_gap\": -1}, \"direction\": \"shortest\", \"tie\": \"right\"}, {\"cuts\": [4, 9, 14], \"weights\": {\"rotation\": 2, \"zero_rotation\": 0, \"zero_swap\": -4, \"position\": 3, \"rank_gap\": 4}, \"direction\": \"right\", \"tie\": \"left\"}, {\"cuts\": [0, 6, 11, 16], \"weights\": {\"rotation\": 4, \"zero_rotation\": -1, \"zero_swap\": 1, \"position\": -1, \"rank_gap\": 0}, \"direction\": \"shortest\", \"tie\": \"left\"}]}, {\"score\": -105450.012092961, \"certified\": 3, \"missed\": 31, \"graphs\": [{\"graph\": \"k4\", \"score\": -4004.8690476190477, \"failures\": 4, \"role\": \"train\", \"feedback\": true}, {\"graph\": \"k5\", \"score\": -7005.359340154795, \"failures\": 7, \"role\": \"train\", \"feedback\": true}, {\"graph\": \"k6\", \"score\": -7003.254285714285, \"failures\": 7, \"role\": \"train\", \"feedback\": true}, {\"graph\": \"k7\", \"score\": -7002.793894872023, \"failures\": 7, \"role\": \"train\", \"feedback\": true}, {\"graph\": \"k8\", \"score\": -6002.735524600847, \"failures\": 6, \"role\": \"train\", \"feedback\": true}], \"failures\": [{\"case\": {\"id\": \"k4-mask78-order9701\", \"mask\": 78, \"order_index\": 9701, \"blocks\": 4}, \"base_deficit\": 2.4285714285714306, \"generated_profiles\": [{\"base\": 108, \"gamma\": [20, 17, 14, 5]}, {\"base\": 76, \"gamma\": [18, 15, 9, 6]}, {\"base\": 66, \"gamma\": [10, 13, 9, 0]}, {\"base\": 71, \"gamma\": [11, 15, 12, 9]}, {\"base\": 178, \"gamma\": [18, 17, 16, 17]}, {\"base\": 154, \"gamma\": [22, 21, 17, 18]}, {\"base\": 120, \"gamma\": [16, 19, 11, 8]}, {\"base\": 103, \"gamma\": [11, 11, 10, 11]}]}, {\"case\": {\"id\": \"k5-mask310-order4691\", \"mask\": 310, \"order_index\": 4691, \"blocks\": 5}, \"base_deficit\": 1.5, \"generated_profiles\": [{\"base\": 103, \"gamma\": [21, 18, 12, 9, 2]}, {\"base\": 92, \"gamma\": [11, 10, 13, 12, 9]}, {\"base\": 77, \"gamma\": [8, 11, 8, 3, 6]}, {\"base\": 102, \"gamma\": [6, 14, 16, 13, 4]}, {\"base\": 137, \"gamma\": [15, 14, 12, 11, 8]}, {\"base\": 178, \"gamma\": [23, 22, 17, 20, 21]}, {\"base\": 180, \"gamma\": [22, 25, 31, 11, 20]}, {\"base\": 143, \"gamma\": [11, 23, 21, 18, 9]}]}, {\"case\": {\"id\": \"k6-mask442-order5461\", \"mask\": 442, \"order_index\": 5461, \"blocks\": 6}, \"base_deficit\": 1.5, \"generated_profiles\": [{\"base\": 85, \"gamma\": [22, 16, 13, 10, 4, 1]}, {\"base\": 107, \"gamma\": [10, 14, 12, 9, 7, 8]}, {\"base\": 83, \"gamma\": [6, 14, 8, 5, 3, 4]}, {\"base\": 131, \"gamma\": [23, 19, 16, 13, 7, 4]}, {\"base\": 249, \"gamma\": [21, 23, 22, 21, 19, 18]}, {\"base\": 128, \"gamma\": [16, 11, 10, 9, 11, 14]}, {\"base\": 202, \"gamma\": [23, 29, 32, 12, 18, 21]}, {\"base\": 127, \"gamma\": [14, 12, 11, 10, 8, 7]}]}, {\"case\": {\"id\": \"k5-mask357-order10564\", \"mask\": 357, \"order_index\": 10564, \"blocks\": 5}, \"base_deficit\": 1.4444444444444429, \"generated_profiles\": [{\"base\": 80, \"gamma\": [25, 19, 10, 7, 1]}, {\"base\": 109, \"gamma\": [11, 15, 11, 8, 10]}, {\"base\": 68, \"gamma\": [6, 10, 4, 1, 5]}, {\"base\": 119, \"gamma\": [8, 23, 16, 13, 7]}, {\"base\": 174, \"gamma\": [13, 20, 17, 16, 14]}, {\"base\": 174, \"gamma\": [16, 22, 20, 19, 17]}, {\"base\": 111, \"gamma\": [13, 19, 9, 8, 14]}, {\"base\": 188, \"gamma\": [17, 30, 25, 22, 16]}]}], \"interpretation\": \"Misses do not prove infeasibility; equal base threshold is insufficient. Every slope must be <=6.\"}]], \"engine_context\": {\"history\": [{\"id\": 11, \"mode\": \"exploit\", \"parents\": [8], \"status\": \"discard\", \"score\": -112256.38588911435, \"parent_score\": -108852.76455282167, \"problem_graphs\": [{\"graph\": \"k4\", \"score\": -4007.211904761905, \"failures\": 4}, {\"graph\": \"k5\", \"score\": -7005.456782106782, \"failures\": 7}, {\"graph\": \"k6\", \"score\": -7003.353186813187, \"failures\": 7}, {\"graph\": \"k7\", \"score\": -9004.62849083162, \"failures\": 9}]}, {\"id\": 10, \"mode\": \"exploit\", \"parents\": [9], \"status\": \"discard\", \"score\": -115656.22562341386, \"parent_score\": -105450.012092961, \"problem_graphs\": [{\"graph\": \"k4\", \"score\": -4007.211904761905, \"failures\": 4}, {\"graph\": \"k5\", \"score\": -8004.33455988456, \"failures\": 8}, {\"graph\": \"k6\", \"score\": -7003.353186813187, \"failures\": 7}, {\"graph\": \"k7\", \"score\": -9004.590447353357, \"failures\": 9}]}, {\"id\": 9, \"mode\": \"exploit\", \"parents\": [5], \"status\": \"discard\", \"score\": -105450.012092961, \"parent_score\": -102048.48907522252, \"problem_graphs\": [{\"graph\": \"k4\", \"score\": -4004.8690476190477, \"failures\": 4}, {\"graph\": \"k5\", \"score\": -7005.359340154795, \"failures\": 7}, {\"graph\": \"k6\", \"score\": -7003.254285714285, \"failures\": 7}, {\"graph\": \"k7\", \"score\": -7002.793894872023, \"failures\": 7}], \"focus\": \"k7\"}, {\"id\": 8, \"mode\": \"exploit\", \"parents\": [5], \"status\": \"discard\", \"score\": -108852.76455282167, \"parent_score\": -102048.48907522252, \"problem_graphs\": [{\"graph\": \"k4\", \"score\": -4007.211904761905, \"failures\": 4}, {\"graph\": \"k5\", \"score\": -7003.842352092352, \"failures\": 7}, {\"graph\": \"k6\", \"score\": -7003.284897959184, \"failures\": 7}, {\"graph\": \"k7\", \"score\": -9003.756540074042, \"failures\": 9}], \"focus\": \"k7\"}, {\"id\": 7, \"mode\": \"exploit\", \"parents\": [5], \"status\": \"discard\", \"score\": -108855.51287324133, \"parent_score\": -102048.48907522252, \"problem_graphs\": [{\"graph\": \"k4\", \"score\": -4007.211904761905, \"failures\": 4}, {\"graph\": \"k5\", \"score\": -7005.650432900433, \"failures\": 7}, {\"graph\": \"k6\", \"score\": -7003.353186813187, \"failures\": 7}, {\"graph\": \"k7\", \"score\": -9004.62849083162, \"failures\": 9}], \"focus\": \"k7\"}, {\"id\": 6, \"mode\": \"exploit\", \"parents\": [5], \"status\": \"discard\", \"score\": -108853.62533355878, \"parent_score\": -102048.48907522252, \"problem_graphs\": [{\"graph\": \"k4\", \"score\": -4007.211904761905, \"failures\": 4}, {\"graph\": \"k5\", \"score\": -8005.2345598845595, \"failures\": 8}, {\"graph\": \"k6\", \"score\": -7003.353186813187, \"failures\": 7}, {\"graph\": \"k7\", \"score\": -8003.156824164952, \"failures\": 8}], \"focus\": \"k8\"}], \"inspirations\": [{\"id\": 5, \"score\": -102048.48907522252, \"graph_scores\": {\"k4\": -4004.7166666666667, \"k5\": -6004.1150793650795, \"k6\": -6002.853186813187, \"k7\": -9004.135284443411, \"k8\": -5002.668857934181}, \"spec\": {\"kind\": \"mixture_policy\", \"name\": \"even-cut low-gap complementary adjacent inversion\", \"rules\": [{\"cuts\": [0, 4, 8, 12], \"weights\": {\"rotation\": 1, \"zero_rotation\": 1, \"zero_swap\": 0, \"position\": 2, \"rank_gap\": -1}, \"direction\": \"shortest\", \"tie\": \"left\"}, {\"cuts\": [1, 5, 9, 13], \"weights\": {\"rotation\": 1, \"zero_rotation\": -1, \"zero_swap\": 2, \"position\": -2, \"rank_gap\": 1}, \"direction\": \"left\", \"tie\": \"right\"}, {\"cuts\": [2, 6, 10, 14], \"weights\": {\"rotation\": 0, \"zero_rotation\": 2, \"zero_swap\": -2, \"position\": 1, \"rank_gap\": -1}, \"direction\": \"right\", \"tie\": \"left\"}, {\"cuts\": [0, 3, 6, 10], \"weights\": {\"rotation\": 2, \"zero_rotation\": 0, \"zero_swap\": 1, \"position\": -1, \"rank_gap\": 0}, \"direction\": \"shortest\", \"tie\": \"right\"}, {\"cuts\": [0, 5, 11], \"weights\": {\"rotation\": -1, \"zero_rotation\": 3, \"zero_swap\": -1, \"position\": 0, \"rank_gap\": -2}, \"direction\": \"left\", \"tie\": \"left\"}, {\"cuts\": [1, 7, 12], \"weights\": {\"rotation\": 2, \"zero_rotation\": -2, \"zero_swap\": 3, \"position\": -3, \"rank_gap\": 2}, \"direction\": \"shortest\", \"tie\": \"left\"}, {\"cuts\": [3, 8, 13, 16], \"weights\": {\"rotation\": 1, \"zero_rotation\": 1, \"zero_swap\": -3, \"position\": 3, \"rank_gap\": -1}, \"direction\": \"right\", \"tie\": \"right\"}, {\"cuts\": [0, 2, 8, 15], \"weights\": {\"rotation\": 3, \"zero_rotation\": -1, \"zero_swap\": 1, \"position\": 1, \"rank_gap\": 0}, \"direction\": \"shortest\", \"tie\": \"left\"}]}}, {\"id\": 6, \"score\": -108853.62533355878, \"graph_scores\": {\"k4\": -4007.211904761905, \"k5\": -8005.2345598845595, \"k6\": -7003.353186813187, \"k7\": -8003.156824164952, \"k8\": -5002.668857934181}, \"spec\": {\"kind\": \"mixture_policy\", \"name\": \"odd-phase flat-slope complementary adjacent inversion\", \"rules\": [{\"cuts\": [0, 5, 9, 14], \"weights\": {\"rotation\": 1, \"zero_rotation\": 2, \"zero_swap\": -2, \"position\": -1, \"rank_gap\": -3}, \"direction\": \"shortest\", \"tie\": \"right\"}, {\"cuts\": [1, 4, 8, 13], \"weights\": {\"rotation\": 2, \"zero_rotation\": -1, \"zero_swap\": 3, \"position\": 1, \"rank_gap\": 2}, \"direction\": \"left\", \"tie\": \"left\"}, {\"cuts\": [2, 7, 11, 16], \"weights\": {\"rotation\": 0, \"zero_rotation\": 3, \"zero_swap\": -1, \"position\": -2, \"rank_gap\": -2}, \"direction\": \"right\", \"tie\": \"right\"}, {\"cuts\": [0, 3, 8, 12], \"weights\": {\"rotation\": 3, \"zero_rotation\": 0, \"zero_swap\": 2, \"position\": 2, \"rank_gap\": -1}, \"direction\": \"shortest\", \"tie\": \"left\"}, {\"cuts\": [1, 6, 10], \"weights\": {\"rotation\": -2, \"zero_rotation\": 4, \"zero_swap\": 1, \"position\": 0, \"rank_gap\": -4}, \"direction\": \"left\", \"tie\": \"right\"}, {\"cuts\": [0, 6, 11, 15], \"weights\": {\"rotation\": 2, \"zero_rotation\": -2, \"zero_swap\": -3, \"position\": 3, \"rank_gap\": 1}, \"direction\": \"shortest\", \"tie\": \"left\"}, {\"cuts\": [3, 7, 12], \"weights\": {\"rotation\": 1, \"zero_rotation\": 1, \"zero_swap\": 4, \"position\": -3, \"rank_gap\": 0}, \"direction\": \"right\", \"tie\": \"left\"}, {\"cuts\": [0, 2, 9, 16], \"weights\": {\"rotation\": 4, \"zero_rotation\": -3, \"zero_swap\": 0, \"position\": 1, \"rank_gap\": -2}, \"direction\": \"shortest\", \"tie\": \"right\"}]}}], \"tactic\": {\"idea\": \"Plateaued pure exploit of the best even-cut policy; discarded children raised failures. Prefer complementary slope profiles over shorter words. Mutate cuts, rank_gap sign, and zero_rotation independently so some rules suppress high-gamma blocks while others cut base. Merge only rules whose gamma peaks sit on different blocks. Do not retune a single low-base word. A miss is not infeasibility.\"}}, \"unverified_hypotheses\": \"\", \"context_sha256\": \"83a280095959be0ee17113ba4e6fea85215d14e850cdceb1550146f143ccdbe3\"}", "role": "user"}], "prompt_system_sha": "5823c3ab836265bb", "proposal": 12, "proposer_error": null, "reasoning_tokens": 570, "repairs_used": null, "score": -108854.06712671355, "seconds": 0.3439727920049336, "spec": {"kind": "mixture_policy", "name": "split-phase complementary slope and base adjacent inversion", "rules": [{"cuts": [0, 4, 8, 12], "direction": "shortest", "tie": "left", "weights": {"position": 1, "rank_gap": -4, "rotation": 1, "zero_rotation": -2, "zero_swap": 0}}, {"cuts": [1, 5, 9, 13], "direction": "left", "tie": "right", "weights": {"position": -2, "rank_gap": 2, "rotation": 2, "zero_rotation": 3, "zero_swap": -1}}, {"cuts": [2, 6, 10, 14], "direction": "right", "tie": "left", "weights": {"position": 2, "rank_gap": -1, "rotation": 0, "zero_rotation": -3, "zero_swap": 2}}, {"cuts": [3, 7, 11, 15], "direction": "shortest", "tie": "right", "weights": {"position": -1, "rank_gap": 4, "rotation": 3, "zero_rotation": 1, "zero_swap": -2}}, {"cuts": [0, 6, 11], "direction": "left", "tie": "left", "weights": {"position": 0, "rank_gap": -3, "rotation": -1, "zero_rotation": 4, "zero_swap": 1}}, {"cuts": [1, 8, 14], "direction": "right", "tie": "right", "weights": {"position": -3, "rank_gap": 1, "rotation": 1, "zero_rotation": -4, "zero_swap": 3}}, {"cuts": [2, 9, 16], "direction": "shortest", "tie": "left", "weights": {"position": 3, "rank_gap": 0, "rotation": 4, "zero_rotation": 2, "zero_swap": -3}}, {"cuts": [0, 5, 10, 15], "direction": "shortest", "tie": "right", "weights": {"position": -1, "rank_gap": -2, "rotation": 2, "zero_rotation": 0, "zero_swap": 4}}]}, "status": "discard", "t": 154.95, "tactic": null, "tokens_in": 6378, "tokens_out": 1010, "valid": true}
{"batch": 11, "best_id": 5, "best_score": -102048.48907522252, "completed": 12, "eval_seconds": 0.34, "event": "batch", "inflight": 0, "proposals": 12, "propose_seconds": 12.08, "requests": [{"explore_p": null, "focus": null, "island": 0, "mode": "exploit", "parents": [9], "proposal": 12, "tactic": null}], "since_improvement": 6, "strategy": {"focus": false, "history": 6, "inspiration_pool": "random", "inspirations": 2, "modes": {"edit": 0.25, "exploit": 0.15, "explore": 0.45, "merge": 0.15}, "parent": "top3", "tactic": "Plateaued pure exploit of the best even-cut policy; discarded children raised failures. Prefer complementary slope profiles over shorter words. Mutate cuts, rank_gap sign, and zero_rotation independently so some rules suppress high-gamma blocks while others cut base. Merge only rules whose gamma peaks sit on different blocks. Do not retune a single low-base word. A miss is not infeasibility."}, "t": 154.95, "usage": {"billing_verified": false, "estimated_usd": 0.181528, "failed_requests": 0, "input_tokens": 68543, "max_spend_usd": 2.0, "output_tokens": 11631, "provider_costed_requests": 13, "requests": 13, "usage_overruns": 0}}
{"J": 0.0, "delta": 0.0, "end": -102048.48907522252, "event": "strategy_window", "proposals": 12, "start": -102048.48907522252, "strategy": {"focus": false, "history": 6, "inspiration_pool": "random", "inspirations": 2, "modes": {"edit": 0.25, "exploit": 0.15, "explore": 0.45, "merge": 0.15}, "parent": "top3", "tactic": "Plateaued pure exploit of the best even-cut policy; discarded children raised failures. Prefer complementary slope profiles over shorter words. Mutate cuts, rank_gap sign, and zero_rotation independently so some rules suppress high-gamma blocks while others cut base. Merge only rules whose gamma peaks sit on different blocks. Do not retune a single low-base word. A miss is not infeasibility."}, "t": 154.96}
{"event": "end", "stop_reason": "max_proposals", "t": 154.97, "usage": {"billing_verified": false, "estimated_usd": 0.181528, "failed_requests": 0, "input_tokens": 68543, "max_spend_usd": 2.0, "output_tokens": 11631, "provider_costed_requests": 13, "requests": 13, "usage_overruns": 0}}
