{"attempts": null, "batch": 7, "context": ["focus", "history", "inspirations"], "cost_source": "provider", "cost_usd": 0.015678, "event": "candidate", "explore_p": null, "feasible": false, "feedback": {"certified": 2, "failures": [{"base_deficit": 3.0, "case": {"blocks": 4, "id": "k4-mask312-order21771", "mask": 312, "order_index": 21771}, "generated_profiles": [{"base": 65, "gamma": [16, 11, 8, 1]}, {"base": 68, "gamma": [11, 9, 10, 7]}, {"base": 89, "gamma": [15, 18, 4, 7]}, {"base": 75, "gamma": [15, 12, 15, 6]}, {"base": 119, "gamma": [22, 19, 20, 11]}, {"base": 95, "gamma": [12, 13, 13, 8]}, {"base": 119, "gamma": [23, 20, 17, 8]}, {"base": 125, "gamma": [23, 20, 21, 12]}]}, {"base_deficit": 2.4285714285714306, "case": {"blocks": 4, "id": "k4-mask78-order9701", "mask": 78, "order_index": 9701}, "generated_profiles": [{"base": 100, "gamma": [21, 18, 15, 6]}, {"base": 86, "gamma": [13, 10, 14, 9]}, {"base": 68, "gamma": [9, 12, 10, 1]}, {"base": 120, "gamma": [23, 20, 17, 12]}, {"base": 176, "gamma": [32, 29, 26, 21]}, {"base": 135, "gamma": [17, 14, 15, 13]}, {"base": 105, "gamma": [9, 21, 18, 9]}, {"base": 121, "gamma": [15, 23, 20, 15]}]}, {"base_deficit": 1.5, "case": {"blocks": 5, "id": "k5-mask310-order4691", "mask": 310, "order_index": 4691}, "generated_profiles": [{"base": 95, "gamma": [21, 18, 12, 9, 2]}, {"base": 85, "gamma": [10, 9, 12, 13, 8]}, {"base": 101, "gamma": [11, 14, 18, 2, 7]}, {"base": 141, "gamma": [29, 26, 20, 17, 8]}, {"base": 152, "gamma": [17, 14, 15, 16, 15]}, {"base": 98, "gamma": [8, 20, 14, 11, 6]}, {"base": 163, "gamma": [13, 25, 23, 20, 11]}, {"base": 150, "gamma": [14, 14, 16, 15, 12]}]}, {"base_deficit": 1.5, "case": {"blocks": 6, "id": "k6-mask442-order5461", "mask": 442, "order_index": 5461}, "generated_profiles": [{"base": 83, "gamma": [21, 15, 12, 9, 3, 2]}, {"base": 78, "gamma": [10, 13, 10, 7, 5, 8]}, {"base": 94, "gamma": [10, 18, 19, 1, 5, 8]}, {"base": 83, "gamma": [21, 15, 12, 9, 3, 2]}, {"base": 233, "gamma": [34, 32, 29, 26, 20, 17]}, {"base": 91, "gamma": [9, 11, 11, 8, 6, 7]}, {"base": 108, "gamma": [9, 18, 15, 12, 6, 7]}, {"base": 190, "gamma": [16, 19, 18, 17, 15, 14]}]}], "graphs": [{"failures": 4, "feedback": true, "graph": "k4", "role": "train", "score": -4007.211904761905}, {"failures": 7, "feedback": true, "graph": "k5", "role": "train", "score": -7003.842352092352}, {"failures": 7, "feedback": true, "graph": "k6", "role": "train", "score": -7003.284897959184}, {"failures": 9, "feedback": true, "graph": "k7", "role": "train", "score": -9003.756540074042}, {"failures": 5, "feedback": true, "graph": "k8", "role": "train", "score": -5002.668857934181}], "interpretation": "Misses do not prove infeasibility; equal base threshold is insufficient. Every slope must be <=6.", "missed": 32, "score": -108852.76455282167}, "finish_reason": "stop", "focus": "k7", "graphs": [{"excess_T": null, "failures": 4, "gap_mean": null, "graph": "k4", "incomplete": null, "score": -4007.211904761905, "value_max": null}, {"excess_T": null, "failures": 7, "gap_mean": null, "graph": "k5", "incomplete": null, "score": -7003.842352092352, "value_max": null}, {"excess_T": null, "failures": 7, "gap_mean": null, "graph": "k6", "incomplete": null, "score": -7003.284897959184, "value_max": null}, {"excess_T": null, "failures": 9, "gap_mean": null, "graph": "k7", "incomplete": null, "score": -9003.756540074042, "value_max": null}, {"excess_T": null, "failures": 5, "gap_mean": null, "graph": "k8", "incomplete": null, "score": -5002.668857934181, "value_max": null}], "hash": "9a87e433b00bb552", "id": 8, "instances": {"k4": -4007.211904761905, "k5": -7003.842352092352, "k6": -7003.284897959184, "k7": -9003.756540074042, "k8": -5002.668857934181}, "island": 0, "kind": "mixture_policy", "llm_seconds": 10.81, "mode": "exploit", "model_reasoning": "The user wants me to return one JSON object that is a mixture_policy. This is a research optimization task about combinatorial word construction for LRX families. It's not a disallowed request - it's ...", "model_text": "{\"kind\":\"mixture_policy\",\"name\":\"flat-slope staggered complementary adjacent inversion\",\"rules\":[{\"cuts\":[0,4,9,13],\"weights\":{\"rotation\":1,\"zero_rotation\":2,\"zero_swap\":-1,\"position\":-2,\"rank_gap\":1},\"direction\":\"shortest\",\"tie\":\"left\"},{\"cuts\":[1,6,11,15],\"weights\":{\"rotation\":2,\"zero_rotation\":-1,\"zero_swap\":1,\"position\":1,\"rank_gap\":-2},\"direction\":\"left\",\"tie\":\"right\"},{\"cuts\":[2,5,10,14],\"weights\":{\"rotation\":0,\"zero_rotation\":3,\"zero_swap\":-2,\"position\":2,\"rank_gap\":1},\"direction\":\"right\",\"tie\":\"left\"},{\"cuts\":[0,3,7,12],\"weights\":{\"rotation\":3,\"zero_rotation\":0,\"zero_swap\":2,\"position\":-1,\"rank_gap\":-1},\"direction\":\"shortest\",\"tie\":\"right\"},{\"cuts\":[1,8,16],\"weights\":{\"rotation\":-1,\"zero_rotation\":2,\"zero_swap\":0,\"position\":-3,\"rank_gap\":2},\"direction\":\"left\",\"tie\":\"left\"},{\"cuts\":[0,6,10],\"weights\":{\"rotation\":1,\"zero_rotation\":-2,\"zero_swap\":3,\"position\":0,\"rank_gap\":-3},\"direction\":\"shortest\",\"tie\":\"right\"},{\"cuts\":[3,8,12,16],\"weights\":{\"rotation\":2,\"zero_rotation\":1,\"zero_swap\":-3,\"position\":3,\"rank_gap\":0},\"direction\":\"right\",\"tie\":\"left\"},{\"cuts\":[2,7,11],\"weights\":{\"rotation\":4,\"zero_rotation\":-1,\"zero_swap\":1,\"position\":1,\"rank_gap\":1},\"direction\":\"shortest\",\"tie\":\"left\"}]}", "parents": [5], "prompt_messages": [{"content": "{\"task\": \"Improve a reusable word-construction policy to certify additional infinite LRX families.\", \"mode\": \"exploit\", \"parents\": [[{\"kind\": \"mixture_policy\", \"name\": \"even-cut low-gap complementary adjacent inversion\", \"rules\": [{\"cuts\": [0, 4, 8, 12], \"weights\": {\"rotation\": 1, \"zero_rotation\": 1, \"zero_swap\": 0, \"position\": 2, \"rank_gap\": -1}, \"direction\": \"shortest\", \"tie\": \"left\"}, {\"cuts\": [1, 5, 9, 13], \"weights\": {\"rotation\": 1, \"zero_rotation\": -1, \"zero_swap\": 2, \"position\": -2, \"rank_gap\": 1}, \"direction\": \"left\", \"tie\": \"right\"}, {\"cuts\": [2, 6, 10, 14], \"weights\": {\"rotation\": 0, \"zero_rotation\": 2, \"zero_swap\": -2, \"position\": 1, \"rank_gap\": -1}, \"direction\": \"right\", \"tie\": \"left\"}, {\"cuts\": [0, 3, 6, 10], \"weights\": {\"rotation\": 2, \"zero_rotation\": 0, \"zero_swap\": 1, \"position\": -1, \"rank_gap\": 0}, \"direction\": \"shortest\", \"tie\": \"right\"}, {\"cuts\": [0, 5, 11], \"weights\": {\"rotation\": -1, \"zero_rotation\": 3, \"zero_swap\": -1, \"position\": 0, \"rank_gap\": -2}, \"direction\": \"left\", \"tie\": \"left\"}, {\"cuts\": [1, 7, 12], \"weights\": {\"rotation\": 2, \"zero_rotation\": -2, \"zero_swap\": 3, \"position\": -3, \"rank_gap\": 2}, \"direction\": \"shortest\", \"tie\": \"left\"}, {\"cuts\": [3, 8, 13, 16], \"weights\": {\"rotation\": 1, \"zero_rotation\": 1, \"zero_swap\": -3, \"position\": 3, \"rank_gap\": -1}, \"direction\": \"right\", \"tie\": \"right\"}, {\"cuts\": [0, 2, 8, 15], \"weights\": {\"rotation\": 3, \"zero_rotation\": -1, \"zero_swap\": 1, \"position\": 1, \"rank_gap\": 0}, \"direction\": \"shortest\", \"tie\": \"left\"}]}, {\"score\": -102048.48907522252, \"certified\": 4, \"missed\": 30, \"graphs\": [{\"graph\": \"k4\", \"score\": -4004.7166666666667, \"failures\": 4, \"role\": \"train\", \"feedback\": true}, {\"graph\": \"k5\", \"score\": -6004.1150793650795, \"failures\": 6, \"role\": \"train\", \"feedback\": true}, {\"graph\": \"k6\", \"score\": -6002.853186813187, \"failures\": 6, \"role\": \"train\", \"feedback\": true}, {\"graph\": \"k7\", \"score\": -9004.135284443411, \"failures\": 9, \"role\": \"train\", \"feedback\": true}, {\"graph\": \"k8\", \"score\": -5002.668857934181, \"failures\": 5, \"role\": \"train\", \"feedback\": true}], \"failures\": [{\"case\": {\"id\": \"k4-mask78-order9701\", \"mask\": 78, \"order_index\": 9701, \"blocks\": 4}, \"base_deficit\": 2.4285714285714306, \"generated_profiles\": [{\"base\": 94, \"gamma\": [20, 17, 14, 5]}, {\"base\": 88, \"gamma\": [14, 13, 13, 8]}, {\"base\": 95, \"gamma\": [12, 15, 18, 4]}, {\"base\": 176, \"gamma\": [32, 29, 26, 21]}, {\"base\": 108, \"gamma\": [15, 12, 16, 11]}, {\"base\": 96, \"gamma\": [10, 11, 15, 6]}, {\"base\": 103, \"gamma\": [11, 11, 10, 11]}, {\"base\": 129, \"gamma\": [23, 22, 25, 15]}]}, {\"case\": {\"id\": \"k5-mask310-order4691\", \"mask\": 310, \"order_index\": 4691, \"blocks\": 5}, \"base_deficit\": 1.5, \"generated_profiles\": [{\"base\": 89, \"gamma\": [21, 18, 12, 9, 0]}, {\"base\": 95, \"gamma\": [14, 13, 10, 13, 10]}, {\"base\": 100, \"gamma\": [12, 15, 21, 1, 10]}, {\"base\": 89, \"gamma\": [21, 18, 12, 9, 0]}, {\"base\": 149, \"gamma\": [29, 26, 20, 17, 8]}, {\"base\": 126, \"gamma\": [15, 12, 17, 18, 13]}, {\"base\": 117, \"gamma\": [11, 12, 14, 6, 9]}, {\"base\": 149, \"gamma\": [29, 26, 20, 17, 8]}]}, {\"case\": {\"id\": \"k6-mask442-order5461\", \"mask\": 442, \"order_index\": 5461, \"blocks\": 6}, \"base_deficit\": 1.5, \"generated_profiles\": [{\"base\": 83, \"gamma\": [21, 15, 12, 9, 3, 2]}, {\"base\": 78, \"gamma\": [11, 12, 9, 6, 4, 7]}, {\"base\": 96, \"gamma\": [11, 17, 20, 0, 6, 9]}, {\"base\": 62, \"gamma\": [6, 13, 10, 7, 1, 4]}, {\"base\": 233, \"gamma\": [34, 32, 29, 26, 20, 17]}, {\"base\": 203, \"gamma\": [19, 17, 21, 18, 16, 17]}, {\"base\": 120, \"gamma\": [11, 13, 14, 6, 8, 9]}, {\"base\": 155, \"gamma\": [30, 24, 21, 18, 12, 9]}]}, {\"case\": {\"id\": \"k4-mask312-order21771\", \"mask\": 312, \"order_index\": 21771, \"blocks\": 4}, \"base_deficit\": 1.3333333333333357, \"generated_profiles\": [{\"base\": 63, \"gamma\": [15, 12, 9, 2]}, {\"base\": 66, \"gamma\": [12, 10, 11, 6]}, {\"base\": 118, \"gamma\": [17, 20, 23, 9]}, {\"base\": 123, \"gamma\": [23, 20, 21, 12]}, {\"base\": 150, \"gamma\": [19, 19, 20, 15]}, {\"base\": 107, \"gamma\": [12, 13, 9, 8]}, {\"base\": 167, \"gamma\": [19, 18, 21, 18]}, {\"base\": 109, \"gamma\": [21, 24, 12, 13]}]}], \"interpretation\": \"Misses do not prove infeasibility; equal base threshold is insufficient. Every slope must be <=6.\"}]], \"engine_context\": {\"history\": [{\"id\": 7, \"mode\": \"exploit\", \"parents\": [5], \"status\": \"discard\", \"score\": -108855.51287324133, \"parent_score\": -102048.48907522252, \"problem_graphs\": [{\"graph\": \"k4\", \"score\": -4007.211904761905, \"failures\": 4}, {\"graph\": \"k5\", \"score\": -7005.650432900433, \"failures\": 7}, {\"graph\": \"k6\", \"score\": -7003.353186813187, \"failures\": 7}, {\"graph\": \"k7\", \"score\": -9004.62849083162, \"failures\": 9}], \"focus\": \"k7\"}, {\"id\": 6, \"mode\": \"exploit\", \"parents\": [5], \"status\": \"discard\", \"score\": -108853.62533355878, \"parent_score\": -102048.48907522252, \"problem_graphs\": [{\"graph\": \"k4\", \"score\": -4007.211904761905, \"failures\": 4}, {\"graph\": \"k5\", \"score\": -8005.2345598845595, \"failures\": 8}, {\"graph\": \"k6\", \"score\": -7003.353186813187, \"failures\": 7}, {\"graph\": \"k7\", \"score\": -8003.156824164952, \"failures\": 8}], \"focus\": \"k8\"}, {\"id\": 5, \"mode\": \"exploit\", \"parents\": [2], \"status\": \"keep\", \"score\": -102048.48907522252, \"parent_score\": -108853.65014531268, \"problem_graphs\": [{\"graph\": \"k4\", \"score\": -4004.7166666666667, \"failures\": 4}, {\"graph\": \"k5\", \"score\": -6004.1150793650795, \"failures\": 6}, {\"graph\": \"k6\", \"score\": -6002.853186813187, \"failures\": 6}, {\"graph\": \"k7\", \"score\": -9004.135284443411, \"failures\": 9}], \"focus\": \"k7\"}, {\"id\": 4, \"mode\": \"exploit\", \"parents\": [2], \"status\": \"discard\", \"score\": -112254.93504599144, \"parent_score\": -108853.65014531268, \"problem_graphs\": [{\"graph\": \"k4\", \"score\": -4007.211904761905, \"failures\": 4}, {\"graph\": \"k5\", \"score\": -7004.2345598845595, \"failures\": 7}, {\"graph\": \"k6\", \"score\": -7003.353186813187, \"failures\": 7}, {\"graph\": \"k7\", \"score\": -9004.62849083162, \"failures\": 9}], \"focus\": \"k7\"}], \"inspirations\": [{\"id\": 6, \"score\": -108853.62533355878, \"graph_scores\": {\"k4\": -4007.211904761905, \"k5\": -8005.2345598845595, \"k6\": -7003.353186813187, \"k7\": -8003.156824164952, \"k8\": -5002.668857934181}, \"spec\": {\"kind\": \"mixture_policy\", \"name\": \"odd-phase flat-slope complementary adjacent inversion\", \"rules\": [{\"cuts\": [0, 5, 9, 14], \"weights\": {\"rotation\": 1, \"zero_rotation\": 2, \"zero_swap\": -2, \"position\": -1, \"rank_gap\": -3}, \"direction\": \"shortest\", \"tie\": \"right\"}, {\"cuts\": [1, 4, 8, 13], \"weights\": {\"rotation\": 2, \"zero_rotation\": -1, \"zero_swap\": 3, \"position\": 1, \"rank_gap\": 2}, \"direction\": \"left\", \"tie\": \"left\"}, {\"cuts\": [2, 7, 11, 16], \"weights\": {\"rotation\": 0, \"zero_rotation\": 3, \"zero_swap\": -1, \"position\": -2, \"rank_gap\": -2}, \"direction\": \"right\", \"tie\": \"right\"}, {\"cuts\": [0, 3, 8, 12], \"weights\": {\"rotation\": 3, \"zero_rotation\": 0, \"zero_swap\": 2, \"position\": 2, \"rank_gap\": -1}, \"direction\": \"shortest\", \"tie\": \"left\"}, {\"cuts\": [1, 6, 10], \"weights\": {\"rotation\": -2, \"zero_rotation\": 4, \"zero_swap\": 1, \"position\": 0, \"rank_gap\": -4}, \"direction\": \"left\", \"tie\": \"right\"}, {\"cuts\": [0, 6, 11, 15], \"weights\": {\"rotation\": 2, \"zero_rotation\": -2, \"zero_swap\": -3, \"position\": 3, \"rank_gap\": 1}, \"direction\": \"shortest\", \"tie\": \"left\"}, {\"cuts\": [3, 7, 12], \"weights\": {\"rotation\": 1, \"zero_rotation\": 1, \"zero_swap\": 4, \"position\": -3, \"rank_gap\": 0}, \"direction\": \"right\", \"tie\": \"left\"}, {\"cuts\": [0, 2, 9, 16], \"weights\": {\"rotation\": 4, \"zero_rotation\": -3, \"zero_swap\": 0, \"position\": 1, \"rank_gap\": -2}, \"direction\": \"shortest\", \"tie\": \"right\"}]}}], \"focus\": {\"graph\": \"k7\", \"parent_score\": -9004.135284443411, \"archive_best\": -8003.156824164952}}, \"unverified_hypotheses\": \"\", \"context_sha256\": \"83a280095959be0ee17113ba4e6fea85215d14e850cdceb1550146f143ccdbe3\"}", "role": "user"}], "prompt_system_sha": "5823c3ab836265bb", "proposal": 8, "proposer_error": null, "reasoning_tokens": 390, "repairs_used": null, "score": -108852.76455282167, "seconds": 0.30660070799058303, "spec": {"kind": "mixture_policy", "name": "flat-slope staggered complementary adjacent inversion", "rules": [{"cuts": [0, 4, 9, 13], "direction": "shortest", "tie": "left", "weights": {"position": -2, "rank_gap": 1, "rotation": 1, "zero_rotation": 2, "zero_swap": -1}}, {"cuts": [1, 6, 11, 15], "direction": "left", "tie": "right", "weights": {"position": 1, "rank_gap": -2, "rotation": 2, "zero_rotation": -1, "zero_swap": 1}}, {"cuts": [2, 5, 10, 14], "direction": "right", "tie": "left", "weights": {"position": 2, "rank_gap": 1, "rotation": 0, "zero_rotation": 3, "zero_swap": -2}}, {"cuts": [0, 3, 7, 12], "direction": "shortest", "tie": "right", "weights": {"position": -1, "rank_gap": -1, "rotation": 3, "zero_rotation": 0, "zero_swap": 2}}, {"cuts": [1, 8, 16], "direction": "left", "tie": "left", "weights": {"position": -3, "rank_gap": 2, "rotation": -1, "zero_rotation": 2, "zero_swap": 0}}, {"cuts": [0, 6, 10], "direction": "shortest", "tie": "right", "weights": {"position": 0, "rank_gap": -3, "rotation": 1, "zero_rotation": -2, "zero_swap": 3}}, {"cuts": [3, 8, 12, 16], "direction": "right", "tie": "left", "weights": {"position": 3, "rank_gap": 0, "rotation": 2, "zero_rotation": 1, "zero_swap": -3}}, {"cuts": [2, 7, 11], "direction": "shortest", "tie": "left", "weights": {"position": 1, "rank_gap": 1, "rotation": 4, "zero_rotation": -1, "zero_swap": 1}}]}, "status": "discard", "t": 96.83, "tactic": null, "tokens_in": 5361, "tokens_out": 826, "valid": true}
{"batch": 7, "best_id": 5, "best_score": -102048.48907522252, "completed": 8, "eval_seconds": 0.31, "event": "batch", "inflight": 0, "proposals": 8, "propose_seconds": 10.81, "requests": [{"explore_p": null, "focus": "k7", "island": 0, "mode": "exploit", "parents": [5], "proposal": 8, "tactic": null}], "since_improvement": 2, "strategy": {"focus": true, "history": 4, "inspiration_pool": "top", "inspirations": 1, "modes": {"exploit": 1.0}, "parent": "best", "tactic": null}, "t": 96.83, "usage": {"billing_verified": false, "estimated_usd": 0.10658, "failed_requests": 0, "input_tokens": 38230, "max_spend_usd": 2.0, "output_tokens": 7292, "provider_costed_requests": 8, "requests": 8, "usage_overruns": 0}}
