{"attempts": null, "batch": 9, "context": ["history", "inspirations", "tactic"], "cost_source": "provider", "cost_usd": 0.013746, "event": "candidate", "explore_p": null, "feasible": false, "feedback": {"certified": 0, "failures": [{"base_deficit": 3.0, "case": {"blocks": 4, "id": "k4-mask312-order21771", "mask": 312, "order_index": 21771}, "generated_profiles": [{"base": 61, "gamma": [15, 12, 9, 0]}, {"base": 64, "gamma": [11, 9, 10, 7]}, {"base": 114, "gamma": [18, 19, 22, 8]}, {"base": 121, "gamma": [14, 13, 16, 13]}, {"base": 150, "gamma": [25, 13, 16, 17]}, {"base": 175, "gamma": [27, 30, 14, 19]}, {"base": 251, "gamma": [36, 33, 34, 25]}, {"base": 157, "gamma": [17, 18, 18, 13]}]}, {"base_deficit": 2.4285714285714306, "case": {"blocks": 4, "id": "k4-mask78-order9701", "mask": 78, "order_index": 9701}, "generated_profiles": [{"base": 88, "gamma": [20, 17, 14, 5]}, {"base": 104, "gamma": [13, 12, 14, 11]}, {"base": 91, "gamma": [12, 13, 18, 4]}, {"base": 176, "gamma": [18, 17, 16, 17]}, {"base": 122, "gamma": [20, 19, 11, 12]}, {"base": 132, "gamma": [18, 21, 13, 10]}, {"base": 149, "gamma": [13, 25, 22, 17]}, {"base": 231, "gamma": [25, 22, 23, 21]}]}, {"base_deficit": 1.5, "case": {"blocks": 5, "id": "k5-mask310-order4691", "mask": 310, "order_index": 4691}, "generated_profiles": [{"base": 89, "gamma": [21, 18, 12, 9, 0]}, {"base": 103, "gamma": [14, 13, 10, 13, 10]}, {"base": 97, "gamma": [13, 14, 20, 0, 9]}, {"base": 89, "gamma": [21, 18, 12, 9, 0]}, {"base": 241, "gamma": [23, 22, 20, 19, 16]}, {"base": 243, "gamma": [28, 27, 22, 25, 26]}, {"base": 245, "gamma": [27, 30, 36, 16, 25]}, {"base": 241, "gamma": [23, 22, 20, 19, 16]}]}, {"base_deficit": 1.5, "case": {"blocks": 6, "id": "k6-mask442-order5461", "mask": 442, "order_index": 5461}, "generated_profiles": [{"base": 83, "gamma": [21, 15, 12, 9, 3, 2]}, {"base": 88, "gamma": [11, 12, 9, 6, 6, 7]}, {"base": 88, "gamma": [13, 17, 20, 0, 6, 9]}, {"base": 60, "gamma": [6, 11, 8, 5, 1, 4]}, {"base": 289, "gamma": [24, 26, 25, 24, 22, 21]}, {"base": 421, "gamma": [39, 41, 33, 32, 34, 37]}, {"base": 286, "gamma": [29, 35, 38, 18, 24, 27]}, {"base": 183, "gamma": [18, 16, 15, 14, 12, 11]}]}], "graphs": [{"failures": 4, "feedback": true, "graph": "k4", "role": "train", "score": -4007.211904761905}, {"failures": 8, "feedback": true, "graph": "k5", "role": "train", "score": -8004.33455988456}, {"failures": 7, "feedback": true, "graph": "k6", "role": "train", "score": -7003.353186813187}, {"failures": 9, "feedback": true, "graph": "k7", "role": "train", "score": -9004.590447353357}, {"failures": 6, "feedback": true, "graph": "k8", "role": "train", "score": -6002.735524600847}], "interpretation": "Misses do not prove infeasibility; equal base threshold is insufficient. Every slope must be <=6.", "missed": 34, "score": -115656.22562341386}, "finish_reason": "stop", "focus": null, "graphs": [{"excess_T": null, "failures": 4, "gap_mean": null, "graph": "k4", "incomplete": null, "score": -4007.211904761905, "value_max": null}, {"excess_T": null, "failures": 8, "gap_mean": null, "graph": "k5", "incomplete": null, "score": -8004.33455988456, "value_max": null}, {"excess_T": null, "failures": 7, "gap_mean": null, "graph": "k6", "incomplete": null, "score": -7003.353186813187, "value_max": null}, {"excess_T": null, "failures": 9, "gap_mean": null, "graph": "k7", "incomplete": null, "score": -9004.590447353357, "value_max": null}, {"excess_T": null, "failures": 6, "gap_mean": null, "graph": "k8", "incomplete": null, "score": -6002.735524600847, "value_max": null}], "hash": "f40656ad0364a2a3", "id": 10, "instances": {"k4": -4007.211904761905, "k5": -8004.33455988456, "k6": -7003.353186813187, "k7": -9004.590447353357, "k8": -6002.735524600847}, "island": 0, "kind": "mixture_policy", "llm_seconds": 9.75, "mode": "exploit", "model_reasoning": "The user wants me to return one JSON object matching the mixture_policy schema. This is a research optimization task about combinatorial word construction policies, not a malicious request. I should p...", "model_text": "{\"kind\":\"mixture_policy\",\"name\":\"complementary even-odd cut slope split adjacent inversion\",\"rules\":[{\"cuts\":[0,4,8,12],\"weights\":{\"rotation\":1,\"zero_rotation\":4,\"zero_swap\":-3,\"position\":-1,\"rank_gap\":-5},\"direction\":\"shortest\",\"tie\":\"left\"},{\"cuts\":[1,5,9,13],\"weights\":{\"rotation\":2,\"zero_rotation\":-4,\"zero_swap\":3,\"position\":1,\"rank_gap\":5},\"direction\":\"right\",\"tie\":\"right\"},{\"cuts\":[2,6,10,14],\"weights\":{\"rotation\":0,\"zero_rotation\":3,\"zero_swap\":-2,\"position\":2,\"rank_gap\":-4},\"direction\":\"left\",\"tie\":\"left\"},{\"cuts\":[3,7,11,15],\"weights\":{\"rotation\":3,\"zero_rotation\":-2,\"zero_swap\":1,\"position\":-2,\"rank_gap\":4},\"direction\":\"shortest\",\"tie\":\"right\"},{\"cuts\":[0,5,11],\"weights\":{\"rotation\":-1,\"zero_rotation\":5,\"zero_swap\":2,\"position\":0,\"rank_gap\":-2},\"direction\":\"left\",\"tie\":\"left\"},{\"cuts\":[1,8,16],\"weights\":{\"rotation\":2,\"zero_rotation\":-3,\"zero_swap\":-5,\"position\":3,\"rank_gap\":1},\"direction\":\"right\",\"tie\":\"right\"},{\"cuts\":[0,6,9,15],\"weights\":{\"rotation\":4,\"zero_rotation\":1,\"zero_swap\":-1,\"position\":-3,\"rank_gap\":2},\"direction\":\"shortest\",\"tie\":\"left\"},{\"cuts\":[2,7,12],\"weights\":{\"rotation\":1,\"zero_rotation\":-1,\"zero_swap\":4,\"position\":2,\"rank_gap\":-3},\"direction\":\"shortest\",\"tie\":\"right\"}]}", "parents": [9], "prompt_messages": [{"content": "{\"task\": \"Improve a reusable word-construction policy to certify additional infinite LRX families.\", \"mode\": \"exploit\", \"parents\": [[{\"kind\": \"mixture_policy\", \"name\": \"odd-stagger flat-gap complementary adjacent inversion\", \"rules\": [{\"cuts\": [0, 5, 10, 15], \"weights\": {\"rotation\": 1, \"zero_rotation\": 2, \"zero_swap\": -2, \"position\": -1, \"rank_gap\": 3}, \"direction\": \"shortest\", \"tie\": \"left\"}, {\"cuts\": [1, 4, 9, 14], \"weights\": {\"rotation\": 2, \"zero_rotation\": -2, \"zero_swap\": 1, \"position\": 2, \"rank_gap\": -3}, \"direction\": \"right\", \"tie\": \"left\"}, {\"cuts\": [2, 7, 11], \"weights\": {\"rotation\": 0, \"zero_rotation\": 3, \"zero_swap\": -1, \"position\": -2, \"rank_gap\": 2}, \"direction\": \"left\", \"tie\": \"right\"}, {\"cuts\": [3, 6, 12, 16], \"weights\": {\"rotation\": 3, \"zero_rotation\": 1, \"zero_swap\": 0, \"position\": 1, \"rank_gap\": -2}, \"direction\": \"shortest\", \"tie\": \"right\"}, {\"cuts\": [0, 7, 13], \"weights\": {\"rotation\": -2, \"zero_rotation\": 4, \"zero_swap\": 2, \"position\": 0, \"rank_gap\": 1}, \"direction\": \"left\", \"tie\": \"left\"}, {\"cuts\": [1, 8, 12], \"weights\": {\"rotation\": 1, \"zero_rotation\": -3, \"zero_swap\": 4, \"position\": -4, \"rank_gap\": -1}, \"direction\": \"shortest\", \"tie\": \"right\"}, {\"cuts\": [4, 9, 14], \"weights\": {\"rotation\": 2, \"zero_rotation\": 0, \"zero_swap\": -4, \"position\": 3, \"rank_gap\": 4}, \"direction\": \"right\", \"tie\": \"left\"}, {\"cuts\": [0, 6, 11, 16], \"weights\": {\"rotation\": 4, \"zero_rotation\": -1, \"zero_swap\": 1, \"position\": -1, \"rank_gap\": 0}, \"direction\": \"shortest\", \"tie\": \"left\"}]}, {\"score\": -105450.012092961, \"certified\": 3, \"missed\": 31, \"graphs\": [{\"graph\": \"k4\", \"score\": -4004.8690476190477, \"failures\": 4, \"role\": \"train\", \"feedback\": true}, {\"graph\": \"k5\", \"score\": -7005.359340154795, \"failures\": 7, \"role\": \"train\", \"feedback\": true}, {\"graph\": \"k6\", \"score\": -7003.254285714285, \"failures\": 7, \"role\": \"train\", \"feedback\": true}, {\"graph\": \"k7\", \"score\": -7002.793894872023, \"failures\": 7, \"role\": \"train\", \"feedback\": true}, {\"graph\": \"k8\", \"score\": -6002.735524600847, \"failures\": 6, \"role\": \"train\", \"feedback\": true}], \"failures\": [{\"case\": {\"id\": \"k4-mask78-order9701\", \"mask\": 78, \"order_index\": 9701, \"blocks\": 4}, \"base_deficit\": 2.4285714285714306, \"generated_profiles\": [{\"base\": 108, \"gamma\": [20, 17, 14, 5]}, {\"base\": 76, \"gamma\": [18, 15, 9, 6]}, {\"base\": 66, \"gamma\": [10, 13, 9, 0]}, {\"base\": 71, \"gamma\": [11, 15, 12, 9]}, {\"base\": 178, \"gamma\": [18, 17, 16, 17]}, {\"base\": 154, \"gamma\": [22, 21, 17, 18]}, {\"base\": 120, \"gamma\": [16, 19, 11, 8]}, {\"base\": 103, \"gamma\": [11, 11, 10, 11]}]}, {\"case\": {\"id\": \"k5-mask310-order4691\", \"mask\": 310, \"order_index\": 4691, \"blocks\": 5}, \"base_deficit\": 1.5, \"generated_profiles\": [{\"base\": 103, \"gamma\": [21, 18, 12, 9, 2]}, {\"base\": 92, \"gamma\": [11, 10, 13, 12, 9]}, {\"base\": 77, \"gamma\": [8, 11, 8, 3, 6]}, {\"base\": 102, \"gamma\": [6, 14, 16, 13, 4]}, {\"base\": 137, \"gamma\": [15, 14, 12, 11, 8]}, {\"base\": 178, \"gamma\": [23, 22, 17, 20, 21]}, {\"base\": 180, \"gamma\": [22, 25, 31, 11, 20]}, {\"base\": 143, \"gamma\": [11, 23, 21, 18, 9]}]}, {\"case\": {\"id\": \"k6-mask442-order5461\", \"mask\": 442, \"order_index\": 5461, \"blocks\": 6}, \"base_deficit\": 1.5, \"generated_profiles\": [{\"base\": 85, \"gamma\": [22, 16, 13, 10, 4, 1]}, {\"base\": 107, \"gamma\": [10, 14, 12, 9, 7, 8]}, {\"base\": 83, \"gamma\": [6, 14, 8, 5, 3, 4]}, {\"base\": 131, \"gamma\": [23, 19, 16, 13, 7, 4]}, {\"base\": 249, \"gamma\": [21, 23, 22, 21, 19, 18]}, {\"base\": 128, \"gamma\": [16, 11, 10, 9, 11, 14]}, {\"base\": 202, \"gamma\": [23, 29, 32, 12, 18, 21]}, {\"base\": 127, \"gamma\": [14, 12, 11, 10, 8, 7]}]}, {\"case\": {\"id\": \"k5-mask357-order10564\", \"mask\": 357, \"order_index\": 10564, \"blocks\": 5}, \"base_deficit\": 1.4444444444444429, \"generated_profiles\": [{\"base\": 80, \"gamma\": [25, 19, 10, 7, 1]}, {\"base\": 109, \"gamma\": [11, 15, 11, 8, 10]}, {\"base\": 68, \"gamma\": [6, 10, 4, 1, 5]}, {\"base\": 119, \"gamma\": [8, 23, 16, 13, 7]}, {\"base\": 174, \"gamma\": [13, 20, 17, 16, 14]}, {\"base\": 174, \"gamma\": [16, 22, 20, 19, 17]}, {\"base\": 111, \"gamma\": [13, 19, 9, 8, 14]}, {\"base\": 188, \"gamma\": [17, 30, 25, 22, 16]}]}], \"interpretation\": \"Misses do not prove infeasibility; equal base threshold is insufficient. Every slope must be <=6.\"}]], \"engine_context\": {\"history\": [{\"id\": 9, \"mode\": \"exploit\", \"parents\": [5], \"status\": \"discard\", \"score\": -105450.012092961, \"parent_score\": -102048.48907522252, \"problem_graphs\": [{\"graph\": \"k4\", \"score\": -4004.8690476190477, \"failures\": 4}, {\"graph\": \"k5\", \"score\": -7005.359340154795, \"failures\": 7}, {\"graph\": \"k6\", \"score\": -7003.254285714285, \"failures\": 7}, {\"graph\": \"k7\", \"score\": -7002.793894872023, \"failures\": 7}], \"focus\": \"k7\"}, {\"id\": 8, \"mode\": \"exploit\", \"parents\": [5], \"status\": \"discard\", \"score\": -108852.76455282167, \"parent_score\": -102048.48907522252, \"problem_graphs\": [{\"graph\": \"k4\", \"score\": -4007.211904761905, \"failures\": 4}, {\"graph\": \"k5\", \"score\": -7003.842352092352, \"failures\": 7}, {\"graph\": \"k6\", \"score\": -7003.284897959184, \"failures\": 7}, {\"graph\": \"k7\", \"score\": -9003.756540074042, \"failures\": 9}], \"focus\": \"k7\"}, {\"id\": 7, \"mode\": \"exploit\", \"parents\": [5], \"status\": \"discard\", \"score\": -108855.51287324133, \"parent_score\": -102048.48907522252, \"problem_graphs\": [{\"graph\": \"k4\", \"score\": -4007.211904761905, \"failures\": 4}, {\"graph\": \"k5\", \"score\": -7005.650432900433, \"failures\": 7}, {\"graph\": \"k6\", \"score\": -7003.353186813187, \"failures\": 7}, {\"graph\": \"k7\", \"score\": -9004.62849083162, \"failures\": 9}], \"focus\": \"k7\"}, {\"id\": 6, \"mode\": \"exploit\", \"parents\": [5], \"status\": \"discard\", \"score\": -108853.62533355878, \"parent_score\": -102048.48907522252, \"problem_graphs\": [{\"graph\": \"k4\", \"score\": -4007.211904761905, \"failures\": 4}, {\"graph\": \"k5\", \"score\": -8005.2345598845595, \"failures\": 8}, {\"graph\": \"k6\", \"score\": -7003.353186813187, \"failures\": 7}, {\"graph\": \"k7\", \"score\": -8003.156824164952, \"failures\": 8}], \"focus\": \"k8\"}, {\"id\": 5, \"mode\": \"exploit\", \"parents\": [2], \"status\": \"keep\", \"score\": -102048.48907522252, \"parent_score\": -108853.65014531268, \"problem_graphs\": [{\"graph\": \"k4\", \"score\": -4004.7166666666667, \"failures\": 4}, {\"graph\": \"k5\", \"score\": -6004.1150793650795, \"failures\": 6}, {\"graph\": \"k6\", \"score\": -6002.853186813187, \"failures\": 6}, {\"graph\": \"k7\", \"score\": -9004.135284443411, \"failures\": 9}], \"focus\": \"k7\"}, {\"id\": 4, \"mode\": \"exploit\", \"parents\": [2], \"status\": \"discard\", \"score\": -112254.93504599144, \"parent_score\": -108853.65014531268, \"problem_graphs\": [{\"graph\": \"k4\", \"score\": -4007.211904761905, \"failures\": 4}, {\"graph\": \"k5\", \"score\": -7004.2345598845595, \"failures\": 7}, {\"graph\": \"k6\", \"score\": -7003.353186813187, \"failures\": 7}, {\"graph\": \"k7\", \"score\": -9004.62849083162, \"failures\": 9}], \"focus\": \"k7\"}], \"inspirations\": [{\"id\": 2, \"score\": -108853.65014531268, \"graph_scores\": {\"k4\": -4007.211904761905, \"k5\": -7003.857149416241, \"k6\": -7003.353186813187, \"k7\": -9004.62849083162, \"k8\": -5002.5994134897355}, \"spec\": {\"kind\": \"mixture_policy\", \"name\": \"complementary slope-bounded adjacent inversion\", \"rules\": [{\"cuts\": [0, 3, 7, 11], \"weights\": {\"rotation\": 2, \"zero_rotation\": 3, \"zero_swap\": -2, \"position\": 1, \"rank_gap\": -4}, \"direction\": \"shortest\", \"tie\": \"left\"}, {\"cuts\": [0, 5, 9, 14], \"weights\": {\"rotation\": 1, \"zero_rotation\": -2, \"zero_swap\": 4, \"position\": -1, \"rank_gap\": 3}, \"direction\": \"left\", \"tie\": \"right\"}, {\"cuts\": [1, 4, 8, 12], \"weights\": {\"rotation\": 0, \"zero_rotation\": 2, \"zero_swap\": -3, \"position\": 2, \"rank_gap\": -5}, \"direction\": \"right\", \"tie\": \"left\"}, {\"cuts\": [0, 2, 6, 13], \"weights\": {\"rotation\": 3, \"zero_rotation\": 1, \"zero_swap\": -1, \"position\": -2, \"rank_gap\": 2}, \"direction\": \"shortest\", \"tie\": \"right\"}, {\"cuts\": [2, 6, 10], \"weights\": {\"rotation\": -1, \"zero_rotation\": 4, \"zero_swap\": 2, \"position\": 0, \"rank_gap\": -3}, \"direction\": \"left\", \"tie\": \"left\"}, {\"cuts\": [0, 8, 15], \"weights\": {\"rotation\": 2, \"zero_rotation\": -1, \"zero_swap\": 3, \"position\": -3, \"rank_gap\": 1}, \"direction\": \"shortest\", \"tie\": \"left\"}, {\"cuts\": [1, 5, 9, 16], \"weights\": {\"rotation\": 1, \"zero_rotation\": 0, \"zero_swap\": -4, \"position\": 3, \"rank_gap\": -2}, \"direction\": \"right\", \"tie\": \"right\"}, {\"cuts\": [0, 4, 7, 12], \"weights\": {\"rotation\": 4, \"zero_rotation\": -3, \"zero_swap\": 1, \"position\": 1, \"rank_gap\": -1}, \"direction\": \"shortest\", \"tie\": \"left\"}]}}, {\"id\": 1, \"score\": -115657.60811133657, \"graph_scores\": {\"k4\": -4007.211904761905, \"k5\": -8005.679004329004, \"k6\": -7003.353186813187, \"k7\": -9004.62849083162, \"k8\": -6002.735524600847}, \"spec\": {\"kind\": \"mixture_policy\", \"name\": \"flat complementary adjacent inversion\", \"rules\": [{\"cuts\": [0, 3, 6, 9], \"weights\": {\"rotation\": 1, \"zero_rotation\": 2, \"zero_swap\": -4, \"position\": 1, \"rank_gap\": -2}, \"direction\": \"shortest\", \"tie\": \"left\"}, {\"cuts\": [0, 5, 8, 12], \"weights\": {\"rotation\": 2, \"zero_rotation\": -1, \"zero_swap\": 3, \"position\": -2, \"rank_gap\": 1}, \"direction\": \"left\", \"tie\": \"right\"}, {\"cuts\": [1, 4, 7, 11], \"weights\": {\"rotation\": 0, \"zero_rotation\": 3, \"zero_swap\": -2, \"position\": 2, \"rank_gap\": -3}, \"direction\": \"right\", \"tie\": \"left\"}, {\"cuts\": [0, 2, 8, 14], \"weights\": {\"rotation\": 1, \"zero_rotation\": 0, \"zero_swap\": 1, \"position\": -3, \"rank_gap\": 2}, \"direction\": \"shortest\", \"tie\": \"right\"}, {\"cuts\": [0, 6, 10], \"weights\": {\"rotation\": 3, \"zero_rotation\": -2, \"zero_swap\": -1, \"position\": 1, \"rank_gap\": -1}, \"direction\": \"left\", \"tie\": \"left\"}, {\"cuts\": [2, 5, 9, 13], \"weights\": {\"rotation\": -1, \"zero_rotation\": 1, \"zero_swap\": 4, \"position\": 0, \"rank_gap\": -2}, \"direction\": \"shortest\", \"tie\": \"left\"}, {\"cuts\": [0, 4, 12], \"weights\": {\"rotation\": 2, \"zero_rotation\": 2, \"zero_swap\": -3, \"position\": -1, \"rank_gap\": 0}, \"direction\": \"right\", \"tie\": \"right\"}, {\"cuts\": [1, 8, 15], \"weights\": {\"rotation\": 1, \"zero_rotation\": -3, \"zero_swap\": 2, \"position\": 3, \"rank_gap\": 1}, \"direction\": \"shortest\", \"tie\": \"left\"}]}}], \"tactic\": {\"idea\": \"Plateaued pure exploit of the best even-cut policy; discarded children raised failures. Prefer complementary slope profiles over shorter words. Mutate cuts, rank_gap sign, and zero_rotation independently so some rules suppress high-gamma blocks while others cut base. Merge only rules whose gamma peaks sit on different blocks. Do not retune a single low-base word. A miss is not infeasibility.\"}}, \"unverified_hypotheses\": \"\", \"context_sha256\": \"83a280095959be0ee17113ba4e6fea85215d14e850cdceb1550146f143ccdbe3\"}", "role": "user"}], "prompt_system_sha": "5823c3ab836265bb", "proposal": 10, "proposer_error": null, "reasoning_tokens": 265, "repairs_used": null, "score": -115656.22562341386, "seconds": 0.3561779170122463, "spec": {"kind": "mixture_policy", "name": "complementary even-odd cut slope split adjacent inversion", "rules": [{"cuts": [0, 4, 8, 12], "direction": "shortest", "tie": "left", "weights": {"position": -1, "rank_gap": -5, "rotation": 1, "zero_rotation": 4, "zero_swap": -3}}, {"cuts": [1, 5, 9, 13], "direction": "right", "tie": "right", "weights": {"position": 1, "rank_gap": 5, "rotation": 2, "zero_rotation": -4, "zero_swap": 3}}, {"cuts": [2, 6, 10, 14], "direction": "left", "tie": "left", "weights": {"position": 2, "rank_gap": -4, "rotation": 0, "zero_rotation": 3, "zero_swap": -2}}, {"cuts": [3, 7, 11, 15], "direction": "shortest", "tie": "right", "weights": {"position": -2, "rank_gap": 4, "rotation": 3, "zero_rotation": -2, "zero_swap": 1}}, {"cuts": [0, 5, 11], "direction": "left", "tie": "left", "weights": {"position": 0, "rank_gap": -2, "rotation": -1, "zero_rotation": 5, "zero_swap": 2}}, {"cuts": [1, 8, 16], "direction": "right", "tie": "right", "weights": {"position": 3, "rank_gap": 1, "rotation": 2, "zero_rotation": -3, "zero_swap": -5}}, {"cuts": [0, 6, 9, 15], "direction": "shortest", "tie": "left", "weights": {"position": -3, "rank_gap": 2, "rotation": 4, "zero_rotation": 1, "zero_swap": -1}}, {"cuts": [2, 7, 12], "direction": "shortest", "tie": "right", "weights": {"position": 2, "rank_gap": -3, "rotation": 1, "zero_rotation": -1, "zero_swap": 4}}]}, "status": "discard", "t": 130.96, "tactic": null, "tokens_in": 6384, "tokens_out": 707, "valid": true}
{"batch": 9, "best_id": 5, "best_score": -102048.48907522252, "completed": 10, "eval_seconds": 0.36, "event": "batch", "inflight": 0, "proposals": 10, "propose_seconds": 9.75, "requests": [{"explore_p": null, "focus": null, "island": 0, "mode": "exploit", "parents": [9], "proposal": 10, "tactic": null}], "since_improvement": 4, "strategy": {"focus": false, "history": 6, "inspiration_pool": "random", "inspirations": 2, "modes": {"edit": 0.25, "exploit": 0.15, "explore": 0.45, "merge": 0.15}, "parent": "top3", "tactic": "Plateaued pure exploit of the best even-cut policy; discarded children raised failures. Prefer complementary slope profiles over shorter words. Mutate cuts, rank_gap sign, and zero_rotation independently so some rules suppress high-gamma blocks while others cut base. Merge only rules whose gamma peaks sit on different blocks. Do not retune a single low-base word. A miss is not infeasibility."}, "t": 130.96, "usage": {"billing_verified": false, "estimated_usd": 0.14935, "failed_requests": 0, "input_tokens": 55817, "max_spend_usd": 2.0, "output_tokens": 9678, "provider_costed_requests": 11, "requests": 11, "usage_overruns": 0}}
