{"attempts": null, "batch": 1, "context": ["focus", "history", "inspirations"], "cost_source": "provider", "cost_usd": 0.010058, "event": "candidate", "explore_p": null, "feasible": false, "feedback": {"certified": 2, "failures": [{"base_deficit": 3.0, "case": {"blocks": 4, "id": "k4-mask312-order21771", "mask": 312, "order_index": 21771}, "generated_profiles": [{"base": 67, "gamma": [15, 12, 9, 2]}, {"base": 71, "gamma": [15, 12, 13, 4]}, {"base": 87, "gamma": [16, 17, 3, 6]}, {"base": 67, "gamma": [15, 12, 9, 2]}, {"base": 119, "gamma": [23, 20, 17, 8]}, {"base": 208, "gamma": [23, 23, 24, 19]}, {"base": 143, "gamma": [15, 16, 12, 11]}, {"base": 239, "gamma": [35, 32, 33, 24]}]}, {"base_deficit": 2.4285714285714306, "case": {"blocks": 4, "id": "k4-mask78-order9701", "mask": 78, "order_index": 9701}, "generated_profiles": [{"base": 96, "gamma": [20, 17, 14, 5]}, {"base": 71, "gamma": [11, 15, 12, 9]}, {"base": 89, "gamma": [16, 15, 18, 8]}, {"base": 65, "gamma": [6, 14, 11, 2]}, {"base": 228, "gamma": [37, 34, 31, 22]}, {"base": 144, "gamma": [18, 15, 19, 14]}, {"base": 144, "gamma": [14, 15, 19, 10]}, {"base": 177, "gamma": [15, 27, 24, 19]}]}, {"base_deficit": 1.5, "case": {"blocks": 5, "id": "k5-mask310-order4691", "mask": 310, "order_index": 4691}, "generated_profiles": [{"base": 89, "gamma": [21, 18, 12, 9, 0]}, {"base": 86, "gamma": [14, 14, 14, 9, 8]}, {"base": 118, "gamma": [16, 15, 21, 5, 14]}, {"base": 71, "gamma": [7, 13, 7, 6, 5]}, {"base": 240, "gamma": [36, 33, 27, 24, 15]}, {"base": 165, "gamma": [18, 15, 20, 21, 16]}, {"base": 195, "gamma": [17, 18, 20, 12, 15]}, {"base": 240, "gamma": [36, 33, 27, 24, 15]}]}, {"base_deficit": 1.5, "case": {"blocks": 6, "id": "k6-mask442-order5461", "mask": 442, "order_index": 5461}, "generated_profiles": [{"base": 87, "gamma": [21, 15, 12, 9, 3, 2]}, {"base": 66, "gamma": [5, 12, 9, 6, 8, 3]}, {"base": 110, "gamma": [12, 18, 21, 5, 5, 8]}, {"base": 60, "gamma": [7, 12, 9, 6, 2, 5]}, {"base": 239, "gamma": [36, 30, 27, 24, 18, 15]}, {"base": 259, "gamma": [23, 21, 25, 22, 20, 21]}, {"base": 242, "gamma": [19, 21, 22, 14, 16, 17]}, {"base": 319, "gamma": [26, 28, 27, 26, 24, 23]}]}], "graphs": [{"failures": 4, "feedback": true, "graph": "k4", "role": "train", "score": -4007.211904761905}, {"failures": 7, "feedback": true, "graph": "k5", "role": "train", "score": -7003.857149416241}, {"failures": 7, "feedback": true, "graph": "k6", "role": "train", "score": -7003.353186813187}, {"failures": 9, "feedback": true, "graph": "k7", "role": "train", "score": -9004.62849083162}, {"failures": 5, "feedback": true, "graph": "k8", "role": "train", "score": -5002.5994134897355}], "interpretation": "Misses do not prove infeasibility; equal base threshold is insufficient. Every slope must be <=6.", "missed": 32, "score": -108853.65014531268}, "finish_reason": "stop", "focus": "k7", "graphs": [{"excess_T": null, "failures": 4, "gap_mean": null, "graph": "k4", "incomplete": null, "score": -4007.211904761905, "value_max": null}, {"excess_T": null, "failures": 7, "gap_mean": null, "graph": "k5", "incomplete": null, "score": -7003.857149416241, "value_max": null}, {"excess_T": null, "failures": 7, "gap_mean": null, "graph": "k6", "incomplete": null, "score": -7003.353186813187, "value_max": null}, {"excess_T": null, "failures": 9, "gap_mean": null, "graph": "k7", "incomplete": null, "score": -9004.62849083162, "value_max": null}, {"excess_T": null, "failures": 5, "gap_mean": null, "graph": "k8", "incomplete": null, "score": -5002.5994134897355, "value_max": null}], "hash": "19548c64ad525335", "id": 2, "instances": {"k4": -4007.211904761905, "k5": -7003.857149416241, "k6": -7003.353186813187, "k7": -9004.62849083162, "k8": -5002.5994134897355}, "island": 0, "kind": "mixture_policy", "llm_seconds": 9.79, "mode": "exploit", "model_reasoning": "The user wants me to return one JSON object with a mixture_policy. I need to improve a word-construction policy to certify additional infinite LRX families.\n", "model_text": "{\"kind\":\"mixture_policy\",\"name\":\"complementary slope-bounded adjacent inversion\",\"rules\":[{\"cuts\":[0,3,7,11],\"weights\":{\"rotation\":2,\"zero_rotation\":3,\"zero_swap\":-2,\"position\":1,\"rank_gap\":-4},\"direction\":\"shortest\",\"tie\":\"left\"},{\"cuts\":[0,5,9,14],\"weights\":{\"rotation\":1,\"zero_rotation\":-2,\"zero_swap\":4,\"position\":-1,\"rank_gap\":3},\"direction\":\"left\",\"tie\":\"right\"},{\"cuts\":[1,4,8,12],\"weights\":{\"rotation\":0,\"zero_rotation\":2,\"zero_swap\":-3,\"position\":2,\"rank_gap\":-5},\"direction\":\"right\",\"tie\":\"left\"},{\"cuts\":[0,2,6,13],\"weights\":{\"rotation\":3,\"zero_rotation\":1,\"zero_swap\":-1,\"position\":-2,\"rank_gap\":2},\"direction\":\"shortest\",\"tie\":\"right\"},{\"cuts\":[2,6,10],\"weights\":{\"rotation\":-1,\"zero_rotation\":4,\"zero_swap\":2,\"position\":0,\"rank_gap\":-3},\"direction\":\"left\",\"tie\":\"left\"},{\"cuts\":[0,8,15],\"weights\":{\"rotation\":2,\"zero_rotation\":-1,\"zero_swap\":3,\"position\":-3,\"rank_gap\":1},\"direction\":\"shortest\",\"tie\":\"left\"},{\"cuts\":[1,5,9,16],\"weights\":{\"rotation\":1,\"zero_rotation\":0,\"zero_swap\":-4,\"position\":3,\"rank_gap\":-2},\"direction\":\"right\",\"tie\":\"right\"},{\"cuts\":[0,4,7,12],\"weights\":{\"rotation\":4,\"zero_rotation\":-3,\"zero_swap\":1,\"position\":1,\"rank_gap\":-1},\"direction\":\"shortest\",\"tie\":\"left\"}]}", "parents": [0], "prompt_messages": [{"content": "{\"task\": \"Improve a reusable word-construction policy to certify additional infinite LRX families.\", \"mode\": \"exploit\", \"parents\": [[{\"kind\": \"mixture_policy\", \"name\": \"nearest adjacent inversion, three cuts\", \"rules\": [{\"cuts\": [0, 4, 8], \"weights\": {\"rotation\": 1, \"zero_rotation\": 0, \"zero_swap\": 0, \"position\": 0, \"rank_gap\": 0}, \"direction\": \"shortest\", \"tie\": \"left\"}]}, {\"score\": -115657.60811133657, \"certified\": 0, \"missed\": 34, \"graphs\": [{\"graph\": \"k4\", \"score\": -4007.211904761905, \"failures\": 4, \"role\": \"train\", \"feedback\": true}, {\"graph\": \"k5\", \"score\": -8005.679004329004, \"failures\": 8, \"role\": \"train\", \"feedback\": true}, {\"graph\": \"k6\", \"score\": -7003.353186813187, \"failures\": 7, \"role\": \"train\", \"feedback\": true}, {\"graph\": \"k7\", \"score\": -9004.62849083162, \"failures\": 9, \"role\": \"train\", \"feedback\": true}, {\"graph\": \"k8\", \"score\": -6002.735524600847, \"failures\": 6, \"role\": \"train\", \"feedback\": true}], \"failures\": [{\"case\": {\"id\": \"k4-mask312-order21771\", \"mask\": 312, \"order_index\": 21771, \"blocks\": 4}, \"base_deficit\": 3.0, \"generated_profiles\": [{\"base\": 61, \"gamma\": [15, 12, 9, 2]}, {\"base\": 60, \"gamma\": [11, 9, 10, 7]}, {\"base\": 108, \"gamma\": [18, 21, 24, 10]}]}, {\"case\": {\"id\": \"k4-mask78-order9701\", \"mask\": 78, \"order_index\": 9701, \"blocks\": 4}, \"base_deficit\": 2.4285714285714306, \"generated_profiles\": [{\"base\": 94, \"gamma\": [19, 16, 13, 4]}, {\"base\": 86, \"gamma\": [11, 10, 14, 11]}, {\"base\": 73, \"gamma\": [11, 14, 17, 3]}]}, {\"case\": {\"id\": \"k5-mask310-order4691\", \"mask\": 310, \"order_index\": 4691, \"blocks\": 5}, \"base_deficit\": 1.5, \"generated_profiles\": [{\"base\": 90, \"gamma\": [20, 17, 11, 8, 1]}, {\"base\": 88, \"gamma\": [11, 10, 11, 14, 9]}, {\"base\": 97, \"gamma\": [9, 12, 18, 2, 9]}]}, {\"case\": {\"id\": \"k6-mask442-order5461\", \"mask\": 442, \"order_index\": 5461, \"blocks\": 6}, \"base_deficit\": 1.5, \"generated_profiles\": [{\"base\": 83, \"gamma\": [21, 15, 12, 9, 3, 2]}, {\"base\": 72, \"gamma\": [9, 12, 9, 6, 4, 7]}, {\"base\": 88, \"gamma\": [11, 15, 18, 2, 6, 9]}]}], \"interpretation\": \"Misses do not prove infeasibility; equal base threshold is insufficient. Every slope must be <=6.\"}]], \"engine_context\": {\"history\": [{\"id\": 1, \"mode\": \"exploit\", \"parents\": [0], \"status\": \"discard\", \"score\": -115657.60811133657, \"parent_score\": -115657.60811133657, \"problem_graphs\": [{\"graph\": \"k4\", \"score\": -4007.211904761905, \"failures\": 4}, {\"graph\": \"k5\", \"score\": -8005.679004329004, \"failures\": 8}, {\"graph\": \"k6\", \"score\": -7003.353186813187, \"failures\": 7}, {\"graph\": \"k7\", \"score\": -9004.62849083162, \"failures\": 9}], \"focus\": \"k7\"}], \"inspirations\": [{\"id\": 1, \"score\": -115657.60811133657, \"graph_scores\": {\"k4\": -4007.211904761905, \"k5\": -8005.679004329004, \"k6\": -7003.353186813187, \"k7\": -9004.62849083162, \"k8\": -6002.735524600847}, \"spec\": {\"kind\": \"mixture_policy\", \"name\": \"flat complementary adjacent inversion\", \"rules\": [{\"cuts\": [0, 3, 6, 9], \"weights\": {\"rotation\": 1, \"zero_rotation\": 2, \"zero_swap\": -4, \"position\": 1, \"rank_gap\": -2}, \"direction\": \"shortest\", \"tie\": \"left\"}, {\"cuts\": [0, 5, 8, 12], \"weights\": {\"rotation\": 2, \"zero_rotation\": -1, \"zero_swap\": 3, \"position\": -2, \"rank_gap\": 1}, \"direction\": \"left\", \"tie\": \"right\"}, {\"cuts\": [1, 4, 7, 11], \"weights\": {\"rotation\": 0, \"zero_rotation\": 3, \"zero_swap\": -2, \"position\": 2, \"rank_gap\": -3}, \"direction\": \"right\", \"tie\": \"left\"}, {\"cuts\": [0, 2, 8, 14], \"weights\": {\"rotation\": 1, \"zero_rotation\": 0, \"zero_swap\": 1, \"position\": -3, \"rank_gap\": 2}, \"direction\": \"shortest\", \"tie\": \"right\"}, {\"cuts\": [0, 6, 10], \"weights\": {\"rotation\": 3, \"zero_rotation\": -2, \"zero_swap\": -1, \"position\": 1, \"rank_gap\": -1}, \"direction\": \"left\", \"tie\": \"left\"}, {\"cuts\": [2, 5, 9, 13], \"weights\": {\"rotation\": -1, \"zero_rotation\": 1, \"zero_swap\": 4, \"position\": 0, \"rank_gap\": -2}, \"direction\": \"shortest\", \"tie\": \"left\"}, {\"cuts\": [0, 4, 12], \"weights\": {\"rotation\": 2, \"zero_rotation\": 2, \"zero_swap\": -3, \"position\": -1, \"rank_gap\": 0}, \"direction\": \"right\", \"tie\": \"right\"}, {\"cuts\": [1, 8, 15], \"weights\": {\"rotation\": 1, \"zero_rotation\": -3, \"zero_swap\": 2, \"position\": 3, \"rank_gap\": 1}, \"direction\": \"shortest\", \"tie\": \"left\"}]}}], \"focus\": {\"graph\": \"k7\", \"parent_score\": -9004.62849083162, \"archive_best\": -9004.62849083162}}, \"unverified_hypotheses\": \"\", \"context_sha256\": \"83a280095959be0ee17113ba4e6fea85215d14e850cdceb1550146f143ccdbe3\"}", "role": "user"}], "prompt_system_sha": "5823c3ab836265bb", "proposal": 2, "proposer_error": null, "reasoning_tokens": 214, "repairs_used": null, "score": -108853.65014531268, "seconds": 0.36755883300793357, "spec": {"kind": "mixture_policy", "name": "complementary slope-bounded adjacent inversion", "rules": [{"cuts": [0, 3, 7, 11], "direction": "shortest", "tie": "left", "weights": {"position": 1, "rank_gap": -4, "rotation": 2, "zero_rotation": 3, "zero_swap": -2}}, {"cuts": [0, 5, 9, 14], "direction": "left", "tie": "right", "weights": {"position": -1, "rank_gap": 3, "rotation": 1, "zero_rotation": -2, "zero_swap": 4}}, {"cuts": [1, 4, 8, 12], "direction": "right", "tie": "left", "weights": {"position": 2, "rank_gap": -5, "rotation": 0, "zero_rotation": 2, "zero_swap": -3}}, {"cuts": [0, 2, 6, 13], "direction": "shortest", "tie": "right", "weights": {"position": -2, "rank_gap": 2, "rotation": 3, "zero_rotation": 1, "zero_swap": -1}}, {"cuts": [2, 6, 10], "direction": "left", "tie": "left", "weights": {"position": 0, "rank_gap": -3, "rotation": -1, "zero_rotation": 4, "zero_swap": 2}}, {"cuts": [0, 8, 15], "direction": "shortest", "tie": "left", "weights": {"position": -3, "rank_gap": 1, "rotation": 2, "zero_rotation": -1, "zero_swap": 3}}, {"cuts": [1, 5, 9, 16], "direction": "right", "tie": "right", "weights": {"position": 3, "rank_gap": -2, "rotation": 1, "zero_rotation": 0, "zero_swap": -4}}, {"cuts": [0, 4, 7, 12], "direction": "shortest", "tie": "left", "weights": {"position": 1, "rank_gap": -1, "rotation": 4, "zero_rotation": -3, "zero_swap": 1}}]}, "status": "keep", "t": 20.15, "tactic": null, "tokens_in": 3928, "tokens_out": 655, "valid": true}
{"batch": 1, "best_id": 2, "best_score": -108853.65014531268, "completed": 2, "eval_seconds": 0.37, "event": "batch", "inflight": 0, "proposals": 2, "propose_seconds": 9.79, "requests": [{"explore_p": null, "focus": "k7", "island": 0, "mode": "exploit", "parents": [0], "proposal": 2, "tactic": null}], "since_improvement": 1, "strategy": {"focus": true, "history": 4, "inspiration_pool": "top", "inspirations": 1, "modes": {"exploit": 1.0}, "parent": "best", "tactic": null}, "t": 20.15, "usage": {"billing_verified": false, "estimated_usd": 0.019186, "failed_requests": 0, "input_tokens": 7055, "max_spend_usd": 2.0, "output_tokens": 1422, "provider_costed_requests": 2, "requests": 2, "usage_overruns": 0}}
