{"attempts": null, "batch": 2, "context": ["focus", "history", "inspirations"], "cost_source": "provider", "cost_usd": 0.054276, "event": "candidate", "explore_p": null, "feasible": false, "feedback": {"complexity": 44, "failures": [{"best_length": 61, "bound": 59, "case": "m9r3-obstruction-6", "defects": [], "generated": 96, "m": 9, "projection_length": 52, "q": 53, "r": 3, "routed": 33, "routing_overhead": 9, "status": "PORTFOLIO_MISS", "v": [2, 1, 0, 0, 0, 9, 8, 7, 6, 5, 4, 3], "word_cap_reached": true}, {"best_length": 49, "bound": 48, "case": "m8r3-obstruction-0", "defects": [], "generated": 96, "m": 8, "projection_length": 41, "q": 43, "r": 3, "routed": 57, "routing_overhead": 8, "status": "PORTFOLIO_MISS", "v": [2, 1, 0, 0, 0, 7, 8, 6, 5, 4, 3], "word_cap_reached": true}, {"best_length": 49, "bound": 48, "case": "m8r3-neighbours-3", "defects": [], "generated": 96, "m": 8, "projection_length": 40, "q": 43, "r": 3, "routed": 48, "routing_overhead": 9, "status": "PORTFOLIO_MISS", "v": [3, 2, 1, 0, 0, 0, 7, 8, 6, 5, 4], "word_cap_reached": true}, {"best_length": 60, "bound": 59, "case": "m9r3-neighbours-7", "defects": [], "generated": 96, "m": 9, "projection_length": 51, "q": 53, "r": 3, "routed": 75, "routing_overhead": 9, "status": "PORTFOLIO_MISS", "v": [1, 0, 0, 0, 9, 8, 7, 6, 5, 4, 3, 2], "word_cap_reached": true}], "families": {"m8r3-neighbours": -1001, "m8r3-obstruction": -1001, "m8r5-antipode-insertions": 0, "m8r9-antipode-insertions": 0, "m9r3-neighbours": -3003, "m9r3-obstruction": -1002, "m9r4-band-edge": 0}, "graphs": [{"T": 48, "checked": 1, "failures": 1, "feedback": true, "graph": "m8r3-obstruction", "incomplete": 0, "m": 8, "r": 3, "role": "train", "score": -1001, "value_max": 49}, {"T": 48, "checked": 5, "failures": 1, "feedback": true, "graph": "m8r3-neighbours", "incomplete": 0, "m": 8, "r": 3, "role": "train", "score": -1001, "value_max": 49}, {"T": 59, "checked": 1, "failures": 1, "feedback": true, "graph": "m9r3-obstruction", "incomplete": 0, "m": 9, "r": 3, "role": "train", "score": -1002, "value_max": 61}, {"T": 59, "checked": 5, "failures": 3, "feedback": true, "graph": "m9r3-neighbours", "incomplete": 0, "m": 9, "r": 3, "role": "train", "score": -3003, "value_max": 60}, {"T": 66, "checked": 4, "failures": 0, "feedback": true, "graph": "m9r4-band-edge", "incomplete": 0, "m": 9, "r": 4, "role": "train", "score": 0, "value_max": 66}, {"T": 60, "checked": 6, "failures": 0, "feedback": true, "graph": "m8r5-antipode-insertions", "incomplete": 0, "m": 8, "r": 5, "role": "train", "score": 0, "value_max": 60}, {"T": 84, "checked": 6, "failures": 0, "feedback": true, "graph": "m8r9-antipode-insertions", "incomplete": 0, "m": 8, "r": 9, "role": "train", "score": 0, "value_max": 83}], "interpretation": "A portfolio miss is not a lifting counterexample. Scoring prioritizes fewer misses, then excess, then simpler policies.", "max_excess": 2, "missed": 6, "score": -1703015.0044}, "finish_reason": "stop", "focus": "m9r3-neighbours", "graphs": [{"excess_T": null, "failures": 1, "gap_mean": null, "graph": "m8r3-obstruction", "incomplete": 0, "score": -1001, "value_max": 49}, {"excess_T": null, "failures": 1, "gap_mean": null, "graph": "m8r3-neighbours", "incomplete": 0, "score": -1001, "value_max": 49}, {"excess_T": null, "failures": 1, "gap_mean": null, "graph": "m9r3-obstruction", "incomplete": 0, "score": -1002, "value_max": 61}, {"excess_T": null, "failures": 3, "gap_mean": null, "graph": "m9r3-neighbours", "incomplete": 0, "score": -3003, "value_max": 60}, {"excess_T": null, "failures": 0, "gap_mean": null, "graph": "m9r4-band-edge", "incomplete": 0, "score": 0, "value_max": 66}, {"excess_T": null, "failures": 0, "gap_mean": null, "graph": "m8r5-antipode-insertions", "incomplete": 0, "score": 0, "value_max": 60}, {"excess_T": null, "failures": 0, "gap_mean": null, "graph": "m8r9-antipode-insertions", "incomplete": 0, "score": 0, "value_max": 83}], "hash": "80b11e77fbc75acc", "id": 3, "instances": {"m8r3-neighbours": -1001, "m8r3-obstruction": -1001, "m8r5-antipode-insertions": 0, "m8r9-antipode-insertions": 0, "m9r3-neighbours": -3003, "m9r3-obstruction": -1002, "m9r4-band-edge": 0}, "island": 0, "kind": "lift_policy", "llm_seconds": 101.11, "mode": "exploit", "model_reasoning": "The user wants me to propose an improved reusable LRX lifting construction policy as a JSON object. I need to understand the problem and improve on the parent policy that missed several cases.\n{\n  \"kind\": \"lift_policy\",\n  \"name\": \"core geodesics plus indexed detours with adaptive uphill\",\n  \"zero_order\": \"left\",\n  \"paths\": [\n    {\n      \"orders\": [\"LRX\"],\n      \"period\": 1,\n      \"axis\": \"step\",\n      \" detour\": \"uphill\",\n      \"detour_steps\": [5, 11]\n    },\n    {\n      \"orders\": [\"LXR\"],\n      \"period\": 1,\n      \"axis\": \"step\",\n      \"detour\": \"level\",\n      \"detour_steps\": [4, 6, 8, 12]\n    },\n    {\n      \"orders\": [\"RLX\"],\n      \"period\": 1,\n      \"axis\": \"step\",\n      \"detour\": \"either\",\n      \"detour_steps\": [5, 9, 15]\n    },\n    {\n      \"orders\": [\"R XL\"],\n      \"period\": 1,\n      \"axis\": \"step\",\n      \"detour\": \"none\",\n      \"detour_steps\": []\n    },\n    {\n      \"orders\": [\"XLR\"],\n      \"period\": 1,\n      \"axis\": \"step\",\n      \"detour\": \"none \",\n      \"detour_steps\": []\n    },\n    {\n      \"orders\": [\"XRL\"],\n      \"period\": 1,\n      \"axis\": \"step\",\n      \"detour\": \"none\",\n      \"detour_steps\": []\n    },\n    {\n      \"orders\": [\"LRX\", \"XRL \"],\n      \"period\": 1,\n      \"axis\": \"step\",\n      \"detour\": \"level\",\n      \"detour_steps\": [5, 11]\n    },\n    {\n      \"orders\": [\"XLR\", \"RLX\"],\n      \"period\": 2,\n      \"axis\": \" distance\",\n      \"detour\": \"uphill\",\n      \"detour_steps\": [5]\n    }\n  ]\n}     This policy keeps the original successful geodesics and their detour variants while adding one new alternating path that coordinates LRX/XRL orders with an uphill detour at step 5. The new path is placed late so it doesn't override early witnesses on easy families. It also keeps the original period-2 distance path. This should hit the m8 obstruction (uphill at 5 with LRX/XRL alternation) and m9 obstruction (level detour on alternating orders) without regressing the large families. The score should improve by reducing misses on the four listed cases and any additional m9r3-neighbours misses.   I kept the original 6 single-order geodesics intact and only added one new alternating path (path 7) while keeping path 8 unchanged. This preserves all base-phase successes and adds the missing LRX/XRL uphill coordination that was likely the key gap. The policy is reusable because it generalizes the known repair patterns (uphill at 5 on LRX/XRL and level on alternating orders) across the zero_order left. The max_excess should stay at 2 or drop if the new path finds a witness with overhead <=5 for m8 and overhead <=6 for m9. Fewer misses expected.  This is a minimal, high-impact change that directly targets the portfolio misses while staying compatible with the antipode and band-edge successes. The JSON is ready for evaluation. I believe this will reduce the number of misses from 6 to 2 or fewer and keep the excess low. The policy is now more targeted to the obstruction families without sacrificing the easy cases.  The final answer is the JSON above.", "model_text": "{\"kind\":\"lift_policy\",\"name\":\"preserve geodesics, critical-index detours\",\"zero_order\":\"left\",\"paths\":[{\"orders\":[\"LRX\"],\"period\":1,\"axis\":\"step\",\"detour\":\"uphill\",\"detour_steps\":[5]},{\"orders\":[\"LXR\"],\"period\":1,\"axis\":\"step\",\"detour\":\"level\",\"detour_steps\":[4,6,8,12]},{\"orders\":[\"RLX\"],\"period\":1,\"axis\":\"step\",\"detour\":\"either\",\"detour_steps\":[5,9,15]},{\"orders\":[\"RXL\"],\"period\":1,\"axis\":\"step\",\"detour\":\"uphill\",\"detour_steps\":[5,4,6,7]},{\"orders\":[\"XLR\"],\"period\":1,\"axis\":\"step\",\"detour\":\"level\",\"detour_steps\":[0,2,5,8]},{\"orders\":[\"XRL\"],\"period\":1,\"axis\":\"step\",\"detour\":\"either\",\"detour_steps\":[5,6,8,11]},{\"orders\":[\"LRX\",\"XRL\"],\"period\":1,\"axis\":\"step\",\"detour\":\"level\",\"detour_steps\":[5,11]},{\"orders\":[\"XLR\",\"RLX\"],\"period\":2,\"axis\":\"distance\",\"detour\":\"uphill\",\"detour_steps\":[5,4,6,8]}]}", "parents": [1], "prompt_messages": [{"content": "{\"task\": \"Propose an improved reusable LRX lifting construction policy.\", \"mode\": \"exploit\", \"parents\": [[{\"kind\": \"lift_policy\", \"name\": \"core geodesics plus indexed detours\", \"zero_order\": \"left\", \"paths\": [{\"orders\": [\"LRX\"], \"period\": 1, \"axis\": \"step\", \"detour\": \"uphill\", \"detour_steps\": [5]}, {\"orders\": [\"LXR\"], \"period\": 1, \"axis\": \"step\", \"detour\": \"level\", \"detour_steps\": [4, 6, 8, 12]}, {\"orders\": [\"RLX\"], \"period\": 1, \"axis\": \"step\", \"detour\": \"either\", \"detour_steps\": [5, 9, 15]}, {\"orders\": [\"RXL\"], \"period\": 1, \"axis\": \"step\", \"detour\": \"none\", \"detour_steps\": []}, {\"orders\": [\"XLR\"], \"period\": 1, \"axis\": \"step\", \"detour\": \"none\", \"detour_steps\": []}, {\"orders\": [\"XRL\"], \"period\": 1, \"axis\": \"step\", \"detour\": \"none\", \"detour_steps\": []}, {\"orders\": [\"LRX\", \"XRL\"], \"period\": 1, \"axis\": \"step\", \"detour\": \"level\", \"detour_steps\": [5, 11]}, {\"orders\": [\"XLR\", \"RLX\"], \"period\": 2, \"axis\": \"distance\", \"detour\": \"uphill\", \"detour_steps\": [5]}]}, {\"score\": -1703015.0029, \"missed\": 6, \"max_excess\": 2, \"complexity\": 29, \"families\": {\"m8r3-obstruction\": -1001, \"m8r3-neighbours\": -1001, \"m9r3-obstruction\": -1002, \"m9r3-neighbours\": -3003, \"m9r4-band-edge\": 0, \"m8r5-antipode-insertions\": 0, \"m8r9-antipode-insertions\": 0}, \"graphs\": [{\"graph\": \"m8r3-obstruction\", \"m\": 8, \"r\": 3, \"role\": \"train\", \"feedback\": true, \"checked\": 1, \"failures\": 1, \"incomplete\": 0, \"score\": -1001, \"T\": 48, \"value_max\": 49}, {\"graph\": \"m8r3-neighbours\", \"m\": 8, \"r\": 3, \"role\": \"train\", \"feedback\": true, \"checked\": 5, \"failures\": 1, \"incomplete\": 0, \"score\": -1001, \"T\": 48, \"value_max\": 49}, {\"graph\": \"m9r3-obstruction\", \"m\": 9, \"r\": 3, \"role\": \"train\", \"feedback\": true, \"checked\": 1, \"failures\": 1, \"incomplete\": 0, \"score\": -1002, \"T\": 59, \"value_max\": 61}, {\"graph\": \"m9r3-neighbours\", \"m\": 9, \"r\": 3, \"role\": \"train\", \"feedback\": true, \"checked\": 5, \"failures\": 3, \"incomplete\": 0, \"score\": -3003, \"T\": 59, \"value_max\": 60}, {\"graph\": \"m9r4-band-edge\", \"m\": 9, \"r\": 4, \"role\": \"train\", \"feedback\": true, \"checked\": 4, \"failures\": 0, \"incomplete\": 0, \"score\": 0, \"T\": 66, \"value_max\": 66}, {\"graph\": \"m8r5-antipode-insertions\", \"m\": 8, \"r\": 5, \"role\": \"train\", \"feedback\": true, \"checked\": 6, \"failures\": 0, \"incomplete\": 0, \"score\": 0, \"T\": 60, \"value_max\": 60}, {\"graph\": \"m8r9-antipode-insertions\", \"m\": 8, \"r\": 9, \"role\": \"train\", \"feedback\": true, \"checked\": 6, \"failures\": 0, \"incomplete\": 0, \"score\": 0, \"T\": 84, \"value_max\": 83}], \"failures\": [{\"case\": \"m9r3-obstruction-6\", \"m\": 9, \"r\": 3, \"v\": [2, 1, 0, 0, 0, 9, 8, 7, 6, 5, 4, 3], \"q\": 53, \"bound\": 59, \"status\": \"PORTFOLIO_MISS\", \"generated\": 57, \"routed\": 30, \"word_cap_reached\": false, \"best_length\": 61, \"projection_length\": 52, \"routing_overhead\": 9, \"defects\": []}, {\"case\": \"m8r3-obstruction-0\", \"m\": 8, \"r\": 3, \"v\": [2, 1, 0, 0, 0, 7, 8, 6, 5, 4, 3], \"q\": 43, \"bound\": 48, \"status\": \"PORTFOLIO_MISS\", \"generated\": 57, \"routed\": 33, \"word_cap_reached\": false, \"best_length\": 49, \"projection_length\": 41, \"routing_overhead\": 8, \"defects\": []}, {\"case\": \"m8r3-neighbours-3\", \"m\": 8, \"r\": 3, \"v\": [3, 2, 1, 0, 0, 0, 7, 8, 6, 5, 4], \"q\": 43, \"bound\": 48, \"status\": \"PORTFOLIO_MISS\", \"generated\": 57, \"routed\": 24, \"word_cap_reached\": false, \"best_length\": 49, \"projection_length\": 40, \"routing_overhead\": 9, \"defects\": []}, {\"case\": \"m9r3-neighbours-7\", \"m\": 9, \"r\": 3, \"v\": [1, 0, 0, 0, 9, 8, 7, 6, 5, 4, 3, 2], \"q\": 53, \"bound\": 59, \"status\": \"PORTFOLIO_MISS\", \"generated\": 57, \"routed\": 42, \"word_cap_reached\": false, \"best_length\": 60, \"projection_length\": 51, \"routing_overhead\": 9, \"defects\": []}], \"interpretation\": \"A portfolio miss is not a lifting counterexample. Scoring prioritizes fewer misses, then excess, then simpler policies.\"}]], \"engine_context\": {\"history\": [{\"id\": 2, \"mode\": \"exploit\", \"parents\": [1], \"status\": \"discard\", \"score\": -1985918.0036, \"parent_score\": -1703015.0029, \"problem_graphs\": [{\"graph\": \"m8r3-obstruction\", \"score\": -1001, \"failures\": 1}, {\"graph\": \"m8r3-neighbours\", \"score\": -1001, \"failures\": 1}, {\"graph\": \"m9r3-obstruction\", \"score\": -1002, \"failures\": 1}, {\"graph\": \"m9r3-neighbours\", \"score\": -3003, \"failures\": 3}], \"focus\": \"m9r3-neighbours\"}, {\"id\": 1, \"mode\": \"exploit\", \"parents\": [0], \"status\": \"keep\", \"score\": -1703015.0029, \"parent_score\": -2268820.0012, \"problem_graphs\": [{\"graph\": \"m8r3-obstruction\", \"score\": -1001, \"failures\": 1}, {\"graph\": \"m8r3-neighbours\", \"score\": -1001, \"failures\": 1}, {\"graph\": \"m9r3-obstruction\", \"score\": -1002, \"failures\": 1}, {\"graph\": \"m9r3-neighbours\", \"score\": -3003, \"failures\": 3}], \"focus\": \"m9r3-neighbours\"}], \"inspirations\": [{\"id\": 2, \"score\": -1985918.0036, \"graph_scores\": {\"m8r3-obstruction\": -1001, \"m8r3-neighbours\": -1001, \"m9r3-obstruction\": -1002, \"m9r3-neighbours\": -3003, \"m9r4-band-edge\": -1002, \"m8r5-antipode-insertions\": 0, \"m8r9-antipode-insertions\": 0}, \"spec\": {\"kind\": \"lift_policy\", \"name\": \"distance-low zeros, alternate prefix then detour\", \"zero_order\": \"distance_low\", \"paths\": [{\"orders\": [\"XRL\", \"LRX\"], \"period\": 1, \"axis\": \"step\", \"detour\": \"uphill\", \"detour_steps\": [5]}, {\"orders\": [\"RLX\", \"XLR\"], \"period\": 2, \"axis\": \"step\", \"detour\": \"uphill\", \"detour_steps\": [5]}, {\"orders\": [\"LXR\", \"RXL\"], \"period\": 1, \"axis\": \"distance\", \"detour\": \"level\", \"detour_steps\": [0, 2, 7, 10]}, {\"orders\": [\"LRX\"], \"period\": 1, \"axis\": \"step\", \"detour\": \"either\", \"detour_steps\": [5, 8]}, {\"orders\": [\"LXR\"], \"period\": 1, \"axis\": \"step\", \"detour\": \"level\", \"detour_steps\": [1, 3, 6, 9]}, {\"orders\": [\"RLX\"], \"period\": 1, \"axis\": \"step\", \"detour\": \"none\", \"detour_steps\": []}, {\"orders\": [\"RXL\"], \"period\": 1, \"axis\": \"step\", \"detour\": \"none\", \"detour_steps\": []}, {\"orders\": [\"XLR\", \"XRL\"], \"period\": 1, \"axis\": \"front_zeros\", \"detour\": \"either\", \"detour_steps\": [4, 5, 12, 16]}]}}], \"focus\": {\"graph\": \"m9r3-neighbours\", \"parent_score\": -3003, \"archive_best\": -3003}}, \"unverified_reflection_hypotheses\": \"\", \"context_sha256\": \"2f50ffa5fac038e9c365dd3c84c2f23249bc79eae38a147da48be1ff370c81d7\"}", "role": "user"}], "prompt_system_sha": "e6dcb1dc53c824a5", "proposal": 3, "proposer_error": null, "reasoning_tokens": 7172, "repairs_used": null, "score": -1703015.0044, "seconds": 0.24429245901410468, "spec": {"kind": "lift_policy", "name": "preserve geodesics, critical-index detours", "paths": [{"axis": "step", "detour": "uphill", "detour_steps": [5], "orders": ["LRX"], "period": 1}, {"axis": "step", "detour": "level", "detour_steps": [4, 6, 8, 12], "orders": ["LXR"], "period": 1}, {"axis": "step", "detour": "either", "detour_steps": [5, 9, 15], "orders": ["RLX"], "period": 1}, {"axis": "step", "detour": "uphill", "detour_steps": [5, 4, 6, 7], "orders": ["RXL"], "period": 1}, {"axis": "step", "detour": "level", "detour_steps": [0, 2, 5, 8], "orders": ["XLR"], "period": 1}, {"axis": "step", "detour": "either", "detour_steps": [5, 6, 8, 11], "orders": ["XRL"], "period": 1}, {"axis": "step", "detour": "level", "detour_steps": [5, 11], "orders": ["LRX", "XRL"], "period": 1}, {"axis": "distance", "detour": "uphill", "detour_steps": [5, 4, 6, 8], "orders": ["XLR", "RLX"], "period": 2}], "zero_order": "left"}, "status": "discard", "t": 218.88, "tactic": null, "tokens_in": 5511, "tokens_out": 7497, "valid": true}
{"batch": 2, "best_id": 1, "best_score": -1703015.0029, "completed": 3, "eval_seconds": 0.24, "event": "batch", "inflight": 0, "proposals": 3, "propose_seconds": 101.12, "requests": [{"explore_p": null, "focus": "m9r3-neighbours", "island": 0, "mode": "exploit", "parents": [1], "proposal": 3, "tactic": null}], "since_improvement": 1, "t": 218.88, "usage": {"billing_verified": false, "estimated_usd": 0.120578, "failed_requests": 0, "input_tokens": 15325, "max_spend_usd": 2.5, "output_tokens": 15852, "provider_costed_requests": 3, "requests": 3, "usage_overruns": 0}}
