{"attempts": null, "batch": 7, "context": ["focus", "history", "inspirations"], "cost_source": "provider", "cost_usd": 0.06015, "event": "candidate", "explore_p": null, "feasible": false, "feedback": {"complexity": 17, "failures": [{"best_length": 63, "bound": 59, "case": "m9r3-obstruction-6", "defects": [], "generated": 27, "m": 9, "projection_length": 52, "q": 53, "r": 3, "routed": 15, "routing_overhead": 11, "status": "PORTFOLIO_MISS", "v": [2, 1, 0, 0, 0, 9, 8, 7, 6, 5, 4, 3], "word_cap_reached": false}, {"best_length": 62, "bound": 59, "case": "m9r3-neighbours-11", "defects": [], "generated": 27, "m": 9, "projection_length": 51, "q": 53, "r": 3, "routed": 15, "routing_overhead": 11, "status": "PORTFOLIO_MISS", "v": [1, 2, 0, 0, 0, 9, 8, 7, 6, 5, 4, 3], "word_cap_reached": false}, {"best_length": 61, "bound": 59, "case": "m9r3-neighbours-10", "defects": [], "generated": 27, "m": 9, "projection_length": 50, "q": 53, "r": 3, "routed": 12, "routing_overhead": 11, "status": "PORTFOLIO_MISS", "v": [2, 3, 1, 0, 0, 0, 9, 8, 7, 6, 5, 4], "word_cap_reached": false}, {"best_length": 68, "bound": 66, "case": "m9r4-band-edge-12", "defects": [], "generated": 36, "m": 9, "projection_length": 56, "q": 60, "r": 4, "routed": 12, "routing_overhead": 12, "status": "PORTFOLIO_MISS", "v": [8, 7, 9, 6, 5, 4, 3, 2, 1, 0, 0, 0, 0], "word_cap_reached": false}], "families": {"m8r3-neighbours": -1001, "m8r3-obstruction": -1001, "m8r5-antipode-insertions": 0, "m8r9-antipode-insertions": 0, "m9r3-neighbours": -4007, "m9r3-obstruction": -1004, "m9r4-band-edge": -1002}, "graphs": [{"T": 48, "checked": 1, "failures": 1, "feedback": true, "graph": "m8r3-obstruction", "incomplete": 0, "m": 8, "r": 3, "role": "train", "score": -1001, "value_max": 49}, {"T": 48, "checked": 5, "failures": 1, "feedback": true, "graph": "m8r3-neighbours", "incomplete": 0, "m": 8, "r": 3, "role": "train", "score": -1001, "value_max": 49}, {"T": 59, "checked": 1, "failures": 1, "feedback": true, "graph": "m9r3-obstruction", "incomplete": 0, "m": 9, "r": 3, "role": "train", "score": -1004, "value_max": 63}, {"T": 59, "checked": 5, "failures": 4, "feedback": true, "graph": "m9r3-neighbours", "incomplete": 0, "m": 9, "r": 3, "role": "train", "score": -4007, "value_max": 62}, {"T": 66, "checked": 4, "failures": 1, "feedback": true, "graph": "m9r4-band-edge", "incomplete": 0, "m": 9, "r": 4, "role": "train", "score": -1002, "value_max": 68}, {"T": 60, "checked": 6, "failures": 0, "feedback": true, "graph": "m8r5-antipode-insertions", "incomplete": 0, "m": 8, "r": 5, "role": "train", "score": 0, "value_max": 60}, {"T": 84, "checked": 6, "failures": 0, "feedback": true, "graph": "m8r9-antipode-insertions", "incomplete": 0, "m": 8, "r": 9, "role": "train", "score": 0, "value_max": 83}], "interpretation": "A portfolio miss is not a lifting counterexample. Scoring prioritizes fewer misses, then excess, then simpler policies.", "max_excess": 4, "missed": 8, "score": -2274427.0017}, "finish_reason": "stop", "focus": "m8r3-neighbours", "graphs": [{"excess_T": null, "failures": 1, "gap_mean": null, "graph": "m8r3-obstruction", "incomplete": 0, "score": -1001, "value_max": 49}, {"excess_T": null, "failures": 1, "gap_mean": null, "graph": "m8r3-neighbours", "incomplete": 0, "score": -1001, "value_max": 49}, {"excess_T": null, "failures": 1, "gap_mean": null, "graph": "m9r3-obstruction", "incomplete": 0, "score": -1004, "value_max": 63}, {"excess_T": null, "failures": 4, "gap_mean": null, "graph": "m9r3-neighbours", "incomplete": 0, "score": -4007, "value_max": 62}, {"excess_T": null, "failures": 1, "gap_mean": null, "graph": "m9r4-band-edge", "incomplete": 0, "score": -1002, "value_max": 68}, {"excess_T": null, "failures": 0, "gap_mean": null, "graph": "m8r5-antipode-insertions", "incomplete": 0, "score": 0, "value_max": 60}, {"excess_T": null, "failures": 0, "gap_mean": null, "graph": "m8r9-antipode-insertions", "incomplete": 0, "score": 0, "value_max": 83}], "hash": "eea89e382353ed5b", "id": 8, "instances": {"m8r3-neighbours": -1001, "m8r3-obstruction": -1001, "m8r5-antipode-insertions": 0, "m8r9-antipode-insertions": 0, "m9r3-neighbours": -4007, "m9r3-obstruction": -1004, "m9r4-band-edge": -1002}, "island": 0, "kind": "lift_policy", "llm_seconds": 117.28, "mode": "exploit", "model_reasoning": "The user wants me to propose an improved reusable LRX lifting construction policy as a JSON object. I need to understand the problem and craft a better policy than the parent.\n", "model_text": "{\"kind\":\"lift_policy\",\"name\":\"budget-fit routing detours\",\"zero_order\":\"left\",\"paths\":[{\"orders\":[\"LRX\",\"RXL\",\"XLR\"],\"period\":1,\"axis\":\"front_zeros\",\"detour\":\"uphill\",\"detour_steps\":[5]},{\"orders\":[\"LXR\",\"XRL\"],\"period\":2,\"axis\":\"distance\",\"detour\":\"level\",\"detour_steps\":[5,8,11]},{\"orders\":[\"LRX\"],\"period\":1,\"axis\":\"step\",\"detour\":\"none\",\"detour_steps\":[]},{\"orders\":[\"RLX\"],\"period\":1,\"axis\":\"step\",\"detour\":\"none\",\"detour_steps\":[]},{\"orders\":[\"XLR\"],\"period\":1,\"axis\":\"step\",\"detour\":\"none\",\"detour_steps\":[]}]}", "parents": [5], "prompt_messages": [{"content": "{\"task\": \"Propose an improved reusable LRX lifting construction policy.\", \"mode\": \"exploit\", \"parents\": [[{\"kind\": \"lift_policy\", \"name\": \"six geodesics, early critical detours\", \"zero_order\": \"left\", \"paths\": [{\"orders\": [\"LRX\"], \"period\": 1, \"axis\": \"step\", \"detour\": \"uphill\", \"detour_steps\": [5]}, {\"orders\": [\"LXR\"], \"period\": 1, \"axis\": \"step\", \"detour\": \"level\", \"detour_steps\": [4, 6, 8, 12]}, {\"orders\": [\"RLX\"], \"period\": 1, \"axis\": \"step\", \"detour\": \"either\", \"detour_steps\": [5]}, {\"orders\": [\"RXL\"], \"period\": 1, \"axis\": \"step\", \"detour\": \"none\", \"detour_steps\": []}, {\"orders\": [\"XLR\"], \"period\": 1, \"axis\": \"step\", \"detour\": \"none\", \"detour_steps\": []}, {\"orders\": [\"XRL\"], \"period\": 1, \"axis\": \"distance\", \"detour\": \"level\", \"detour_steps\": [5, 7]}]}, {\"score\": -1703015.002, \"missed\": 6, \"max_excess\": 2, \"complexity\": 20, \"families\": {\"m8r3-obstruction\": -1001, \"m8r3-neighbours\": -1001, \"m9r3-obstruction\": -1002, \"m9r3-neighbours\": -3003, \"m9r4-band-edge\": 0, \"m8r5-antipode-insertions\": 0, \"m8r9-antipode-insertions\": 0}, \"graphs\": [{\"graph\": \"m8r3-obstruction\", \"m\": 8, \"r\": 3, \"role\": \"train\", \"feedback\": true, \"checked\": 1, \"failures\": 1, \"incomplete\": 0, \"score\": -1001, \"T\": 48, \"value_max\": 49}, {\"graph\": \"m8r3-neighbours\", \"m\": 8, \"r\": 3, \"role\": \"train\", \"feedback\": true, \"checked\": 5, \"failures\": 1, \"incomplete\": 0, \"score\": -1001, \"T\": 48, \"value_max\": 49}, {\"graph\": \"m9r3-obstruction\", \"m\": 9, \"r\": 3, \"role\": \"train\", \"feedback\": true, \"checked\": 1, \"failures\": 1, \"incomplete\": 0, \"score\": -1002, \"T\": 59, \"value_max\": 61}, {\"graph\": \"m9r3-neighbours\", \"m\": 9, \"r\": 3, \"role\": \"train\", \"feedback\": true, \"checked\": 5, \"failures\": 3, \"incomplete\": 0, \"score\": -3003, \"T\": 59, \"value_max\": 60}, {\"graph\": \"m9r4-band-edge\", \"m\": 9, \"r\": 4, \"role\": \"train\", \"feedback\": true, \"checked\": 4, \"failures\": 0, \"incomplete\": 0, \"score\": 0, \"T\": 66, \"value_max\": 66}, {\"graph\": \"m8r5-antipode-insertions\", \"m\": 8, \"r\": 5, \"role\": \"train\", \"feedback\": true, \"checked\": 6, \"failures\": 0, \"incomplete\": 0, \"score\": 0, \"T\": 60, \"value_max\": 60}, {\"graph\": \"m8r9-antipode-insertions\", \"m\": 8, \"r\": 9, \"role\": \"train\", \"feedback\": true, \"checked\": 6, \"failures\": 0, \"incomplete\": 0, \"score\": 0, \"T\": 84, \"value_max\": 83}], \"failures\": [{\"case\": \"m9r3-obstruction-6\", \"m\": 9, \"r\": 3, \"v\": [2, 1, 0, 0, 0, 9, 8, 7, 6, 5, 4, 3], \"q\": 53, \"bound\": 59, \"status\": \"PORTFOLIO_MISS\", \"generated\": 42, \"routed\": 27, \"word_cap_reached\": false, \"best_length\": 61, \"projection_length\": 52, \"routing_overhead\": 9, \"defects\": []}, {\"case\": \"m8r3-obstruction-0\", \"m\": 8, \"r\": 3, \"v\": [2, 1, 0, 0, 0, 7, 8, 6, 5, 4, 3], \"q\": 43, \"bound\": 48, \"status\": \"PORTFOLIO_MISS\", \"generated\": 42, \"routed\": 18, \"word_cap_reached\": false, \"best_length\": 49, \"projection_length\": 41, \"routing_overhead\": 8, \"defects\": []}, {\"case\": \"m8r3-neighbours-3\", \"m\": 8, \"r\": 3, \"v\": [3, 2, 1, 0, 0, 0, 7, 8, 6, 5, 4], \"q\": 43, \"bound\": 48, \"status\": \"PORTFOLIO_MISS\", \"generated\": 42, \"routed\": 18, \"word_cap_reached\": false, \"best_length\": 49, \"projection_length\": 40, \"routing_overhead\": 9, \"defects\": []}, {\"case\": \"m9r3-neighbours-7\", \"m\": 9, \"r\": 3, \"v\": [1, 0, 0, 0, 9, 8, 7, 6, 5, 4, 3, 2], \"q\": 53, \"bound\": 59, \"status\": \"PORTFOLIO_MISS\", \"generated\": 42, \"routed\": 27, \"word_cap_reached\": false, \"best_length\": 60, \"projection_length\": 51, \"routing_overhead\": 9, \"defects\": []}], \"interpretation\": \"A portfolio miss is not a lifting counterexample. Scoring prioritizes fewer misses, then excess, then simpler policies.\"}]], \"engine_context\": {\"history\": [{\"id\": 7, \"mode\": \"exploit\", \"parents\": [5], \"status\": \"discard\", \"score\": -1703015.0032, \"parent_score\": -1703015.002, \"problem_graphs\": [{\"graph\": \"m8r3-obstruction\", \"score\": -1001, \"failures\": 1}, {\"graph\": \"m8r3-neighbours\", \"score\": -1001, \"failures\": 1}, {\"graph\": \"m9r3-obstruction\", \"score\": -1002, \"failures\": 1}, {\"graph\": \"m9r3-neighbours\", \"score\": -3003, \"failures\": 3}], \"focus\": \"m8r3-neighbours\"}, {\"id\": 6, \"mode\": \"exploit\", \"parents\": [5], \"status\": \"discard\", \"score\": -2268820.0012, \"parent_score\": -1703015.002, \"problem_graphs\": [{\"graph\": \"m8r3-obstruction\", \"score\": -1002, \"failures\": 1}, {\"graph\": \"m8r3-neighbours\", \"score\": -2002, \"failures\": 2}, {\"graph\": \"m9r3-obstruction\", \"score\": -1002, \"failures\": 1}, {\"graph\": \"m9r3-neighbours\", \"score\": -3003, \"failures\": 3}], \"focus\": \"m8r3-neighbours\"}, {\"id\": 5, \"mode\": \"exploit\", \"parents\": [1], \"status\": \"keep\", \"score\": -1703015.002, \"parent_score\": -1703015.0029, \"problem_graphs\": [{\"graph\": \"m8r3-obstruction\", \"score\": -1001, \"failures\": 1}, {\"graph\": \"m8r3-neighbours\", \"score\": -1001, \"failures\": 1}, {\"graph\": \"m9r3-obstruction\", \"score\": -1002, \"failures\": 1}, {\"graph\": \"m9r3-neighbours\", \"score\": -3003, \"failures\": 3}], \"focus\": \"m8r3-neighbours\"}, {\"id\": 4, \"mode\": \"exploit\", \"parents\": [1], \"status\": \"discard\", \"score\": -1708620.0036, \"parent_score\": -1703015.0029, \"problem_graphs\": [{\"graph\": \"m8r3-obstruction\", \"score\": -1001, \"failures\": 1}, {\"graph\": \"m9r3-obstruction\", \"score\": -1004, \"failures\": 1}, {\"graph\": \"m9r3-neighbours\", \"score\": -3003, \"failures\": 3}, {\"graph\": \"m9r4-band-edge\", \"score\": -1002, \"failures\": 1}], \"focus\": \"m9r3-neighbours\"}], \"inspirations\": [{\"id\": 1, \"score\": -1703015.0029, \"graph_scores\": {\"m8r3-obstruction\": -1001, \"m8r3-neighbours\": -1001, \"m9r3-obstruction\": -1002, \"m9r3-neighbours\": -3003, \"m9r4-band-edge\": 0, \"m8r5-antipode-insertions\": 0, \"m8r9-antipode-insertions\": 0}, \"spec\": {\"kind\": \"lift_policy\", \"name\": \"core geodesics plus indexed detours\", \"zero_order\": \"left\", \"paths\": [{\"orders\": [\"LRX\"], \"period\": 1, \"axis\": \"step\", \"detour\": \"uphill\", \"detour_steps\": [5]}, {\"orders\": [\"LXR\"], \"period\": 1, \"axis\": \"step\", \"detour\": \"level\", \"detour_steps\": [4, 6, 8, 12]}, {\"orders\": [\"RLX\"], \"period\": 1, \"axis\": \"step\", \"detour\": \"either\", \"detour_steps\": [5, 9, 15]}, {\"orders\": [\"RXL\"], \"period\": 1, \"axis\": \"step\", \"detour\": \"none\", \"detour_steps\": []}, {\"orders\": [\"XLR\"], \"period\": 1, \"axis\": \"step\", \"detour\": \"none\", \"detour_steps\": []}, {\"orders\": [\"XRL\"], \"period\": 1, \"axis\": \"step\", \"detour\": \"none\", \"detour_steps\": []}, {\"orders\": [\"LRX\", \"XRL\"], \"period\": 1, \"axis\": \"step\", \"detour\": \"level\", \"detour_steps\": [5, 11]}, {\"orders\": [\"XLR\", \"RLX\"], \"period\": 2, \"axis\": \"distance\", \"detour\": \"uphill\", \"detour_steps\": [5]}]}}], \"focus\": {\"graph\": \"m8r3-neighbours\", \"parent_score\": -1001, \"archive_best\": 0}}, \"unverified_reflection_hypotheses\": \"\", \"context_sha256\": \"2f50ffa5fac038e9c365dd3c84c2f23249bc79eae38a147da48be1ff370c81d7\"}", "role": "user"}], "prompt_system_sha": "e6dcb1dc53c824a5", "proposal": 8, "proposer_error": null, "reasoning_tokens": 8211, "repairs_used": null, "score": -2274427.0017, "seconds": 0.11035116700804792, "spec": {"kind": "lift_policy", "name": "budget-fit routing detours", "paths": [{"axis": "front_zeros", "detour": "uphill", "detour_steps": [5], "orders": ["LRX", "RXL", "XLR"], "period": 1}, {"axis": "distance", "detour": "level", "detour_steps": [5, 8, 11], "orders": ["LXR", "XRL"], "period": 2}, {"axis": "step", "detour": "none", "detour_steps": [], "orders": ["LRX"], "period": 1}, {"axis": "step", "detour": "none", "detour_steps": [], "orders": ["RLX"], "period": 1}, {"axis": "step", "detour": "none", "detour_steps": [], "orders": ["XLR"], "period": 1}], "zero_order": "left"}, "status": "discard", "t": 572.42, "tactic": null, "tokens_in": 5721, "tokens_out": 8406, "valid": true}
{"batch": 7, "best_id": 5, "best_score": -1703015.002, "completed": 8, "eval_seconds": 0.11, "event": "batch", "inflight": 0, "proposals": 8, "propose_seconds": 117.28, "requests": [{"explore_p": null, "focus": "m8r3-neighbours", "island": 0, "mode": "exploit", "parents": [5], "proposal": 8, "tactic": null}], "since_improvement": 2, "t": 572.42, "usage": {"billing_verified": false, "estimated_usd": 0.327588, "failed_requests": 0, "input_tokens": 44028, "max_spend_usd": 2.5, "output_tokens": 41938, "provider_costed_requests": 8, "requests": 8, "usage_overruns": 0}}
