{"attempts": null, "batch": 6, "context": ["focus", "history", "inspirations"], "cost_source": "provider", "cost_usd": 0.012664, "event": "candidate", "explore_p": null, "feasible": false, "feedback": {"certified": 2, "failures": [{"base_deficit": 3.0, "case": {"blocks": 4, "id": "k4-mask312-order21771", "mask": 312, "order_index": 21771}, "generated_profiles": [{"base": 61, "gamma": [15, 12, 9, 2]}, {"base": 62, "gamma": [12, 10, 11, 8]}, {"base": 108, "gamma": [19, 22, 25, 11]}, {"base": 137, "gamma": [14, 13, 16, 13]}, {"base": 162, "gamma": [26, 14, 17, 18]}, {"base": 211, "gamma": [30, 33, 17, 22]}, {"base": 235, "gamma": [34, 31, 32, 23]}, {"base": 107, "gamma": [13, 14, 14, 9]}]}, {"base_deficit": 2.4285714285714306, "case": {"blocks": 4, "id": "k4-mask78-order9701", "mask": 78, "order_index": 9701}, "generated_profiles": [{"base": 100, "gamma": [21, 18, 15, 6]}, {"base": 80, "gamma": [12, 11, 13, 10]}, {"base": 83, "gamma": [11, 14, 17, 3]}, {"base": 358, "gamma": [33, 32, 31, 32]}, {"base": 132, "gamma": [21, 20, 12, 13]}, {"base": 156, "gamma": [19, 22, 14, 11]}, {"base": 177, "gamma": [15, 27, 24, 19]}, {"base": 173, "gamma": [20, 17, 18, 16]}]}, {"base_deficit": 1.5, "case": {"blocks": 5, "id": "k5-mask310-order4691", "mask": 310, "order_index": 4691}, "generated_profiles": [{"base": 92, "gamma": [20, 17, 11, 8, 1]}, {"base": 90, "gamma": [11, 10, 11, 14, 9]}, {"base": 100, "gamma": [10, 13, 19, 1, 8]}, {"base": 254, "gamma": [24, 23, 21, 20, 17]}, {"base": 204, "gamma": [25, 24, 19, 22, 23]}, {"base": 245, "gamma": [27, 30, 36, 16, 25]}, {"base": 254, "gamma": [24, 23, 21, 20, 17]}, {"base": 208, "gamma": [16, 28, 26, 23, 14]}]}, {"base_deficit": 1.5, "case": {"blocks": 6, "id": "k6-mask442-order5461", "mask": 442, "order_index": 5461}, "generated_profiles": [{"base": 79, "gamma": [21, 15, 12, 9, 3, 0]}, {"base": 78, "gamma": [10, 13, 10, 7, 5, 8]}, {"base": 92, "gamma": [10, 16, 19, 1, 5, 8]}, {"base": 389, "gamma": [31, 33, 32, 31, 29, 28]}, {"base": 281, "gamma": [29, 31, 23, 22, 24, 27]}, {"base": 230, "gamma": [25, 31, 34, 14, 20, 23]}, {"base": 225, "gamma": [22, 20, 19, 18, 16, 15]}, {"base": 174, "gamma": [13, 26, 23, 20, 14, 11]}]}], "graphs": [{"failures": 4, "feedback": true, "graph": "k4", "role": "train", "score": -4007.211904761905}, {"failures": 7, "feedback": true, "graph": "k5", "role": "train", "score": -7003.857149416241}, {"failures": 7, "feedback": true, "graph": "k6", "role": "train", "score": -7003.353186813187}, {"failures": 9, "feedback": true, "graph": "k7", "role": "train", "score": -9004.62849083162}, {"failures": 5, "feedback": true, "graph": "k8", "role": "train", "score": -5002.668857934181}], "interpretation": "Misses do not prove infeasibility; equal base threshold is insufficient. Every slope must be <=6.", "missed": 32, "score": -108853.71958975714}, "finish_reason": "stop", "focus": "k5", "graphs": [{"excess_T": null, "failures": 4, "gap_mean": null, "graph": "k4", "incomplete": null, "score": -4007.211904761905, "value_max": null}, {"excess_T": null, "failures": 7, "gap_mean": null, "graph": "k5", "incomplete": null, "score": -7003.857149416241, "value_max": null}, {"excess_T": null, "failures": 7, "gap_mean": null, "graph": "k6", "incomplete": null, "score": -7003.353186813187, "value_max": null}, {"excess_T": null, "failures": 9, "gap_mean": null, "graph": "k7", "incomplete": null, "score": -9004.62849083162, "value_max": null}, {"excess_T": null, "failures": 5, "gap_mean": null, "graph": "k8", "incomplete": null, "score": -5002.668857934181, "value_max": null}], "hash": "8e586c82366f4427", "id": 7, "instances": {"k4": -4007.211904761905, "k5": -7003.857149416241, "k6": -7003.353186813187, "k7": -9004.62849083162, "k8": -5002.668857934181}, "island": 0, "kind": "mixture_policy", "llm_seconds": 9.55, "mode": "exploit", "model_reasoning": "The user wants me to return one JSON object for a mixture policy. This is a research optimization task about combinatorial word construction for LRX families - not a disallowed topic. I should produce...", "model_text": "{\"kind\":\"mixture_policy\",\"name\":\"description\",\"rules\":[{\"cuts\":[0,4,8],\"weights\":{\"rotation\":1,\"zero_rotation\":1,\"zero_swap\":0,\"position\":0,\"rank_gap\":0},\"direction\":\"shortest\",\"tie\":\"left\"},{\"cuts\":[1,5,9,13],\"weights\":{\"rotation\":1,\"zero_rotation\":-1,\"zero_swap\":-4,\"position\":2,\"rank_gap\":-6},\"direction\":\"right\",\"tie\":\"left\"},{\"cuts\":[2,6,10,14],\"weights\":{\"rotation\":0,\"zero_rotation\":2,\"zero_swap\":3,\"position\":-2,\"rank_gap\":5},\"direction\":\"left\",\"tie\":\"right\"},{\"cuts\":[3,7,11,15],\"weights\":{\"rotation\":2,\"zero_rotation\":0,\"zero_swap\":-2,\"position\":1,\"rank_gap\":-3},\"direction\":\"shortest\",\"tie\":\"left\"},{\"cuts\":[0,6,12],\"weights\":{\"rotation\":3,\"zero_rotation\":-2,\"zero_swap\":1,\"position\":4,\"rank_gap\":2},\"direction\":\"right\",\"tie\":\"right\"},{\"cuts\":[4,8,16],\"weights\":{\"rotation\":0,\"zero_rotation\":4,\"zero_swap\":-1,\"position\":-3,\"rank_gap\":7},\"direction\":\"left\",\"tie\":\"left\"},{\"cuts\":[1,7,12],\"weights\":{\"rotation\":4,\"zero_rotation\":1,\"zero_swap\":2,\"position\":0,\"rank_gap\":-8},\"direction\":\"shortest\",\"tie\":\"right\"},{\"cuts\":[5,9,13],\"weights\":{\"rotation\":2,\"zero_rotation\":-3,\"zero_swap\":0,\"position\":3,\"rank_gap\":1},\"direction\":\"left\",\"tie\":\"right\"}]}", "parents": [1], "prompt_messages": [{"content": "{\"task\": \"Improve a reusable word-construction policy to certify additional infinite LRX families.\", \"mode\": \"exploit\", \"parents\": [[{\"kind\": \"mixture_policy\", \"name\": \"description\", \"rules\": [{\"cuts\": [0, 5, 11], \"weights\": {\"rotation\": 1, \"zero_rotation\": 2, \"zero_swap\": -2, \"position\": 3, \"rank_gap\": 4}, \"direction\": \"shortest\", \"tie\": \"left\"}, {\"cuts\": [2, 7, 13], \"weights\": {\"rotation\": 2, \"zero_rotation\": -1, \"zero_swap\": 1, \"position\": -3, \"rank_gap\": 6}, \"direction\": \"left\", \"tie\": \"right\"}, {\"cuts\": [1, 6, 10, 15], \"weights\": {\"rotation\": 0, \"zero_rotation\": 4, \"zero_swap\": -4, \"position\": 1, \"rank_gap\": 2}, \"direction\": \"right\", \"tie\": \"left\"}, {\"cuts\": [3, 8, 12], \"weights\": {\"rotation\": 3, \"zero_rotation\": 1, \"zero_swap\": 2, \"position\": 5, \"rank_gap\": -1}, \"direction\": \"shortest\", \"tie\": \"right\"}, {\"cuts\": [4, 9, 14], \"weights\": {\"rotation\": 1, \"zero_rotation\": -3, \"zero_swap\": 0, \"position\": -2, \"rank_gap\": 8}, \"direction\": \"left\", \"tie\": \"left\"}, {\"cuts\": [0, 6, 12], \"weights\": {\"rotation\": 4, \"zero_rotation\": 0, \"zero_swap\": 3, \"position\": 2, \"rank_gap\": 1}, \"direction\": \"right\", \"tie\": \"right\"}]}, {\"score\": -108854.4164446699, \"certified\": 2, \"missed\": 32, \"graphs\": [{\"graph\": \"k4\", \"score\": -4007.211904761905, \"failures\": 4, \"role\": \"train\", \"feedback\": true}, {\"graph\": \"k5\", \"score\": -8005.679004329004, \"failures\": 8, \"role\": \"train\", \"feedback\": true}, {\"graph\": \"k6\", \"score\": -7003.353186813187, \"failures\": 7, \"role\": \"train\", \"feedback\": true}, {\"graph\": \"k7\", \"score\": -8003.503490831618, \"failures\": 8, \"role\": \"train\", \"feedback\": true}, {\"graph\": \"k8\", \"score\": -5002.668857934181, \"failures\": 5, \"role\": \"train\", \"feedback\": true}], \"failures\": [{\"case\": {\"id\": \"k4-mask312-order21771\", \"mask\": 312, \"order_index\": 21771, \"blocks\": 4}, \"base_deficit\": 3.0, \"generated_profiles\": [{\"base\": 61, \"gamma\": [14, 11, 8, 1]}, {\"base\": 86, \"gamma\": [18, 8, 9, 8]}, {\"base\": 61, \"gamma\": [14, 11, 8, 1]}, {\"base\": 187, \"gamma\": [30, 27, 28, 19]}, {\"base\": 113, \"gamma\": [12, 13, 9, 8]}, {\"base\": 131, \"gamma\": [23, 20, 21, 12]}, {\"base\": 111, \"gamma\": [12, 11, 14, 11]}, {\"base\": 109, \"gamma\": [21, 24, 12, 13]}]}, {\"case\": {\"id\": \"k4-mask78-order9701\", \"mask\": 78, \"order_index\": 9701, \"blocks\": 4}, \"base_deficit\": 2.4285714285714306, \"generated_profiles\": [{\"base\": 96, \"gamma\": [18, 15, 12, 5]}, {\"base\": 78, \"gamma\": [16, 13, 11, 6]}, {\"base\": 67, \"gamma\": [6, 14, 11, 2]}, {\"base\": 153, \"gamma\": [13, 25, 22, 17]}, {\"base\": 165, \"gamma\": [20, 17, 18, 16]}, {\"base\": 216, \"gamma\": [35, 32, 29, 24]}, {\"base\": 140, \"gamma\": [15, 14, 13, 14]}, {\"base\": 129, \"gamma\": [23, 22, 25, 15]}]}, {\"case\": {\"id\": \"k5-mask310-order4691\", \"mask\": 310, \"order_index\": 4691, \"blocks\": 5}, \"base_deficit\": 1.5, \"generated_profiles\": [{\"base\": 98, \"gamma\": [20, 17, 11, 10, 1]}, {\"base\": 98, \"gamma\": [13, 12, 13, 12, 11]}, {\"base\": 66, \"gamma\": [6, 14, 8, 5, 4]}, {\"base\": 156, \"gamma\": [12, 24, 22, 19, 10]}, {\"base\": 151, \"gamma\": [17, 14, 16, 12, 15]}, {\"base\": 162, \"gamma\": [30, 27, 21, 18, 9]}, {\"base\": 124, \"gamma\": [14, 13, 11, 10, 7]}, {\"base\": 163, \"gamma\": [22, 21, 12, 15, 20]}]}, {\"case\": {\"id\": \"k6-mask442-order5461\", \"mask\": 442, \"order_index\": 5461, \"blocks\": 6}, \"base_deficit\": 1.5, \"generated_profiles\": [{\"base\": 77, \"gamma\": [20, 14, 11, 8, 2, 1]}, {\"base\": 119, \"gamma\": [14, 18, 10, 7, 7, 10]}, {\"base\": 52, \"gamma\": [5, 12, 9, 6, 0, 3]}, {\"base\": 174, \"gamma\": [13, 26, 23, 20, 14, 11]}, {\"base\": 146, \"gamma\": [12, 14, 15, 11, 9, 10]}, {\"base\": 183, \"gamma\": [32, 26, 23, 20, 14, 11]}, {\"base\": 207, \"gamma\": [18, 20, 19, 18, 16, 15]}, {\"base\": 133, \"gamma\": [16, 22, 10, 9, 11, 14]}]}], \"interpretation\": \"Misses do not prove infeasibility; equal base threshold is insufficient. Every slope must be <=6.\"}]], \"engine_context\": {\"history\": [{\"id\": 6, \"mode\": \"exploit\", \"parents\": [1], \"status\": \"discard\", \"score\": -115657.60811133657, \"parent_score\": -108854.4164446699, \"problem_graphs\": [{\"graph\": \"k4\", \"score\": -4007.211904761905, \"failures\": 4}, {\"graph\": \"k5\", \"score\": -8005.679004329004, \"failures\": 8}, {\"graph\": \"k6\", \"score\": -7003.353186813187, \"failures\": 7}, {\"graph\": \"k7\", \"score\": -9004.62849083162, \"failures\": 9}], \"focus\": \"k5\"}, {\"id\": 5, \"mode\": \"exploit\", \"parents\": [1], \"status\": \"discard\", \"score\": -112256.09700022545, \"parent_score\": -108854.4164446699, \"problem_graphs\": [{\"graph\": \"k4\", \"score\": -4007.211904761905, \"failures\": 4}, {\"graph\": \"k5\", \"score\": -8005.2345598845595, \"failures\": 8}, {\"graph\": \"k6\", \"score\": -7003.353186813187, \"failures\": 7}, {\"graph\": \"k7\", \"score\": -9004.62849083162, \"failures\": 9}], \"focus\": \"k5\"}, {\"id\": 4, \"mode\": \"exploit\", \"parents\": [1], \"status\": \"discard\", \"score\": -115657.60811133657, \"parent_score\": -108854.4164446699, \"problem_graphs\": [{\"graph\": \"k4\", \"score\": -4007.211904761905, \"failures\": 4}, {\"graph\": \"k5\", \"score\": -8005.679004329004, \"failures\": 8}, {\"graph\": \"k6\", \"score\": -7003.353186813187, \"failures\": 7}, {\"graph\": \"k7\", \"score\": -9004.62849083162, \"failures\": 9}], \"focus\": \"k5\"}], \"inspirations\": [{\"id\": 5, \"score\": -112256.09700022545, \"graph_scores\": {\"k4\": -4007.211904761905, \"k5\": -8005.2345598845595, \"k6\": -7003.353186813187, \"k7\": -9004.62849083162, \"k8\": -5002.668857934181}, \"spec\": {\"kind\": \"mixture_policy\", \"name\": \"description\", \"rules\": [{\"cuts\": [0, 4, 8], \"weights\": {\"rotation\": 1, \"zero_rotation\": 1, \"zero_swap\": 0, \"position\": 0, \"rank_gap\": 0}, \"direction\": \"shortest\", \"tie\": \"left\"}, {\"cuts\": [1, 5, 9, 13], \"weights\": {\"rotation\": 2, \"zero_rotation\": -2, \"zero_swap\": 4, \"position\": 1, \"rank_gap\": 6}, \"direction\": \"left\", \"tie\": \"left\"}, {\"cuts\": [2, 6, 11], \"weights\": {\"rotation\": 0, \"zero_rotation\": 3, \"zero_swap\": -3, \"position\": -1, \"rank_gap\": 5}, \"direction\": \"right\", \"tie\": \"right\"}, {\"cuts\": [3, 7, 12, 16], \"weights\": {\"rotation\": 3, \"zero_rotation\": 0, \"zero_swap\": 2, \"position\": 4, \"rank_gap\": 1}, \"direction\": \"shortest\", \"tie\": \"right\"}, {\"cuts\": [0, 6, 10], \"weights\": {\"rotation\": 1, \"zero_rotation\": -4, \"zero_swap\": 1, \"position\": -2, \"rank_gap\": 8}, \"direction\": \"left\", \"tie\": \"left\"}, {\"cuts\": [4, 8, 14], \"weights\": {\"rotation\": 4, \"zero_rotation\": 2, \"zero_swap\": -1, \"position\": 3, \"rank_gap\": 2}, \"direction\": \"right\", \"tie\": \"left\"}, {\"cuts\": [1, 8, 15], \"weights\": {\"rotation\": 0, \"zero_rotation\": 1, \"zero_swap\": 5, \"position\": -4, \"rank_gap\": 3}, \"direction\": \"shortest\", \"tie\": \"right\"}, {\"cuts\": [5, 9, 12], \"weights\": {\"rotation\": 2, \"zero_rotation\": -1, \"zero_swap\": -2, \"position\": 2, \"rank_gap\": 7}, \"direction\": \"left\", \"tie\": \"right\"}]}}], \"focus\": {\"graph\": \"k5\", \"parent_score\": -8005.679004329004, \"archive_best\": -8005.2345598845595}}, \"unverified_hypotheses\": \"\", \"context_sha256\": \"83a280095959be0ee17113ba4e6fea85215d14e850cdceb1550146f143ccdbe3\"}", "role": "user"}], "prompt_system_sha": "5823c3ab836265bb", "proposal": 7, "proposer_error": null, "reasoning_tokens": 301, "repairs_used": null, "score": -108853.71958975714, "seconds": 0.32076137501280755, "spec": {"kind": "mixture_policy", "name": "description", "rules": [{"cuts": [0, 4, 8], "direction": "shortest", "tie": "left", "weights": {"position": 0, "rank_gap": 0, "rotation": 1, "zero_rotation": 1, "zero_swap": 0}}, {"cuts": [1, 5, 9, 13], "direction": "right", "tie": "left", "weights": {"position": 2, "rank_gap": -6, "rotation": 1, "zero_rotation": -1, "zero_swap": -4}}, {"cuts": [2, 6, 10, 14], "direction": "left", "tie": "right", "weights": {"position": -2, "rank_gap": 5, "rotation": 0, "zero_rotation": 2, "zero_swap": 3}}, {"cuts": [3, 7, 11, 15], "direction": "shortest", "tie": "left", "weights": {"position": 1, "rank_gap": -3, "rotation": 2, "zero_rotation": 0, "zero_swap": -2}}, {"cuts": [0, 6, 12], "direction": "right", "tie": "right", "weights": {"position": 4, "rank_gap": 2, "rotation": 3, "zero_rotation": -2, "zero_swap": 1}}, {"cuts": [4, 8, 16], "direction": "left", "tie": "left", "weights": {"position": -3, "rank_gap": 7, "rotation": 0, "zero_rotation": 4, "zero_swap": -1}}, {"cuts": [1, 7, 12], "direction": "shortest", "tie": "right", "weights": {"position": 0, "rank_gap": -8, "rotation": 4, "zero_rotation": 1, "zero_swap": 2}}, {"cuts": [5, 9, 13], "direction": "left", "tie": "right", "weights": {"position": 3, "rank_gap": 1, "rotation": 2, "zero_rotation": -3, "zero_swap": 0}}]}, "status": "keep", "t": 82.64, "tactic": null, "tokens_in": 5021, "tokens_out": 725, "valid": true}
{"batch": 6, "best_id": 7, "best_score": -108853.71958975714, "completed": 7, "eval_seconds": 0.32, "event": "batch", "inflight": 0, "proposals": 7, "propose_seconds": 9.56, "requests": [{"explore_p": null, "focus": "k5", "island": 0, "mode": "exploit", "parents": [1], "proposal": 7, "tactic": null}], "since_improvement": 5, "t": 82.64, "usage": {"billing_verified": false, "estimated_usd": 0.08718, "failed_requests": 0, "input_tokens": 30987, "max_spend_usd": 2.0, "output_tokens": 6217, "provider_costed_requests": 7, "requests": 7, "usage_overruns": 0}}
