{"config": {"async": false, "batch": 1, "engine": "sequential", "eval_cache": null, "eval_workers": 1, "explore_max": 0.7, "feedback_potential": true, "feedback_words": false, "final_heldout_top": 0, "focus": true, "gepa_n": 1, "history": 3, "insights_file": null, "inspirations": 1, "island_size": 6, "islands": 3, "kinds": ["mixture_policy"], "max_merges": 5, "max_proposals": 12, "max_wall_seconds": 1800, "merge_prob": 1.0, "migration_every": 12, "provider": {"api_key_env": "XAI_API_KEY", "base_url": "https://api.x.ai/v1", "idle_timeout_sec": 120, "input_usd_per_mtok": 2.2, "max_output_tokens": 2200, "max_reasoning_tokens": 16000, "max_requests": 18, "max_spend_usd": 2, "model": "grok-4.7", "output_usd_per_mtok": 6.6, "reasoning_effort": "low", "repairs": 0, "timeout_sec": 360, "type": "openai_compatible"}, "refine_mode": "exploit", "reflector": null, "seed": 409, "seeds": ["autoresearch/loop-260924-optimizer/seed.json"], "select": "score", "split": "train", "stagnation": 12, "strategy": null, "tactic_trials": 3, "tactics": false, "ucb_c": 1.4142135623730951, "ucb_decay": 0.9, "window": 3}, "evaluator_sha256": "fd9ce7b1ed0eff0e", "event": "start", "git_commit": "139eeb1d037300f556eefcd402d1b1339ec9bfb1", "t": 0.02}
{"event": "candidate", "feasible": false, "feedback": {"certified": 0, "failures": [{"base_deficit": 3.0, "case": {"blocks": 4, "id": "k4-mask312-order21771", "mask": 312, "order_index": 21771}, "generated_profiles": [{"base": 61, "gamma": [15, 12, 9, 2]}, {"base": 60, "gamma": [11, 9, 10, 7]}, {"base": 108, "gamma": [18, 21, 24, 10]}]}, {"base_deficit": 2.4285714285714306, "case": {"blocks": 4, "id": "k4-mask78-order9701", "mask": 78, "order_index": 9701}, "generated_profiles": [{"base": 94, "gamma": [19, 16, 13, 4]}, {"base": 86, "gamma": [11, 10, 14, 11]}, {"base": 73, "gamma": [11, 14, 17, 3]}]}, {"base_deficit": 1.5, "case": {"blocks": 5, "id": "k5-mask310-order4691", "mask": 310, "order_index": 4691}, "generated_profiles": [{"base": 90, "gamma": [20, 17, 11, 8, 1]}, {"base": 88, "gamma": [11, 10, 11, 14, 9]}, {"base": 97, "gamma": [9, 12, 18, 2, 9]}]}, {"base_deficit": 1.5, "case": {"blocks": 6, "id": "k6-mask442-order5461", "mask": 442, "order_index": 5461}, "generated_profiles": [{"base": 83, "gamma": [21, 15, 12, 9, 3, 2]}, {"base": 72, "gamma": [9, 12, 9, 6, 4, 7]}, {"base": 88, "gamma": [11, 15, 18, 2, 6, 9]}]}], "graphs": [{"failures": 4, "feedback": true, "graph": "k4", "role": "train", "score": -4007.211904761905}, {"failures": 8, "feedback": true, "graph": "k5", "role": "train", "score": -8005.679004329004}, {"failures": 7, "feedback": true, "graph": "k6", "role": "train", "score": -7003.353186813187}, {"failures": 9, "feedback": true, "graph": "k7", "role": "train", "score": -9004.62849083162}, {"failures": 6, "feedback": true, "graph": "k8", "role": "train", "score": -6002.735524600847}], "interpretation": "Misses do not prove infeasibility; equal base threshold is insufficient. Every slope must be <=6.", "missed": 34, "score": -115657.60811133657}, "graphs": [{"excess_T": null, "failures": 4, "gap_mean": null, "graph": "k4", "incomplete": null, "score": -4007.211904761905, "value_max": null}, {"excess_T": null, "failures": 8, "gap_mean": null, "graph": "k5", "incomplete": null, "score": -8005.679004329004, "value_max": null}, {"excess_T": null, "failures": 7, "gap_mean": null, "graph": "k6", "incomplete": null, "score": -7003.353186813187, "value_max": null}, {"excess_T": null, "failures": 9, "gap_mean": null, "graph": "k7", "incomplete": null, "score": -9004.62849083162, "value_max": null}, {"excess_T": null, "failures": 6, "gap_mean": null, "graph": "k8", "incomplete": null, "score": -6002.735524600847, "value_max": null}], "hash": "d2ab64cf63614a4e", "id": 0, "instances": {"k4": -4007.211904761905, "k5": -8005.679004329004, "k6": -7003.353186813187, "k7": -9004.62849083162, "k8": -6002.735524600847}, "island": null, "kind": "mixture_policy", "mode": "seed", "parents": [], "score": -115657.60811133657, "seconds": 0.06954754100297578, "source": "autoresearch/loop-260924-optimizer/seed.json", "spec": {"kind": "mixture_policy", "name": "nearest adjacent inversion, three cuts", "rules": [{"cuts": [0, 4, 8], "direction": "shortest", "tie": "left", "weights": {"position": 0, "rank_gap": 0, "rotation": 1, "zero_rotation": 0, "zero_swap": 0}}]}, "status": "keep", "t": 0.09, "valid": true}
{"attempts": null, "batch": 0, "context": ["focus"], "cost_source": "provider", "cost_usd": 0.009296, "event": "candidate", "explore_p": null, "feasible": false, "feedback": {"certified": 2, "failures": [{"base_deficit": 3.0, "case": {"blocks": 4, "id": "k4-mask312-order21771", "mask": 312, "order_index": 21771}, "generated_profiles": [{"base": 61, "gamma": [14, 11, 8, 1]}, {"base": 86, "gamma": [18, 8, 9, 8]}, {"base": 61, "gamma": [14, 11, 8, 1]}, {"base": 187, "gamma": [30, 27, 28, 19]}, {"base": 113, "gamma": [12, 13, 9, 8]}, {"base": 131, "gamma": [23, 20, 21, 12]}, {"base": 111, "gamma": [12, 11, 14, 11]}, {"base": 109, "gamma": [21, 24, 12, 13]}]}, {"base_deficit": 2.4285714285714306, "case": {"blocks": 4, "id": "k4-mask78-order9701", "mask": 78, "order_index": 9701}, "generated_profiles": [{"base": 96, "gamma": [18, 15, 12, 5]}, {"base": 78, "gamma": [16, 13, 11, 6]}, {"base": 67, "gamma": [6, 14, 11, 2]}, {"base": 153, "gamma": [13, 25, 22, 17]}, {"base": 165, "gamma": [20, 17, 18, 16]}, {"base": 216, "gamma": [35, 32, 29, 24]}, {"base": 140, "gamma": [15, 14, 13, 14]}, {"base": 129, "gamma": [23, 22, 25, 15]}]}, {"base_deficit": 1.5, "case": {"blocks": 5, "id": "k5-mask310-order4691", "mask": 310, "order_index": 4691}, "generated_profiles": [{"base": 98, "gamma": [20, 17, 11, 10, 1]}, {"base": 98, "gamma": [13, 12, 13, 12, 11]}, {"base": 66, "gamma": [6, 14, 8, 5, 4]}, {"base": 156, "gamma": [12, 24, 22, 19, 10]}, {"base": 151, "gamma": [17, 14, 16, 12, 15]}, {"base": 162, "gamma": [30, 27, 21, 18, 9]}, {"base": 124, "gamma": [14, 13, 11, 10, 7]}, {"base": 163, "gamma": [22, 21, 12, 15, 20]}]}, {"base_deficit": 1.5, "case": {"blocks": 6, "id": "k6-mask442-order5461", "mask": 442, "order_index": 5461}, "generated_profiles": [{"base": 77, "gamma": [20, 14, 11, 8, 2, 1]}, {"base": 119, "gamma": [14, 18, 10, 7, 7, 10]}, {"base": 52, "gamma": [5, 12, 9, 6, 0, 3]}, {"base": 174, "gamma": [13, 26, 23, 20, 14, 11]}, {"base": 146, "gamma": [12, 14, 15, 11, 9, 10]}, {"base": 183, "gamma": [32, 26, 23, 20, 14, 11]}, {"base": 207, "gamma": [18, 20, 19, 18, 16, 15]}, {"base": 133, "gamma": [16, 22, 10, 9, 11, 14]}]}], "graphs": [{"failures": 4, "feedback": true, "graph": "k4", "role": "train", "score": -4007.211904761905}, {"failures": 8, "feedback": true, "graph": "k5", "role": "train", "score": -8005.679004329004}, {"failures": 7, "feedback": true, "graph": "k6", "role": "train", "score": -7003.353186813187}, {"failures": 8, "feedback": true, "graph": "k7", "role": "train", "score": -8003.503490831618}, {"failures": 5, "feedback": true, "graph": "k8", "role": "train", "score": -5002.668857934181}], "interpretation": "Misses do not prove infeasibility; equal base threshold is insufficient. Every slope must be <=6.", "missed": 32, "score": -108854.4164446699}, "finish_reason": "stop", "focus": "k7", "graphs": [{"excess_T": null, "failures": 4, "gap_mean": null, "graph": "k4", "incomplete": null, "score": -4007.211904761905, "value_max": null}, {"excess_T": null, "failures": 8, "gap_mean": null, "graph": "k5", "incomplete": null, "score": -8005.679004329004, "value_max": null}, {"excess_T": null, "failures": 7, "gap_mean": null, "graph": "k6", "incomplete": null, "score": -7003.353186813187, "value_max": null}, {"excess_T": null, "failures": 8, "gap_mean": null, "graph": "k7", "incomplete": null, "score": -8003.503490831618, "value_max": null}, {"excess_T": null, "failures": 5, "gap_mean": null, "graph": "k8", "incomplete": null, "score": -5002.668857934181, "value_max": null}], "hash": "f29c4520e4bd051b", "id": 1, "instances": {"k4": -4007.211904761905, "k5": -8005.679004329004, "k6": -7003.353186813187, "k7": -8003.503490831618, "k8": -5002.668857934181}, "island": 0, "kind": "mixture_policy", "llm_seconds": 9.25, "mode": "exploit", "model_reasoning": "The user wants me to return one JSON object matching a specific schema for a mixture_policy. This appears to be a research optimization task about constructing words for LRX families - mathematical co...", "model_text": "{\"kind\":\"mixture_policy\",\"name\":\"description\",\"rules\":[{\"cuts\":[0,5,11],\"weights\":{\"rotation\":1,\"zero_rotation\":2,\"zero_swap\":-2,\"position\":3,\"rank_gap\":4},\"direction\":\"shortest\",\"tie\":\"left\"},{\"cuts\":[2,7,13],\"weights\":{\"rotation\":2,\"zero_rotation\":-1,\"zero_swap\":1,\"position\":-3,\"rank_gap\":6},\"direction\":\"left\",\"tie\":\"right\"},{\"cuts\":[1,6,10,15],\"weights\":{\"rotation\":0,\"zero_rotation\":4,\"zero_swap\":-4,\"position\":1,\"rank_gap\":2},\"direction\":\"right\",\"tie\":\"left\"},{\"cuts\":[3,8,12],\"weights\":{\"rotation\":3,\"zero_rotation\":1,\"zero_swap\":2,\"position\":5,\"rank_gap\":-1},\"direction\":\"shortest\",\"tie\":\"right\"},{\"cuts\":[4,9,14],\"weights\":{\"rotation\":1,\"zero_rotation\":-3,\"zero_swap\":0,\"position\":-2,\"rank_gap\":8},\"direction\":\"left\",\"tie\":\"left\"},{\"cuts\":[0,6,12],\"weights\":{\"rotation\":4,\"zero_rotation\":0,\"zero_swap\":3,\"position\":2,\"rank_gap\":1},\"direction\":\"right\",\"tie\":\"right\"}]}", "parents": [0], "prompt_messages": [{"content": "{\"task\": \"Improve a reusable word-construction policy to certify additional infinite LRX families.\", \"mode\": \"exploit\", \"parents\": [[{\"kind\": \"mixture_policy\", \"name\": \"nearest adjacent inversion, three cuts\", \"rules\": [{\"cuts\": [0, 4, 8], \"weights\": {\"rotation\": 1, \"zero_rotation\": 0, \"zero_swap\": 0, \"position\": 0, \"rank_gap\": 0}, \"direction\": \"shortest\", \"tie\": \"left\"}]}, {\"score\": -115657.60811133657, \"certified\": 0, \"missed\": 34, \"graphs\": [{\"graph\": \"k4\", \"score\": -4007.211904761905, \"failures\": 4, \"role\": \"train\", \"feedback\": true}, {\"graph\": \"k5\", \"score\": -8005.679004329004, \"failures\": 8, \"role\": \"train\", \"feedback\": true}, {\"graph\": \"k6\", \"score\": -7003.353186813187, \"failures\": 7, \"role\": \"train\", \"feedback\": true}, {\"graph\": \"k7\", \"score\": -9004.62849083162, \"failures\": 9, \"role\": \"train\", \"feedback\": true}, {\"graph\": \"k8\", \"score\": -6002.735524600847, \"failures\": 6, \"role\": \"train\", \"feedback\": true}], \"failures\": [{\"case\": {\"id\": \"k4-mask312-order21771\", \"mask\": 312, \"order_index\": 21771, \"blocks\": 4}, \"base_deficit\": 3.0, \"generated_profiles\": [{\"base\": 61, \"gamma\": [15, 12, 9, 2]}, {\"base\": 60, \"gamma\": [11, 9, 10, 7]}, {\"base\": 108, \"gamma\": [18, 21, 24, 10]}]}, {\"case\": {\"id\": \"k4-mask78-order9701\", \"mask\": 78, \"order_index\": 9701, \"blocks\": 4}, \"base_deficit\": 2.4285714285714306, \"generated_profiles\": [{\"base\": 94, \"gamma\": [19, 16, 13, 4]}, {\"base\": 86, \"gamma\": [11, 10, 14, 11]}, {\"base\": 73, \"gamma\": [11, 14, 17, 3]}]}, {\"case\": {\"id\": \"k5-mask310-order4691\", \"mask\": 310, \"order_index\": 4691, \"blocks\": 5}, \"base_deficit\": 1.5, \"generated_profiles\": [{\"base\": 90, \"gamma\": [20, 17, 11, 8, 1]}, {\"base\": 88, \"gamma\": [11, 10, 11, 14, 9]}, {\"base\": 97, \"gamma\": [9, 12, 18, 2, 9]}]}, {\"case\": {\"id\": \"k6-mask442-order5461\", \"mask\": 442, \"order_index\": 5461, \"blocks\": 6}, \"base_deficit\": 1.5, \"generated_profiles\": [{\"base\": 83, \"gamma\": [21, 15, 12, 9, 3, 2]}, {\"base\": 72, \"gamma\": [9, 12, 9, 6, 4, 7]}, {\"base\": 88, \"gamma\": [11, 15, 18, 2, 6, 9]}]}], \"interpretation\": \"Misses do not prove infeasibility; equal base threshold is insufficient. Every slope must be <=6.\"}]], \"engine_context\": {\"focus\": {\"graph\": \"k7\", \"parent_score\": -9004.62849083162, \"archive_best\": -9004.62849083162}}, \"unverified_hypotheses\": \"\", \"context_sha256\": \"83a280095959be0ee17113ba4e6fea85215d14e850cdceb1550146f143ccdbe3\"}", "role": "user"}], "prompt_system_sha": "5823c3ab836265bb", "proposal": 1, "proposer_error": null, "reasoning_tokens": 477, "repairs_used": null, "score": -108854.4164446699, "seconds": 0.22619791599572636, "spec": {"kind": "mixture_policy", "name": "description", "rules": [{"cuts": [0, 5, 11], "direction": "shortest", "tie": "left", "weights": {"position": 3, "rank_gap": 4, "rotation": 1, "zero_rotation": 2, "zero_swap": -2}}, {"cuts": [2, 7, 13], "direction": "left", "tie": "right", "weights": {"position": -3, "rank_gap": 6, "rotation": 2, "zero_rotation": -1, "zero_swap": 1}}, {"cuts": [1, 6, 10, 15], "direction": "right", "tie": "left", "weights": {"position": 1, "rank_gap": 2, "rotation": 0, "zero_rotation": 4, "zero_swap": -4}}, {"cuts": [3, 8, 12], "direction": "shortest", "tie": "right", "weights": {"position": 5, "rank_gap": -1, "rotation": 3, "zero_rotation": 1, "zero_swap": 2}}, {"cuts": [4, 9, 14], "direction": "left", "tie": "left", "weights": {"position": -2, "rank_gap": 8, "rotation": 1, "zero_rotation": -3, "zero_swap": 0}}, {"cuts": [0, 6, 12], "direction": "right", "tie": "right", "weights": {"position": 2, "rank_gap": 1, "rotation": 4, "zero_rotation": 0, "zero_swap": 3}}]}, "status": "keep", "t": 9.57, "tactic": null, "tokens_in": 3127, "tokens_out": 795, "valid": true}
{"batch": 0, "best_id": 1, "best_score": -108854.4164446699, "completed": 1, "eval_seconds": 0.23, "event": "batch", "inflight": 0, "proposals": 1, "propose_seconds": 9.25, "requests": [{"explore_p": null, "focus": "k7", "island": 0, "mode": "exploit", "parents": [0], "proposal": 1, "tactic": null}], "since_improvement": 0, "t": 9.57, "usage": {"billing_verified": false, "estimated_usd": 0.009296, "failed_requests": 0, "input_tokens": 3127, "max_spend_usd": 2.0, "output_tokens": 795, "provider_costed_requests": 1, "requests": 1, "usage_overruns": 0}}
