{"attempts": null, "batch": 7, "context": ["focus", "history", "inspirations"], "cost_source": "provider", "cost_usd": 0.012132, "event": "candidate", "explore_p": null, "feasible": false, "feedback": {"certified": 1, "failures": [{"base_deficit": 3.0, "case": {"blocks": 4, "id": "k4-mask312-order21771", "mask": 312, "order_index": 21771}, "generated_profiles": [{"base": 83, "gamma": [16, 15, 14, 5]}, {"base": 83, "gamma": [15, 14, 15, 6]}, {"base": 97, "gamma": [17, 20, 4, 9]}, {"base": 199, "gamma": [31, 28, 29, 20]}, {"base": 220, "gamma": [24, 24, 25, 20]}, {"base": 179, "gamma": [18, 19, 15, 14]}, {"base": 101, "gamma": [11, 10, 13, 10]}, {"base": 109, "gamma": [21, 24, 12, 13]}]}, {"base_deficit": 2.4285714285714306, "case": {"blocks": 4, "id": "k4-mask78-order9701", "mask": 78, "order_index": 9701}, "generated_profiles": [{"base": 106, "gamma": [24, 21, 18, 9]}, {"base": 77, "gamma": [11, 15, 12, 7]}, {"base": 99, "gamma": [18, 15, 18, 10]}, {"base": 177, "gamma": [15, 27, 24, 19]}, {"base": 118, "gamma": [15, 12, 16, 11]}, {"base": 132, "gamma": [13, 14, 18, 9]}, {"base": 130, "gamma": [14, 13, 12, 13]}, {"base": 129, "gamma": [23, 22, 25, 15]}]}, {"base_deficit": 1.5, "case": {"blocks": 5, "id": "k5-mask310-order4691", "mask": 310, "order_index": 4691}, "generated_profiles": [{"base": 101, "gamma": [23, 20, 14, 11, 2]}, {"base": 98, "gamma": [12, 16, 18, 15, 8]}, {"base": 128, "gamma": [18, 15, 21, 7, 16]}, {"base": 101, "gamma": [23, 20, 14, 11, 2]}, {"base": 292, "gamma": [22, 34, 32, 29, 20]}, {"base": 178, "gamma": [19, 16, 21, 22, 17]}, {"base": 143, "gamma": [13, 14, 16, 8, 11]}, {"base": 162, "gamma": [30, 27, 21, 18, 9]}]}, {"base_deficit": 1.5, "case": {"blocks": 6, "id": "k6-mask442-order5461", "mask": 442, "order_index": 5461}, "generated_profiles": [{"base": 103, "gamma": [22, 18, 17, 12, 6, 3]}, {"base": 86, "gamma": [5, 12, 11, 12, 8, 5]}, {"base": 114, "gamma": [16, 18, 21, 7, 7, 10]}, {"base": 88, "gamma": [11, 14, 11, 8, 6, 7]}, {"base": 188, "gamma": [14, 27, 24, 21, 15, 12]}, {"base": 259, "gamma": [23, 21, 25, 22, 20, 21]}, {"base": 204, "gamma": [17, 19, 20, 12, 14, 15]}, {"base": 189, "gamma": [32, 26, 23, 20, 14, 11]}]}], "graphs": [{"failures": 4, "feedback": true, "graph": "k4", "role": "train", "score": -4007.211904761905}, {"failures": 7, "feedback": true, "graph": "k5", "role": "train", "score": -7004.2345598845595}, {"failures": 7, "feedback": true, "graph": "k6", "role": "train", "score": -7003.353186813187}, {"failures": 9, "feedback": true, "graph": "k7", "role": "train", "score": -9004.62849083162}, {"failures": 6, "feedback": true, "graph": "k8", "role": "train", "score": -6002.735524600847}], "interpretation": "Misses do not prove infeasibility; equal base threshold is insufficient. Every slope must be <=6.", "missed": 33, "score": -112255.16366689211}, "finish_reason": "stop", "focus": "k7", "graphs": [{"excess_T": null, "failures": 4, "gap_mean": null, "graph": "k4", "incomplete": null, "score": -4007.211904761905, "value_max": null}, {"excess_T": null, "failures": 7, "gap_mean": null, "graph": "k5", "incomplete": null, "score": -7004.2345598845595, "value_max": null}, {"excess_T": null, "failures": 7, "gap_mean": null, "graph": "k6", "incomplete": null, "score": -7003.353186813187, "value_max": null}, {"excess_T": null, "failures": 9, "gap_mean": null, "graph": "k7", "incomplete": null, "score": -9004.62849083162, "value_max": null}, {"excess_T": null, "failures": 6, "gap_mean": null, "graph": "k8", "incomplete": null, "score": -6002.735524600847, "value_max": null}], "hash": "101565772a9dc147", "id": 8, "instances": {"k4": -4007.211904761905, "k5": -7004.2345598845595, "k6": -7003.353186813187, "k7": -9004.62849083162, "k8": -6002.735524600847}, "island": 0, "kind": "mixture_policy", "llm_seconds": 7.93, "mode": "exploit", "model_reasoning": "The user wants me to return a JSON object for a mixture_policy. This is a mathematical research optimization task about word construction policies for LRX families. I need to output one JSON object ma...", "model_text": "{\"kind\":\"mixture_policy\",\"name\":\"description\",\"rules\":[{\"cuts\":[0,3,7,12],\"weights\":{\"rotation\":1,\"zero_rotation\":-2,\"zero_swap\":-6,\"position\":1,\"rank_gap\":-4},\"direction\":\"shortest\",\"tie\":\"left\"},{\"cuts\":[2,5,9,14],\"weights\":{\"rotation\":0,\"zero_rotation\":3,\"zero_swap\":2,\"position\":-1,\"rank_gap\":6},\"direction\":\"left\",\"tie\":\"right\"},{\"cuts\":[1,6,11],\"weights\":{\"rotation\":2,\"zero_rotation\":1,\"zero_swap\":-3,\"position\":4,\"rank_gap\":-2},\"direction\":\"right\",\"tie\":\"left\"},{\"cuts\":[4,8,13,16],\"weights\":{\"rotation\":3,\"zero_rotation\":-1,\"zero_swap\":1,\"position\":-4,\"rank_gap\":5},\"direction\":\"shortest\",\"tie\":\"right\"},{\"cuts\":[0,8],\"weights\":{\"rotation\":1,\"zero_rotation\":4,\"zero_swap\":0,\"position\":2,\"rank_gap\":-8},\"direction\":\"left\",\"tie\":\"left\"},{\"cuts\":[3,10,15],\"weights\":{\"rotation\":4,\"zero_rotation\":-3,\"zero_swap\":-1,\"position\":0,\"rank_gap\":3},\"direction\":\"right\",\"tie\":\"right\"},{\"cuts\":[5,9,12],\"weights\":{\"rotation\":0,\"zero_rotation\":2,\"zero_swap\":5,\"position\":-2,\"rank_gap\":1},\"direction\":\"shortest\",\"tie\":\"left\"},{\"cuts\":[6,11,14],\"weights\":{\"rotation\":2,\"zero_rotation\":0,\"zero_swap\":-5,\"position\":3,\"rank_gap\":-6},\"direction\":\"left\",\"tie\":\"right\"}]}", "parents": [7], "prompt_messages": [{"content": "{\"task\": \"Improve a reusable word-construction policy to certify additional infinite LRX families.\", \"mode\": \"exploit\", \"parents\": [[{\"kind\": \"mixture_policy\", \"name\": \"description\", \"rules\": [{\"cuts\": [0, 4, 8], \"weights\": {\"rotation\": 1, \"zero_rotation\": 1, \"zero_swap\": 0, \"position\": 0, \"rank_gap\": 0}, \"direction\": \"shortest\", \"tie\": \"left\"}, {\"cuts\": [1, 5, 9, 13], \"weights\": {\"rotation\": 1, \"zero_rotation\": -1, \"zero_swap\": -4, \"position\": 2, \"rank_gap\": -6}, \"direction\": \"right\", \"tie\": \"left\"}, {\"cuts\": [2, 6, 10, 14], \"weights\": {\"rotation\": 0, \"zero_rotation\": 2, \"zero_swap\": 3, \"position\": -2, \"rank_gap\": 5}, \"direction\": \"left\", \"tie\": \"right\"}, {\"cuts\": [3, 7, 11, 15], \"weights\": {\"rotation\": 2, \"zero_rotation\": 0, \"zero_swap\": -2, \"position\": 1, \"rank_gap\": -3}, \"direction\": \"shortest\", \"tie\": \"left\"}, {\"cuts\": [0, 6, 12], \"weights\": {\"rotation\": 3, \"zero_rotation\": -2, \"zero_swap\": 1, \"position\": 4, \"rank_gap\": 2}, \"direction\": \"right\", \"tie\": \"right\"}, {\"cuts\": [4, 8, 16], \"weights\": {\"rotation\": 0, \"zero_rotation\": 4, \"zero_swap\": -1, \"position\": -3, \"rank_gap\": 7}, \"direction\": \"left\", \"tie\": \"left\"}, {\"cuts\": [1, 7, 12], \"weights\": {\"rotation\": 4, \"zero_rotation\": 1, \"zero_swap\": 2, \"position\": 0, \"rank_gap\": -8}, \"direction\": \"shortest\", \"tie\": \"right\"}, {\"cuts\": [5, 9, 13], \"weights\": {\"rotation\": 2, \"zero_rotation\": -3, \"zero_swap\": 0, \"position\": 3, \"rank_gap\": 1}, \"direction\": \"left\", \"tie\": \"right\"}]}, {\"score\": -108853.71958975714, \"certified\": 2, \"missed\": 32, \"graphs\": [{\"graph\": \"k4\", \"score\": -4007.211904761905, \"failures\": 4, \"role\": \"train\", \"feedback\": true}, {\"graph\": \"k5\", \"score\": -7003.857149416241, \"failures\": 7, \"role\": \"train\", \"feedback\": true}, {\"graph\": \"k6\", \"score\": -7003.353186813187, \"failures\": 7, \"role\": \"train\", \"feedback\": true}, {\"graph\": \"k7\", \"score\": -9004.62849083162, \"failures\": 9, \"role\": \"train\", \"feedback\": true}, {\"graph\": \"k8\", \"score\": -5002.668857934181, \"failures\": 5, \"role\": \"train\", \"feedback\": true}], \"failures\": [{\"case\": {\"id\": \"k4-mask312-order21771\", \"mask\": 312, \"order_index\": 21771, \"blocks\": 4}, \"base_deficit\": 3.0, \"generated_profiles\": [{\"base\": 61, \"gamma\": [15, 12, 9, 2]}, {\"base\": 62, \"gamma\": [12, 10, 11, 8]}, {\"base\": 108, \"gamma\": [19, 22, 25, 11]}, {\"base\": 137, \"gamma\": [14, 13, 16, 13]}, {\"base\": 162, \"gamma\": [26, 14, 17, 18]}, {\"base\": 211, \"gamma\": [30, 33, 17, 22]}, {\"base\": 235, \"gamma\": [34, 31, 32, 23]}, {\"base\": 107, \"gamma\": [13, 14, 14, 9]}]}, {\"case\": {\"id\": \"k4-mask78-order9701\", \"mask\": 78, \"order_index\": 9701, \"blocks\": 4}, \"base_deficit\": 2.4285714285714306, \"generated_profiles\": [{\"base\": 100, \"gamma\": [21, 18, 15, 6]}, {\"base\": 80, \"gamma\": [12, 11, 13, 10]}, {\"base\": 83, \"gamma\": [11, 14, 17, 3]}, {\"base\": 358, \"gamma\": [33, 32, 31, 32]}, {\"base\": 132, \"gamma\": [21, 20, 12, 13]}, {\"base\": 156, \"gamma\": [19, 22, 14, 11]}, {\"base\": 177, \"gamma\": [15, 27, 24, 19]}, {\"base\": 173, \"gamma\": [20, 17, 18, 16]}]}, {\"case\": {\"id\": \"k5-mask310-order4691\", \"mask\": 310, \"order_index\": 4691, \"blocks\": 5}, \"base_deficit\": 1.5, \"generated_profiles\": [{\"base\": 92, \"gamma\": [20, 17, 11, 8, 1]}, {\"base\": 90, \"gamma\": [11, 10, 11, 14, 9]}, {\"base\": 100, \"gamma\": [10, 13, 19, 1, 8]}, {\"base\": 254, \"gamma\": [24, 23, 21, 20, 17]}, {\"base\": 204, \"gamma\": [25, 24, 19, 22, 23]}, {\"base\": 245, \"gamma\": [27, 30, 36, 16, 25]}, {\"base\": 254, \"gamma\": [24, 23, 21, 20, 17]}, {\"base\": 208, \"gamma\": [16, 28, 26, 23, 14]}]}, {\"case\": {\"id\": \"k6-mask442-order5461\", \"mask\": 442, \"order_index\": 5461, \"blocks\": 6}, \"base_deficit\": 1.5, \"generated_profiles\": [{\"base\": 79, \"gamma\": [21, 15, 12, 9, 3, 0]}, {\"base\": 78, \"gamma\": [10, 13, 10, 7, 5, 8]}, {\"base\": 92, \"gamma\": [10, 16, 19, 1, 5, 8]}, {\"base\": 389, \"gamma\": [31, 33, 32, 31, 29, 28]}, {\"base\": 281, \"gamma\": [29, 31, 23, 22, 24, 27]}, {\"base\": 230, \"gamma\": [25, 31, 34, 14, 20, 23]}, {\"base\": 225, \"gamma\": [22, 20, 19, 18, 16, 15]}, {\"base\": 174, \"gamma\": [13, 26, 23, 20, 14, 11]}]}], \"interpretation\": \"Misses do not prove infeasibility; equal base threshold is insufficient. Every slope must be <=6.\"}]], \"engine_context\": {\"history\": [{\"id\": 7, \"mode\": \"exploit\", \"parents\": [1], \"status\": \"keep\", \"score\": -108853.71958975714, \"parent_score\": -108854.4164446699, \"problem_graphs\": [{\"graph\": \"k4\", \"score\": -4007.211904761905, \"failures\": 4}, {\"graph\": \"k5\", \"score\": -7003.857149416241, \"failures\": 7}, {\"graph\": \"k6\", \"score\": -7003.353186813187, \"failures\": 7}, {\"graph\": \"k7\", \"score\": -9004.62849083162, \"failures\": 9}], \"focus\": \"k5\"}, {\"id\": 6, \"mode\": \"exploit\", \"parents\": [1], \"status\": \"discard\", \"score\": -115657.60811133657, \"parent_score\": -108854.4164446699, \"problem_graphs\": [{\"graph\": \"k4\", \"score\": -4007.211904761905, \"failures\": 4}, {\"graph\": \"k5\", \"score\": -8005.679004329004, \"failures\": 8}, {\"graph\": \"k6\", \"score\": -7003.353186813187, \"failures\": 7}, {\"graph\": \"k7\", \"score\": -9004.62849083162, \"failures\": 9}], \"focus\": \"k5\"}, {\"id\": 5, \"mode\": \"exploit\", \"parents\": [1], \"status\": \"discard\", \"score\": -112256.09700022545, \"parent_score\": -108854.4164446699, \"problem_graphs\": [{\"graph\": \"k4\", \"score\": -4007.211904761905, \"failures\": 4}, {\"graph\": \"k5\", \"score\": -8005.2345598845595, \"failures\": 8}, {\"graph\": \"k6\", \"score\": -7003.353186813187, \"failures\": 7}, {\"graph\": \"k7\", \"score\": -9004.62849083162, \"failures\": 9}], \"focus\": \"k5\"}], \"inspirations\": [{\"id\": 1, \"score\": -108854.4164446699, \"graph_scores\": {\"k4\": -4007.211904761905, \"k5\": -8005.679004329004, \"k6\": -7003.353186813187, \"k7\": -8003.503490831618, \"k8\": -5002.668857934181}, \"spec\": {\"kind\": \"mixture_policy\", \"name\": \"description\", \"rules\": [{\"cuts\": [0, 5, 11], \"weights\": {\"rotation\": 1, \"zero_rotation\": 2, \"zero_swap\": -2, \"position\": 3, \"rank_gap\": 4}, \"direction\": \"shortest\", \"tie\": \"left\"}, {\"cuts\": [2, 7, 13], \"weights\": {\"rotation\": 2, \"zero_rotation\": -1, \"zero_swap\": 1, \"position\": -3, \"rank_gap\": 6}, \"direction\": \"left\", \"tie\": \"right\"}, {\"cuts\": [1, 6, 10, 15], \"weights\": {\"rotation\": 0, \"zero_rotation\": 4, \"zero_swap\": -4, \"position\": 1, \"rank_gap\": 2}, \"direction\": \"right\", \"tie\": \"left\"}, {\"cuts\": [3, 8, 12], \"weights\": {\"rotation\": 3, \"zero_rotation\": 1, \"zero_swap\": 2, \"position\": 5, \"rank_gap\": -1}, \"direction\": \"shortest\", \"tie\": \"right\"}, {\"cuts\": [4, 9, 14], \"weights\": {\"rotation\": 1, \"zero_rotation\": -3, \"zero_swap\": 0, \"position\": -2, \"rank_gap\": 8}, \"direction\": \"left\", \"tie\": \"left\"}, {\"cuts\": [0, 6, 12], \"weights\": {\"rotation\": 4, \"zero_rotation\": 0, \"zero_swap\": 3, \"position\": 2, \"rank_gap\": 1}, \"direction\": \"right\", \"tie\": \"right\"}]}}], \"focus\": {\"graph\": \"k7\", \"parent_score\": -9004.62849083162, \"archive_best\": -8003.503490831618}}, \"unverified_hypotheses\": \"\", \"context_sha256\": \"83a280095959be0ee17113ba4e6fea85215d14e850cdceb1550146f143ccdbe3\"}", "role": "user"}], "prompt_system_sha": "5823c3ab836265bb", "proposal": 8, "proposer_error": null, "reasoning_tokens": 211, "repairs_used": null, "score": -112255.16366689211, "seconds": 0.3069441659899894, "spec": {"kind": "mixture_policy", "name": "description", "rules": [{"cuts": [0, 3, 7, 12], "direction": "shortest", "tie": "left", "weights": {"position": 1, "rank_gap": -4, "rotation": 1, "zero_rotation": -2, "zero_swap": -6}}, {"cuts": [2, 5, 9, 14], "direction": "left", "tie": "right", "weights": {"position": -1, "rank_gap": 6, "rotation": 0, "zero_rotation": 3, "zero_swap": 2}}, {"cuts": [1, 6, 11], "direction": "right", "tie": "left", "weights": {"position": 4, "rank_gap": -2, "rotation": 2, "zero_rotation": 1, "zero_swap": -3}}, {"cuts": [4, 8, 13, 16], "direction": "shortest", "tie": "right", "weights": {"position": -4, "rank_gap": 5, "rotation": 3, "zero_rotation": -1, "zero_swap": 1}}, {"cuts": [0, 8], "direction": "left", "tie": "left", "weights": {"position": 2, "rank_gap": -8, "rotation": 1, "zero_rotation": 4, "zero_swap": 0}}, {"cuts": [3, 10, 15], "direction": "right", "tie": "right", "weights": {"position": 0, "rank_gap": 3, "rotation": 4, "zero_rotation": -3, "zero_swap": -1}}, {"cuts": [5, 9, 12], "direction": "shortest", "tie": "left", "weights": {"position": -2, "rank_gap": 1, "rotation": 0, "zero_rotation": 2, "zero_swap": 5}}, {"cuts": [6, 11, 14], "direction": "left", "tie": "right", "weights": {"position": 3, "rank_gap": -6, "rotation": 2, "zero_rotation": 0, "zero_swap": -5}}]}, "status": "discard", "t": 90.89, "tactic": null, "tokens_in": 5022, "tokens_out": 636, "valid": true}
{"batch": 7, "best_id": 7, "best_score": -108853.71958975714, "completed": 8, "eval_seconds": 0.31, "event": "batch", "inflight": 0, "proposals": 8, "propose_seconds": 7.93, "requests": [{"explore_p": null, "focus": "k7", "island": 0, "mode": "exploit", "parents": [7], "proposal": 8, "tactic": null}], "since_improvement": 0, "t": 90.89, "usage": {"billing_verified": false, "estimated_usd": 0.099312, "failed_requests": 0, "input_tokens": 36009, "max_spend_usd": 2.0, "output_tokens": 6853, "provider_costed_requests": 8, "requests": 8, "usage_overruns": 0}}
