{"attempts": null, "batch": 11, "context": ["focus", "history", "inspirations", "tactic"], "cost_source": "provider", "cost_usd": 0.017764, "event": "candidate", "explore_p": null, "feasible": false, "feedback": {"complexity": 23, "failures": [{"best_length": 61, "bound": 59, "case": "m9r3-obstruction-6", "defects": [], "generated": 39, "m": 9, "projection_length": 52, "q": 53, "r": 3, "routed": 27, "routing_overhead": 9, "status": "PORTFOLIO_MISS", "v": [2, 1, 0, 0, 0, 9, 8, 7, 6, 5, 4, 3], "word_cap_reached": false}, {"best_length": 68, "bound": 66, "case": "m9r4-band-edge-12", "defects": [], "generated": 52, "m": 9, "projection_length": 56, "q": 60, "r": 4, "routed": 24, "routing_overhead": 12, "status": "PORTFOLIO_MISS", "v": [8, 7, 9, 6, 5, 4, 3, 2, 1, 0, 0, 0, 0], "word_cap_reached": false}, {"best_length": 49, "bound": 48, "case": "m8r3-obstruction-0", "defects": [], "generated": 39, "m": 8, "projection_length": 41, "q": 43, "r": 3, "routed": 24, "routing_overhead": 8, "status": "PORTFOLIO_MISS", "v": [2, 1, 0, 0, 0, 7, 8, 6, 5, 4, 3], "word_cap_reached": false}, {"best_length": 49, "bound": 48, "case": "m8r3-neighbours-3", "defects": [], "generated": 39, "m": 8, "projection_length": 40, "q": 43, "r": 3, "routed": 27, "routing_overhead": 9, "status": "PORTFOLIO_MISS", "v": [3, 2, 1, 0, 0, 0, 7, 8, 6, 5, 4], "word_cap_reached": false}], "families": {"m8r3-neighbours": -1001, "m8r3-obstruction": -1001, "m8r5-antipode-insertions": 0, "m8r9-antipode-insertions": 0, "m9r3-neighbours": -3003, "m9r3-obstruction": -1002, "m9r4-band-edge": -2003}, "graphs": [{"T": 48, "checked": 1, "failures": 1, "feedback": true, "graph": "m8r3-obstruction", "incomplete": 0, "m": 8, "r": 3, "role": "train", "score": -1001, "value_max": 49}, {"T": 48, "checked": 5, "failures": 1, "feedback": true, "graph": "m8r3-neighbours", "incomplete": 0, "m": 8, "r": 3, "role": "train", "score": -1001, "value_max": 49}, {"T": 59, "checked": 1, "failures": 1, "feedback": true, "graph": "m9r3-obstruction", "incomplete": 0, "m": 9, "r": 3, "role": "train", "score": -1002, "value_max": 61}, {"T": 59, "checked": 5, "failures": 3, "feedback": true, "graph": "m9r3-neighbours", "incomplete": 0, "m": 9, "r": 3, "role": "train", "score": -3003, "value_max": 60}, {"T": 66, "checked": 4, "failures": 2, "feedback": true, "graph": "m9r4-band-edge", "incomplete": 0, "m": 9, "r": 4, "role": "train", "score": -2003, "value_max": 68}, {"T": 60, "checked": 6, "failures": 0, "feedback": true, "graph": "m8r5-antipode-insertions", "incomplete": 0, "m": 8, "r": 5, "role": "train", "score": 0, "value_max": 60}, {"T": 84, "checked": 6, "failures": 0, "feedback": true, "graph": "m8r9-antipode-insertions", "incomplete": 0, "m": 8, "r": 9, "role": "train", "score": 0, "value_max": 82}], "interpretation": "A portfolio miss is not a lifting counterexample. Scoring prioritizes fewer misses, then excess, then simpler policies.", "max_excess": 2, "missed": 8, "score": -2268820.0023}, "finish_reason": "stop", "focus": "m9r4-band-edge", "graphs": [{"excess_T": null, "failures": 1, "gap_mean": null, "graph": "m8r3-obstruction", "incomplete": 0, "score": -1001, "value_max": 49}, {"excess_T": null, "failures": 1, "gap_mean": null, "graph": "m8r3-neighbours", "incomplete": 0, "score": -1001, "value_max": 49}, {"excess_T": null, "failures": 1, "gap_mean": null, "graph": "m9r3-obstruction", "incomplete": 0, "score": -1002, "value_max": 61}, {"excess_T": null, "failures": 3, "gap_mean": null, "graph": "m9r3-neighbours", "incomplete": 0, "score": -3003, "value_max": 60}, {"excess_T": null, "failures": 2, "gap_mean": null, "graph": "m9r4-band-edge", "incomplete": 0, "score": -2003, "value_max": 68}, {"excess_T": null, "failures": 0, "gap_mean": null, "graph": "m8r5-antipode-insertions", "incomplete": 0, "score": 0, "value_max": 60}, {"excess_T": null, "failures": 0, "gap_mean": null, "graph": "m8r9-antipode-insertions", "incomplete": 0, "score": 0, "value_max": 82}], "hash": "f61d008988fc8b74", "id": 12, "instances": {"m8r3-neighbours": -1001, "m8r3-obstruction": -1001, "m8r5-antipode-insertions": 0, "m8r9-antipode-insertions": 0, "m9r3-neighbours": -3003, "m9r3-obstruction": -1002, "m9r4-band-edge": -2003}, "island": 0, "kind": "lift_policy", "llm_seconds": 16.81, "mode": "exploit", "model_reasoning": "The user wants me to return a JSON object with a specific schema for a lift policy. This is a research construction discovery task, not a disallowed request. I need to propose an improved reusable LRX...", "model_text": "{\"kind\":\"lift_policy\",\"name\":\"distance-low mixed axis detours\",\"zero_order\":\"distance_low\",\"paths\":[{\"orders\":[\"LRX\"],\"period\":1,\"axis\":\"step\",\"detour\":\"none\",\"detour_steps\":[]},{\"orders\":[\"XRL\"],\"period\":1,\"axis\":\"step\",\"detour\":\"none\",\"detour_steps\":[]},{\"orders\":[\"RLX\"],\"period\":1,\"axis\":\"step\",\"detour\":\"none\",\"detour_steps\":[]},{\"orders\":[\"LXR\"],\"period\":1,\"axis\":\"step\",\"detour\":\"none\",\"detour_steps\":[]},{\"orders\":[\"LRX\",\"XRL\"],\"period\":2,\"axis\":\"distance\",\"detour\":\"uphill\",\"detour_steps\":[5]},{\"orders\":[\"RLX\",\"LXR\"],\"period\":3,\"axis\":\"front_zeros\",\"detour\":\"level\",\"detour_steps\":[1,4,8]},{\"orders\":[\"XLR\",\"RXL\"],\"period\":4,\"axis\":\"step\",\"detour\":\"either\",\"detour_steps\":[5,6]}]}", "parents": [7], "prompt_messages": [{"content": "{\"task\": \"Propose an improved reusable LRX lifting construction policy.\", \"mode\": \"exploit\", \"parents\": [[{\"kind\": \"lift_policy\", \"name\": \"right zeros, distance-band uphill, front level\", \"zero_order\": \"right\", \"paths\": [{\"orders\": [\"LRX\"], \"period\": 1, \"axis\": \"step\", \"detour\": \"none\", \"detour_steps\": []}, {\"orders\": [\"XRL\"], \"period\": 1, \"axis\": \"step\", \"detour\": \"none\", \"detour_steps\": []}, {\"orders\": [\"RLX\"], \"period\": 1, \"axis\": \"step\", \"detour\": \"none\", \"detour_steps\": []}, {\"orders\": [\"LXR\"], \"period\": 1, \"axis\": \"step\", \"detour\": \"none\", \"detour_steps\": []}, {\"orders\": [\"XRL\", \"LRX\"], \"period\": 3, \"axis\": \"distance\", \"detour\": \"uphill\", \"detour_steps\": [5]}, {\"orders\": [\"RLX\", \"XLR\"], \"period\": 2, \"axis\": \"front_zeros\", \"detour\": \"level\", \"detour_steps\": [1, 3, 5, 8]}, {\"orders\": [\"RXL\", \"LXR\"], \"period\": 4, \"axis\": \"distance\", \"detour\": \"either\", \"detour_steps\": [4, 6, 9]}, {\"orders\": [\"XLR\"], \"period\": 1, \"axis\": \"step\", \"detour\": \"uphill\", \"detour_steps\": [5, 11]}]}, {\"score\": -2268819.0029, \"missed\": 8, \"max_excess\": 2, \"complexity\": 29, \"families\": {\"m8r3-obstruction\": -1001, \"m8r3-neighbours\": -1001, \"m9r3-obstruction\": -1002, \"m9r3-neighbours\": -3003, \"m9r4-band-edge\": -2002, \"m8r5-antipode-insertions\": 0, \"m8r9-antipode-insertions\": 0}, \"graphs\": [{\"graph\": \"m8r3-obstruction\", \"m\": 8, \"r\": 3, \"role\": \"train\", \"feedback\": true, \"checked\": 1, \"failures\": 1, \"incomplete\": 0, \"score\": -1001, \"T\": 48, \"value_max\": 49}, {\"graph\": \"m8r3-neighbours\", \"m\": 8, \"r\": 3, \"role\": \"train\", \"feedback\": true, \"checked\": 5, \"failures\": 1, \"incomplete\": 0, \"score\": -1001, \"T\": 48, \"value_max\": 49}, {\"graph\": \"m9r3-obstruction\", \"m\": 9, \"r\": 3, \"role\": \"train\", \"feedback\": true, \"checked\": 1, \"failures\": 1, \"incomplete\": 0, \"score\": -1002, \"T\": 59, \"value_max\": 61}, {\"graph\": \"m9r3-neighbours\", \"m\": 9, \"r\": 3, \"role\": \"train\", \"feedback\": true, \"checked\": 5, \"failures\": 3, \"incomplete\": 0, \"score\": -3003, \"T\": 59, \"value_max\": 60}, {\"graph\": \"m9r4-band-edge\", \"m\": 9, \"r\": 4, \"role\": \"train\", \"feedback\": true, \"checked\": 4, \"failures\": 2, \"incomplete\": 0, \"score\": -2002, \"T\": 66, \"value_max\": 67}, {\"graph\": \"m8r5-antipode-insertions\", \"m\": 8, \"r\": 5, \"role\": \"train\", \"feedback\": true, \"checked\": 6, \"failures\": 0, \"incomplete\": 0, \"score\": 0, \"T\": 60, \"value_max\": 60}, {\"graph\": \"m8r9-antipode-insertions\", \"m\": 8, \"r\": 9, \"role\": \"train\", \"feedback\": true, \"checked\": 6, \"failures\": 0, \"incomplete\": 0, \"score\": 0, \"T\": 84, \"value_max\": 83}], \"failures\": [{\"case\": \"m9r3-obstruction-6\", \"m\": 9, \"r\": 3, \"v\": [2, 1, 0, 0, 0, 9, 8, 7, 6, 5, 4, 3], \"q\": 53, \"bound\": 59, \"status\": \"PORTFOLIO_MISS\", \"generated\": 54, \"routed\": 30, \"word_cap_reached\": false, \"best_length\": 61, \"projection_length\": 52, \"routing_overhead\": 9, \"defects\": []}, {\"case\": \"m8r3-obstruction-0\", \"m\": 8, \"r\": 3, \"v\": [2, 1, 0, 0, 0, 7, 8, 6, 5, 4, 3], \"q\": 43, \"bound\": 48, \"status\": \"PORTFOLIO_MISS\", \"generated\": 54, \"routed\": 36, \"word_cap_reached\": false, \"best_length\": 49, \"projection_length\": 41, \"routing_overhead\": 8, \"defects\": []}, {\"case\": \"m8r3-neighbours-3\", \"m\": 8, \"r\": 3, \"v\": [3, 2, 1, 0, 0, 0, 7, 8, 6, 5, 4], \"q\": 43, \"bound\": 48, \"status\": \"PORTFOLIO_MISS\", \"generated\": 54, \"routed\": 39, \"word_cap_reached\": false, \"best_length\": 49, \"projection_length\": 40, \"routing_overhead\": 9, \"defects\": []}, {\"case\": \"m9r3-neighbours-7\", \"m\": 9, \"r\": 3, \"v\": [1, 0, 0, 0, 9, 8, 7, 6, 5, 4, 3, 2], \"q\": 53, \"bound\": 59, \"status\": \"PORTFOLIO_MISS\", \"generated\": 54, \"routed\": 42, \"word_cap_reached\": false, \"best_length\": 60, \"projection_length\": 51, \"routing_overhead\": 9, \"defects\": []}], \"interpretation\": \"A portfolio miss is not a lifting counterexample. Scoring prioritizes fewer misses, then excess, then simpler policies.\"}]], \"engine_context\": {\"history\": [{\"id\": 11, \"mode\": \"exploit\", \"parents\": [1], \"status\": \"discard\", \"score\": -1985918.0029, \"parent_score\": -1420113.0036, \"problem_graphs\": [{\"graph\": \"m8r3-obstruction\", \"score\": -1001, \"failures\": 1}, {\"graph\": \"m8r3-neighbours\", \"score\": -1001, \"failures\": 1}, {\"graph\": \"m9r3-obstruction\", \"score\": -1002, \"failures\": 1}, {\"graph\": \"m9r3-neighbours\", \"score\": -3003, \"failures\": 3}], \"focus\": \"m9r4-band-edge\"}, {\"id\": 10, \"mode\": \"exploit\", \"parents\": [4], \"status\": \"discard\", \"score\": -1703015.0027, \"parent_score\": -1700213.0027, \"problem_graphs\": [{\"graph\": \"m8r3-obstruction\", \"score\": -1001, \"failures\": 1}, {\"graph\": \"m8r3-neighbours\", \"score\": -1001, \"failures\": 1}, {\"graph\": \"m9r3-neighbours\", \"score\": -2002, \"failures\": 2}, {\"graph\": \"m9r4-band-edge\", \"score\": -2003, \"failures\": 2}], \"focus\": \"m9r4-band-edge\"}, {\"id\": 9, \"mode\": \"explore\", \"parents\": [5], \"status\": \"discard\", \"score\": -1985918.003, \"parent_score\": -1134409.0028, \"problem_graphs\": [{\"graph\": \"m8r3-obstruction\", \"score\": -1001, \"failures\": 1}, {\"graph\": \"m8r3-neighbours\", \"score\": -1001, \"failures\": 1}, {\"graph\": \"m9r3-obstruction\", \"score\": -1002, \"failures\": 1}, {\"graph\": \"m9r3-neighbours\", \"score\": -2002, \"failures\": 2}]}], \"inspirations\": [{\"id\": 3, \"score\": -1134409.0025, \"graph_scores\": {\"m8r3-obstruction\": -1001, \"m8r3-neighbours\": -1001, \"m9r3-obstruction\": 0, \"m9r3-neighbours\": -2002, \"m9r4-band-edge\": 0, \"m8r5-antipode-insertions\": 0, \"m8r9-antipode-insertions\": 0}, \"spec\": {\"kind\": \"lift_policy\", \"name\": \"left zeros, step-five uphill, distance band repair\", \"zero_order\": \"left\", \"paths\": [{\"orders\": [\"LRX\"], \"period\": 1, \"axis\": \"step\", \"detour\": \"none\", \"detour_steps\": []}, {\"orders\": [\"XRL\"], \"period\": 1, \"axis\": \"step\", \"detour\": \"none\", \"detour_steps\": []}, {\"orders\": [\"RLX\"], \"period\": 1, \"axis\": \"step\", \"detour\": \"none\", \"detour_steps\": []}, {\"orders\": [\"LXR\"], \"period\": 1, \"axis\": \"step\", \"detour\": \"none\", \"detour_steps\": []}, {\"orders\": [\"LRX\"], \"period\": 1, \"axis\": \"step\", \"detour\": \"uphill\", \"detour_steps\": [5]}, {\"orders\": [\"RLX\"], \"period\": 1, \"axis\": \"step\", \"detour\": \"uphill\", \"detour_steps\": [5]}, {\"orders\": [\"XLR\", \"RXL\"], \"period\": 4, \"axis\": \"distance\", \"detour\": \"uphill\", \"detour_steps\": [5]}, {\"orders\": [\"XLR\", \"RXL\"], \"period\": 2, \"axis\": \"distance\", \"detour\": \"level\", \"detour_steps\": [0, 2, 4, 6]}]}}], \"focus\": {\"graph\": \"m9r4-band-edge\", \"parent_score\": -2002, \"archive_best\": 0}, \"tactic\": {\"idea\": \"Front diversity and best-parent exploit both plateaued at 4 misses. Sample random archive parents and edit zero_order, axis, and detour type together, not only step-5 uphill. Keep portfolios small. Coordinate descents with zero routing; no per-vector exceptions. Finite misses are portfolio misses only.\"}}, \"unverified_reflection_hypotheses\": \"\", \"context_sha256\": \"2f50ffa5fac038e9c365dd3c84c2f23249bc79eae38a147da48be1ff370c81d7\"}", "role": "user"}], "prompt_system_sha": "e6dcb1dc53c824a5", "proposal": 12, "proposer_error": null, "reasoning_tokens": 1081, "repairs_used": null, "score": -2268820.0023, "seconds": 0.16912462501204573, "spec": {"kind": "lift_policy", "name": "distance-low mixed axis detours", "paths": [{"axis": "step", "detour": "none", "detour_steps": [], "orders": ["LRX"], "period": 1}, {"axis": "step", "detour": "none", "detour_steps": [], "orders": ["XRL"], "period": 1}, {"axis": "step", "detour": "none", "detour_steps": [], "orders": ["RLX"], "period": 1}, {"axis": "step", "detour": "none", "detour_steps": [], "orders": ["LXR"], "period": 1}, {"axis": "distance", "detour": "uphill", "detour_steps": [5], "orders": ["LRX", "XRL"], "period": 2}, {"axis": "front_zeros", "detour": "level", "detour_steps": [1, 4, 8], "orders": ["RLX", "LXR"], "period": 3}, {"axis": "step", "detour": "either", "detour_steps": [5, 6], "orders": ["XLR", "RXL"], "period": 4}], "zero_order": "distance_low"}, "status": "discard", "t": 426.23, "tactic": null, "tokens_in": 5717, "tokens_out": 1343, "valid": true}
{"batch": 11, "best_id": 3, "best_score": -1134409.0025, "completed": 12, "eval_seconds": 0.17, "event": "batch", "inflight": 0, "proposals": 12, "propose_seconds": 16.81, "requests": [{"explore_p": null, "focus": "m9r4-band-edge", "island": 0, "mode": "exploit", "parents": [7], "proposal": 12, "tactic": null}], "since_improvement": 8, "strategy": {"focus": true, "history": 3, "inspiration_pool": "top", "inspirations": 1, "modes": {"edit": 0.6, "exploit": 0.15, "explore": 0.25}, "parent": "random", "tactic": "Front diversity and best-parent exploit both plateaued at 4 misses. Sample random archive parents and edit zero_order, axis, and detour type together, not only step-5 uphill. Keep portfolios small. Coordinate descents with zero routing; no per-vector exceptions. Finite misses are portfolio misses only."}, "t": 426.23, "usage": {"billing_verified": false, "estimated_usd": 0.338014, "failed_requests": 0, "input_tokens": 81878, "max_spend_usd": 2.5, "output_tokens": 32787, "provider_costed_requests": 14, "requests": 14, "usage_overruns": 0}}
{"J": 0.0, "delta": 0.0, "end": -1134409.0025, "event": "strategy_window", "proposals": 12, "start": -1134409.0025, "strategy": {"focus": true, "history": 3, "inspiration_pool": "top", "inspirations": 1, "modes": {"edit": 0.6, "exploit": 0.15, "explore": 0.25}, "parent": "random", "tactic": "Front diversity and best-parent exploit both plateaued at 4 misses. Sample random archive parents and edit zero_order, axis, and detour type together, not only step-5 uphill. Keep portfolios small. Coordinate descents with zero routing; no per-vector exceptions. Finite misses are portfolio misses only."}, "t": 426.26}
{"event": "end", "stop_reason": "max_proposals", "t": 426.27, "usage": {"billing_verified": false, "estimated_usd": 0.338014, "failed_requests": 0, "input_tokens": 81878, "max_spend_usd": 2.5, "output_tokens": 32787, "provider_costed_requests": 14, "requests": 14, "usage_overruns": 0}}
