{"attempts": null, "batch": 9, "context": ["focus", "history", "inspirations", "tactic"], "cost_source": "provider", "cost_usd": 0.026578, "event": "candidate", "explore_p": null, "feasible": false, "feedback": {"complexity": 27, "failures": [{"best_length": 68, "bound": 66, "case": "m9r4-band-edge-12", "defects": [], "generated": 60, "m": 9, "projection_length": 56, "q": 60, "r": 4, "routed": 24, "routing_overhead": 12, "status": "PORTFOLIO_MISS", "v": [8, 7, 9, 6, 5, 4, 3, 2, 1, 0, 0, 0, 0], "word_cap_reached": false}, {"best_length": 49, "bound": 48, "case": "m8r3-obstruction-0", "defects": [], "generated": 45, "m": 8, "projection_length": 41, "q": 43, "r": 3, "routed": 24, "routing_overhead": 8, "status": "PORTFOLIO_MISS", "v": [2, 1, 0, 0, 0, 7, 8, 6, 5, 4, 3], "word_cap_reached": false}, {"best_length": 49, "bound": 48, "case": "m8r3-neighbours-3", "defects": [], "generated": 45, "m": 8, "projection_length": 40, "q": 43, "r": 3, "routed": 24, "routing_overhead": 9, "status": "PORTFOLIO_MISS", "v": [3, 2, 1, 0, 0, 0, 7, 8, 6, 5, 4], "word_cap_reached": false}, {"best_length": 60, "bound": 59, "case": "m9r3-neighbours-7", "defects": [{"after": 47, "before": 47, "index": 4, "letter": "R"}], "generated": 45, "m": 9, "projection_length": 52, "q": 53, "r": 3, "routed": 30, "routing_overhead": 8, "status": "PORTFOLIO_MISS", "v": [1, 0, 0, 0, 9, 8, 7, 6, 5, 4, 3, 2], "word_cap_reached": false}], "families": {"m8r3-neighbours": -1001, "m8r3-obstruction": -1001, "m8r5-antipode-insertions": 0, "m8r9-antipode-insertions": 0, "m9r3-neighbours": -2002, "m9r3-obstruction": 0, "m9r4-band-edge": -2003}, "graphs": [{"T": 48, "checked": 1, "failures": 1, "feedback": true, "graph": "m8r3-obstruction", "incomplete": 0, "m": 8, "r": 3, "role": "train", "score": -1001, "value_max": 49}, {"T": 48, "checked": 5, "failures": 1, "feedback": true, "graph": "m8r3-neighbours", "incomplete": 0, "m": 8, "r": 3, "role": "train", "score": -1001, "value_max": 49}, {"T": 59, "checked": 1, "failures": 0, "feedback": true, "graph": "m9r3-obstruction", "incomplete": 0, "m": 9, "r": 3, "role": "train", "score": 0, "value_max": 59}, {"T": 59, "checked": 5, "failures": 2, "feedback": true, "graph": "m9r3-neighbours", "incomplete": 0, "m": 9, "r": 3, "role": "train", "score": -2002, "value_max": 60}, {"T": 66, "checked": 4, "failures": 2, "feedback": true, "graph": "m9r4-band-edge", "incomplete": 0, "m": 9, "r": 4, "role": "train", "score": -2003, "value_max": 68}, {"T": 60, "checked": 6, "failures": 0, "feedback": true, "graph": "m8r5-antipode-insertions", "incomplete": 0, "m": 8, "r": 5, "role": "train", "score": 0, "value_max": 60}, {"T": 84, "checked": 6, "failures": 0, "feedback": true, "graph": "m8r9-antipode-insertions", "incomplete": 0, "m": 8, "r": 9, "role": "train", "score": 0, "value_max": 83}], "interpretation": "A portfolio miss is not a lifting counterexample. Scoring prioritizes fewer misses, then excess, then simpler policies.", "max_excess": 2, "missed": 6, "score": -1703015.0027}, "finish_reason": "stop", "focus": "m9r4-band-edge", "graphs": [{"excess_T": null, "failures": 1, "gap_mean": null, "graph": "m8r3-obstruction", "incomplete": 0, "score": -1001, "value_max": 49}, {"excess_T": null, "failures": 1, "gap_mean": null, "graph": "m8r3-neighbours", "incomplete": 0, "score": -1001, "value_max": 49}, {"excess_T": null, "failures": 0, "gap_mean": null, "graph": "m9r3-obstruction", "incomplete": 0, "score": 0, "value_max": 59}, {"excess_T": null, "failures": 2, "gap_mean": null, "graph": "m9r3-neighbours", "incomplete": 0, "score": -2002, "value_max": 60}, {"excess_T": null, "failures": 2, "gap_mean": null, "graph": "m9r4-band-edge", "incomplete": 0, "score": -2003, "value_max": 68}, {"excess_T": null, "failures": 0, "gap_mean": null, "graph": "m8r5-antipode-insertions", "incomplete": 0, "score": 0, "value_max": 60}, {"excess_T": null, "failures": 0, "gap_mean": null, "graph": "m8r9-antipode-insertions", "incomplete": 0, "score": 0, "value_max": 83}], "hash": "d254ed0c0d6b8f89", "id": 10, "instances": {"m8r3-neighbours": -1001, "m8r3-obstruction": -1001, "m8r5-antipode-insertions": 0, "m8r9-antipode-insertions": 0, "m9r3-neighbours": -2002, "m9r3-obstruction": 0, "m9r4-band-edge": -2003}, "island": 0, "kind": "lift_policy", "llm_seconds": 33.0, "mode": "exploit", "model_reasoning": "The user wants me to return a JSON object with a lift policy. This is a research construction discovery task, not a malicious request. I should propose an improved reusable LRX lifting construction po...", "model_text": "{\"kind\":\"lift_policy\",\"name\":\"left zeros, period-five switch, mixed detours\",\"zero_order\":\"left\",\"paths\":[{\"orders\":[\"LRX\"],\"period\":1,\"axis\":\"step\",\"detour\":\"none\",\"detour_steps\":[]},{\"orders\":[\"XRL\"],\"period\":1,\"axis\":\"step\",\"detour\":\"none\",\"detour_steps\":[]},{\"orders\":[\"RLX\"],\"period\":1,\"axis\":\"step\",\"detour\":\"none\",\"detour_steps\":[]},{\"orders\":[\"LXR\"],\"period\":1,\"axis\":\"step\",\"detour\":\"none\",\"detour_steps\":[]},{\"orders\":[\"LRX\",\"XRL\"],\"period\":5,\"axis\":\"step\",\"detour\":\"uphill\",\"detour_steps\":[5]},{\"orders\":[\"XRL\",\"LRX\"],\"period\":5,\"axis\":\"step\",\"detour\":\"either\",\"detour_steps\":[5]},{\"orders\":[\"RLX\",\"LXR\"],\"period\":5,\"axis\":\"step\",\"detour\":\"level\",\"detour_steps\":[5]},{\"orders\":[\"XLR\",\"RXL\"],\"period\":2,\"axis\":\"distance\",\"detour\":\"level\",\"detour_steps\":[0,2,4,6]}]}", "parents": [4], "prompt_messages": [{"content": "{\"task\": \"Propose an improved reusable LRX lifting construction policy.\", \"mode\": \"exploit\", \"parents\": [[{\"kind\": \"lift_policy\", \"name\": \"period-three alternation with index-five uphill\", \"zero_order\": \"left\", \"paths\": [{\"orders\": [\"LRX\"], \"period\": 1, \"axis\": \"step\", \"detour\": \"none\", \"detour_steps\": []}, {\"orders\": [\"XRL\"], \"period\": 1, \"axis\": \"step\", \"detour\": \"none\", \"detour_steps\": []}, {\"orders\": [\"RLX\"], \"period\": 1, \"axis\": \"step\", \"detour\": \"none\", \"detour_steps\": []}, {\"orders\": [\"LXR\"], \"period\": 1, \"axis\": \"step\", \"detour\": \"none\", \"detour_steps\": []}, {\"orders\": [\"LRX\", \"XRL\"], \"period\": 3, \"axis\": \"step\", \"detour\": \"uphill\", \"detour_steps\": [5]}, {\"orders\": [\"XRL\", \"LRX\"], \"period\": 3, \"axis\": \"step\", \"detour\": \"uphill\", \"detour_steps\": [5]}, {\"orders\": [\"RXL\", \"LXR\"], \"period\": 2, \"axis\": \"step\", \"detour\": \"uphill\", \"detour_steps\": [5]}, {\"orders\": [\"XLR\", \"RXL\"], \"period\": 2, \"axis\": \"distance\", \"detour\": \"level\", \"detour_steps\": [0, 2, 4, 6]}]}, {\"score\": -1700213.0027, \"missed\": 6, \"max_excess\": 1, \"complexity\": 27, \"families\": {\"m8r3-obstruction\": -1001, \"m8r3-neighbours\": -1001, \"m9r3-obstruction\": 0, \"m9r3-neighbours\": -2002, \"m9r4-band-edge\": -2002, \"m8r5-antipode-insertions\": 0, \"m8r9-antipode-insertions\": 0}, \"graphs\": [{\"graph\": \"m8r3-obstruction\", \"m\": 8, \"r\": 3, \"role\": \"train\", \"feedback\": true, \"checked\": 1, \"failures\": 1, \"incomplete\": 0, \"score\": -1001, \"T\": 48, \"value_max\": 49}, {\"graph\": \"m8r3-neighbours\", \"m\": 8, \"r\": 3, \"role\": \"train\", \"feedback\": true, \"checked\": 5, \"failures\": 1, \"incomplete\": 0, \"score\": -1001, \"T\": 48, \"value_max\": 49}, {\"graph\": \"m9r3-obstruction\", \"m\": 9, \"r\": 3, \"role\": \"train\", \"feedback\": true, \"checked\": 1, \"failures\": 0, \"incomplete\": 0, \"score\": 0, \"T\": 59, \"value_max\": 59}, {\"graph\": \"m9r3-neighbours\", \"m\": 9, \"r\": 3, \"role\": \"train\", \"feedback\": true, \"checked\": 5, \"failures\": 2, \"incomplete\": 0, \"score\": -2002, \"T\": 59, \"value_max\": 60}, {\"graph\": \"m9r4-band-edge\", \"m\": 9, \"r\": 4, \"role\": \"train\", \"feedback\": true, \"checked\": 4, \"failures\": 2, \"incomplete\": 0, \"score\": -2002, \"T\": 66, \"value_max\": 67}, {\"graph\": \"m8r5-antipode-insertions\", \"m\": 8, \"r\": 5, \"role\": \"train\", \"feedback\": true, \"checked\": 6, \"failures\": 0, \"incomplete\": 0, \"score\": 0, \"T\": 60, \"value_max\": 60}, {\"graph\": \"m8r9-antipode-insertions\", \"m\": 8, \"r\": 9, \"role\": \"train\", \"feedback\": true, \"checked\": 6, \"failures\": 0, \"incomplete\": 0, \"score\": 0, \"T\": 84, \"value_max\": 83}], \"failures\": [{\"case\": \"m8r3-obstruction-0\", \"m\": 8, \"r\": 3, \"v\": [2, 1, 0, 0, 0, 7, 8, 6, 5, 4, 3], \"q\": 43, \"bound\": 48, \"status\": \"PORTFOLIO_MISS\", \"generated\": 45, \"routed\": 33, \"word_cap_reached\": false, \"best_length\": 49, \"projection_length\": 41, \"routing_overhead\": 8, \"defects\": []}, {\"case\": \"m8r3-neighbours-3\", \"m\": 8, \"r\": 3, \"v\": [3, 2, 1, 0, 0, 0, 7, 8, 6, 5, 4], \"q\": 43, \"bound\": 48, \"status\": \"PORTFOLIO_MISS\", \"generated\": 45, \"routed\": 30, \"word_cap_reached\": false, \"best_length\": 49, \"projection_length\": 40, \"routing_overhead\": 9, \"defects\": []}, {\"case\": \"m9r3-neighbours-7\", \"m\": 9, \"r\": 3, \"v\": [1, 0, 0, 0, 9, 8, 7, 6, 5, 4, 3, 2], \"q\": 53, \"bound\": 59, \"status\": \"PORTFOLIO_MISS\", \"generated\": 45, \"routed\": 36, \"word_cap_reached\": false, \"best_length\": 60, \"projection_length\": 51, \"routing_overhead\": 9, \"defects\": []}, {\"case\": \"m9r3-neighbours-11\", \"m\": 9, \"r\": 3, \"v\": [1, 2, 0, 0, 0, 9, 8, 7, 6, 5, 4, 3], \"q\": 53, \"bound\": 59, \"status\": \"PORTFOLIO_MISS\", \"generated\": 45, \"routed\": 39, \"word_cap_reached\": false, \"best_length\": 60, \"projection_length\": 51, \"routing_overhead\": 9, \"defects\": []}], \"interpretation\": \"A portfolio miss is not a lifting counterexample. Scoring prioritizes fewer misses, then excess, then simpler policies.\"}]], \"engine_context\": {\"history\": [{\"id\": 9, \"mode\": \"explore\", \"parents\": [5], \"status\": \"discard\", \"score\": -1985918.003, \"parent_score\": -1134409.0028, \"problem_graphs\": [{\"graph\": \"m8r3-obstruction\", \"score\": -1001, \"failures\": 1}, {\"graph\": \"m8r3-neighbours\", \"score\": -1001, \"failures\": 1}, {\"graph\": \"m9r3-obstruction\", \"score\": -1002, \"failures\": 1}, {\"graph\": \"m9r3-neighbours\", \"score\": -2002, \"failures\": 2}]}, {\"id\": 8, \"mode\": \"exploit\", \"parents\": [1], \"status\": \"discard\", \"score\": -2268821.0024, \"parent_score\": -1420113.0036, \"problem_graphs\": [{\"graph\": \"m8r3-obstruction\", \"score\": -1002, \"failures\": 1}, {\"graph\": \"m8r3-neighbours\", \"score\": -2002, \"failures\": 2}, {\"graph\": \"m9r3-obstruction\", \"score\": -1002, \"failures\": 1}, {\"graph\": \"m9r3-neighbours\", \"score\": -3003, \"failures\": 3}]}, {\"id\": 7, \"mode\": \"exploit\", \"parents\": [3], \"status\": \"discard\", \"score\": -2268819.0029, \"parent_score\": -1134409.0025, \"problem_graphs\": [{\"graph\": \"m8r3-obstruction\", \"score\": -1001, \"failures\": 1}, {\"graph\": \"m8r3-neighbours\", \"score\": -1001, \"failures\": 1}, {\"graph\": \"m9r3-obstruction\", \"score\": -1002, \"failures\": 1}, {\"graph\": \"m9r3-neighbours\", \"score\": -3003, \"failures\": 3}]}], \"inspirations\": [{\"id\": 3, \"score\": -1134409.0025, \"graph_scores\": {\"m8r3-obstruction\": -1001, \"m8r3-neighbours\": -1001, \"m9r3-obstruction\": 0, \"m9r3-neighbours\": -2002, \"m9r4-band-edge\": 0, \"m8r5-antipode-insertions\": 0, \"m8r9-antipode-insertions\": 0}, \"spec\": {\"kind\": \"lift_policy\", \"name\": \"left zeros, step-five uphill, distance band repair\", \"zero_order\": \"left\", \"paths\": [{\"orders\": [\"LRX\"], \"period\": 1, \"axis\": \"step\", \"detour\": \"none\", \"detour_steps\": []}, {\"orders\": [\"XRL\"], \"period\": 1, \"axis\": \"step\", \"detour\": \"none\", \"detour_steps\": []}, {\"orders\": [\"RLX\"], \"period\": 1, \"axis\": \"step\", \"detour\": \"none\", \"detour_steps\": []}, {\"orders\": [\"LXR\"], \"period\": 1, \"axis\": \"step\", \"detour\": \"none\", \"detour_steps\": []}, {\"orders\": [\"LRX\"], \"period\": 1, \"axis\": \"step\", \"detour\": \"uphill\", \"detour_steps\": [5]}, {\"orders\": [\"RLX\"], \"period\": 1, \"axis\": \"step\", \"detour\": \"uphill\", \"detour_steps\": [5]}, {\"orders\": [\"XLR\", \"RXL\"], \"period\": 4, \"axis\": \"distance\", \"detour\": \"uphill\", \"detour_steps\": [5]}, {\"orders\": [\"XLR\", \"RXL\"], \"period\": 2, \"axis\": \"distance\", \"detour\": \"level\", \"detour_steps\": [0, 2, 4, 6]}]}}], \"focus\": {\"graph\": \"m9r4-band-edge\", \"parent_score\": -2002, \"archive_best\": 0}, \"tactic\": {\"idea\": \"Front diversity and best-parent exploit both plateaued at 4 misses. Sample random archive parents and edit zero_order, axis, and detour type together, not only step-5 uphill. Keep portfolios small. Coordinate descents with zero routing; no per-vector exceptions. Finite misses are portfolio misses only.\"}}, \"unverified_reflection_hypotheses\": \"\", \"context_sha256\": \"2f50ffa5fac038e9c365dd3c84c2f23249bc79eae38a147da48be1ff370c81d7\"}", "role": "user"}], "prompt_system_sha": "e6dcb1dc53c824a5", "proposal": 10, "proposer_error": null, "reasoning_tokens": 2528, "repairs_used": null, "score": -1703015.0027, "seconds": 0.14851433399599046, "spec": {"kind": "lift_policy", "name": "left zeros, period-five switch, mixed detours", "paths": [{"axis": "step", "detour": "none", "detour_steps": [], "orders": ["LRX"], "period": 1}, {"axis": "step", "detour": "none", "detour_steps": [], "orders": ["XRL"], "period": 1}, {"axis": "step", "detour": "none", "detour_steps": [], "orders": ["RLX"], "period": 1}, {"axis": "step", "detour": "none", "detour_steps": [], "orders": ["LXR"], "period": 1}, {"axis": "step", "detour": "uphill", "detour_steps": [5], "orders": ["LRX", "XRL"], "period": 5}, {"axis": "step", "detour": "either", "detour_steps": [5], "orders": ["XRL", "LRX"], "period": 5}, {"axis": "step", "detour": "level", "detour_steps": [5], "orders": ["RLX", "LXR"], "period": 5}, {"axis": "distance", "detour": "level", "detour_steps": [0, 2, 4, 6], "orders": ["XLR", "RXL"], "period": 2}], "zero_order": "left"}, "status": "discard", "t": 371.15, "tactic": null, "tokens_in": 5681, "tokens_out": 2824, "valid": true}
{"batch": 9, "best_id": 3, "best_score": -1134409.0025, "completed": 10, "eval_seconds": 0.15, "event": "batch", "inflight": 0, "proposals": 10, "propose_seconds": 33.0, "requests": [{"explore_p": null, "focus": "m9r4-band-edge", "island": 0, "mode": "exploit", "parents": [4], "proposal": 10, "tactic": null}], "since_improvement": 6, "strategy": {"focus": true, "history": 3, "inspiration_pool": "top", "inspirations": 1, "modes": {"edit": 0.6, "exploit": 0.15, "explore": 0.25}, "parent": "random", "tactic": "Front diversity and best-parent exploit both plateaued at 4 misses. Sample random archive parents and edit zero_order, axis, and detour type together, not only step-5 uphill. Keep portfolios small. Coordinate descents with zero routing; no per-vector exceptions. Finite misses are portfolio misses only."}, "t": 371.15, "usage": {"billing_verified": false, "estimated_usd": 0.291856, "failed_requests": 0, "input_tokens": 70433, "max_spend_usd": 2.5, "output_tokens": 28333, "provider_costed_requests": 12, "requests": 12, "usage_overruns": 0}}
