{"config": {"async": false, "batch": 1, "engine": "evox", "eval_cache": null, "eval_workers": 1, "explore_max": 0.7, "feedback_potential": true, "feedback_words": false, "final_heldout_top": 0, "focus": true, "gepa_n": 1, "history": 4, "insights_file": null, "inspirations": 1, "island_size": 6, "islands": 3, "kinds": ["lift_policy"], "max_merges": 5, "max_proposals": 12, "max_wall_seconds": 5400, "merge_prob": 1.0, "migration_every": 12, "provider": {"api_key_env": "XAI_API_KEY", "base_url": "https://api.x.ai/v1", "idle_timeout_sec": 120, "input_usd_per_mtok": 2.2, "max_output_tokens": 2500, "max_reasoning_tokens": 16000, "max_requests": 18, "max_spend_usd": 2.5, "model": "grok-4.7", "output_usd_per_mtok": 6.6, "reasoning_effort": "low", "repairs": 0, "timeout_sec": 360, "type": "openai_compatible"}, "refine_mode": "exploit", "reflector": null, "seed": 307, "seeds": ["/Users/pavluhin/Documents/Projects/lrx-lab/autoresearch/loop-260923-2107/seed.json"], "select": "score", "split": "train", "stagnation": 12, "strategy": {"focus": true, "history": 4, "inspiration_pool": "top", "inspirations": 1, "modes": {"exploit": 1.0}, "parent": "best", "tactic": null}, "tactic_trials": 3, "tactics": false, "ucb_c": 1.4142135623730951, "ucb_decay": 0.9, "window": 3}, "evaluator_sha256": "fd9ce7b1ed0eff0e", "event": "start", "git_commit": "70e13367bd6e856badafbb800542d17ef328599d", "t": 0.01}
{"event": "candidate", "feasible": false, "feedback": {"complexity": 12, "failures": [{"best_length": 61, "bound": 59, "case": "m9r3-obstruction-6", "defects": [], "generated": 18, "m": 9, "projection_length": 52, "q": 53, "r": 3, "routed": 18, "routing_overhead": 9, "status": "PORTFOLIO_MISS", "v": [2, 1, 0, 0, 0, 9, 8, 7, 6, 5, 4, 3], "word_cap_reached": false}, {"best_length": 68, "bound": 66, "case": "m9r4-band-edge-12", "defects": [], "generated": 24, "m": 9, "projection_length": 56, "q": 60, "r": 4, "routed": 12, "routing_overhead": 12, "status": "PORTFOLIO_MISS", "v": [8, 7, 9, 6, 5, 4, 3, 2, 1, 0, 0, 0, 0], "word_cap_reached": false}, {"best_length": 49, "bound": 48, "case": "m8r3-obstruction-0", "defects": [], "generated": 18, "m": 8, "projection_length": 41, "q": 43, "r": 3, "routed": 12, "routing_overhead": 8, "status": "PORTFOLIO_MISS", "v": [2, 1, 0, 0, 0, 7, 8, 6, 5, 4, 3], "word_cap_reached": false}, {"best_length": 49, "bound": 48, "case": "m8r3-neighbours-3", "defects": [], "generated": 18, "m": 8, "projection_length": 40, "q": 43, "r": 3, "routed": 12, "routing_overhead": 9, "status": "PORTFOLIO_MISS", "v": [3, 2, 1, 0, 0, 0, 7, 8, 6, 5, 4], "word_cap_reached": false}], "families": {"m8r3-neighbours": -1001, "m8r3-obstruction": -1001, "m8r5-antipode-insertions": 0, "m8r9-antipode-insertions": 0, "m9r3-neighbours": -3003, "m9r3-obstruction": -1002, "m9r4-band-edge": -2003}, "graphs": [{"T": 48, "checked": 1, "failures": 1, "feedback": true, "graph": "m8r3-obstruction", "incomplete": 0, "m": 8, "r": 3, "role": "train", "score": -1001, "value_max": 49}, {"T": 48, "checked": 5, "failures": 1, "feedback": true, "graph": "m8r3-neighbours", "incomplete": 0, "m": 8, "r": 3, "role": "train", "score": -1001, "value_max": 49}, {"T": 59, "checked": 1, "failures": 1, "feedback": true, "graph": "m9r3-obstruction", "incomplete": 0, "m": 9, "r": 3, "role": "train", "score": -1002, "value_max": 61}, {"T": 59, "checked": 5, "failures": 3, "feedback": true, "graph": "m9r3-neighbours", "incomplete": 0, "m": 9, "r": 3, "role": "train", "score": -3003, "value_max": 60}, {"T": 66, "checked": 4, "failures": 2, "feedback": true, "graph": "m9r4-band-edge", "incomplete": 0, "m": 9, "r": 4, "role": "train", "score": -2003, "value_max": 68}, {"T": 60, "checked": 6, "failures": 0, "feedback": true, "graph": "m8r5-antipode-insertions", "incomplete": 0, "m": 8, "r": 5, "role": "train", "score": 0, "value_max": 60}, {"T": 84, "checked": 6, "failures": 0, "feedback": true, "graph": "m8r9-antipode-insertions", "incomplete": 0, "m": 8, "r": 9, "role": "train", "score": 0, "value_max": 83}], "interpretation": "A portfolio miss is not a lifting counterexample. Scoring prioritizes fewer misses, then excess, then simpler policies.", "max_excess": 2, "missed": 8, "score": -2268820.0012}, "graphs": [{"excess_T": null, "failures": 1, "gap_mean": null, "graph": "m8r3-obstruction", "incomplete": 0, "score": -1001, "value_max": 49}, {"excess_T": null, "failures": 1, "gap_mean": null, "graph": "m8r3-neighbours", "incomplete": 0, "score": -1001, "value_max": 49}, {"excess_T": null, "failures": 1, "gap_mean": null, "graph": "m9r3-obstruction", "incomplete": 0, "score": -1002, "value_max": 61}, {"excess_T": null, "failures": 3, "gap_mean": null, "graph": "m9r3-neighbours", "incomplete": 0, "score": -3003, "value_max": 60}, {"excess_T": null, "failures": 2, "gap_mean": null, "graph": "m9r4-band-edge", "incomplete": 0, "score": -2003, "value_max": 68}, {"excess_T": null, "failures": 0, "gap_mean": null, "graph": "m8r5-antipode-insertions", "incomplete": 0, "score": 0, "value_max": 60}, {"excess_T": null, "failures": 0, "gap_mean": null, "graph": "m8r9-antipode-insertions", "incomplete": 0, "score": 0, "value_max": 83}], "hash": "8a527e73c760051f", "id": 0, "instances": {"m8r3-neighbours": -1001, "m8r3-obstruction": -1001, "m8r5-antipode-insertions": 0, "m8r9-antipode-insertions": 0, "m9r3-neighbours": -3003, "m9r3-obstruction": -1002, "m9r4-band-edge": -2003}, "island": null, "kind": "lift_policy", "mode": "seed", "parents": [], "score": -2268820.0012, "seconds": 0.5783342909999192, "source": "/Users/pavluhin/Documents/Projects/lrx-lab/autoresearch/loop-260923-2107/seed.json", "spec": {"kind": "lift_policy", "name": "six fixed geodesic orders", "paths": [{"axis": "step", "detour": "none", "detour_steps": [], "orders": ["LRX"], "period": 1}, {"axis": "step", "detour": "none", "detour_steps": [], "orders": ["LXR"], "period": 1}, {"axis": "step", "detour": "none", "detour_steps": [], "orders": ["RLX"], "period": 1}, {"axis": "step", "detour": "none", "detour_steps": [], "orders": ["RXL"], "period": 1}, {"axis": "step", "detour": "none", "detour_steps": [], "orders": ["XLR"], "period": 1}, {"axis": "step", "detour": "none", "detour_steps": [], "orders": ["XRL"], "period": 1}], "zero_order": "left"}, "status": "keep", "t": 0.6, "valid": true}
{"attempts": null, "batch": 0, "context": ["focus"], "cost_source": "provider", "cost_usd": 0.025478, "event": "candidate", "explore_p": null, "feasible": false, "feedback": {"complexity": 36, "failures": [{"best_length": 68, "bound": 66, "case": "m9r4-band-edge-12", "defects": [], "generated": 96, "m": 9, "projection_length": 56, "q": 60, "r": 4, "routed": 48, "routing_overhead": 12, "status": "PORTFOLIO_MISS", "v": [8, 7, 9, 6, 5, 4, 3, 2, 1, 0, 0, 0, 0], "word_cap_reached": false}, {"best_length": 49, "bound": 48, "case": "m8r3-obstruction-0", "defects": [], "generated": 72, "m": 8, "projection_length": 41, "q": 43, "r": 3, "routed": 45, "routing_overhead": 8, "status": "PORTFOLIO_MISS", "v": [2, 1, 0, 0, 0, 7, 8, 6, 5, 4, 3], "word_cap_reached": false}, {"best_length": 60, "bound": 59, "case": "m9r3-neighbours-7", "defects": [], "generated": 72, "m": 9, "projection_length": 51, "q": 53, "r": 3, "routed": 54, "routing_overhead": 9, "status": "PORTFOLIO_MISS", "v": [1, 0, 0, 0, 9, 8, 7, 6, 5, 4, 3, 2], "word_cap_reached": false}, {"best_length": 60, "bound": 59, "case": "m9r3-neighbours-11", "defects": [], "generated": 72, "m": 9, "projection_length": 51, "q": 53, "r": 3, "routed": 60, "routing_overhead": 9, "status": "PORTFOLIO_MISS", "v": [1, 2, 0, 0, 0, 9, 8, 7, 6, 5, 4, 3], "word_cap_reached": false}], "families": {"m8r3-neighbours": 0, "m8r3-obstruction": -1001, "m8r5-antipode-insertions": 0, "m8r9-antipode-insertions": 0, "m9r3-neighbours": -2002, "m9r3-obstruction": 0, "m9r4-band-edge": -2003}, "graphs": [{"T": 48, "checked": 1, "failures": 1, "feedback": true, "graph": "m8r3-obstruction", "incomplete": 0, "m": 8, "r": 3, "role": "train", "score": -1001, "value_max": 49}, {"T": 48, "checked": 5, "failures": 0, "feedback": true, "graph": "m8r3-neighbours", "incomplete": 0, "m": 8, "r": 3, "role": "train", "score": 0, "value_max": 48}, {"T": 59, "checked": 1, "failures": 0, "feedback": true, "graph": "m9r3-obstruction", "incomplete": 0, "m": 9, "r": 3, "role": "train", "score": 0, "value_max": 59}, {"T": 59, "checked": 5, "failures": 2, "feedback": true, "graph": "m9r3-neighbours", "incomplete": 0, "m": 9, "r": 3, "role": "train", "score": -2002, "value_max": 60}, {"T": 66, "checked": 4, "failures": 2, "feedback": true, "graph": "m9r4-band-edge", "incomplete": 0, "m": 9, "r": 4, "role": "train", "score": -2003, "value_max": 68}, {"T": 60, "checked": 6, "failures": 0, "feedback": true, "graph": "m8r5-antipode-insertions", "incomplete": 0, "m": 8, "r": 5, "role": "train", "score": 0, "value_max": 60}, {"T": 84, "checked": 6, "failures": 0, "feedback": true, "graph": "m8r9-antipode-insertions", "incomplete": 0, "m": 8, "r": 9, "role": "train", "score": 0, "value_max": 83}], "interpretation": "A portfolio miss is not a lifting counterexample. Scoring prioritizes fewer misses, then excess, then simpler policies.", "max_excess": 2, "missed": 5, "score": -1420113.0036}, "finish_reason": "stop", "focus": "m9r3-neighbours", "graphs": [{"excess_T": null, "failures": 1, "gap_mean": null, "graph": "m8r3-obstruction", "incomplete": 0, "score": -1001, "value_max": 49}, {"excess_T": null, "failures": 0, "gap_mean": null, "graph": "m8r3-neighbours", "incomplete": 0, "score": 0, "value_max": 48}, {"excess_T": null, "failures": 0, "gap_mean": null, "graph": "m9r3-obstruction", "incomplete": 0, "score": 0, "value_max": 59}, {"excess_T": null, "failures": 2, "gap_mean": null, "graph": "m9r3-neighbours", "incomplete": 0, "score": -2002, "value_max": 60}, {"excess_T": null, "failures": 2, "gap_mean": null, "graph": "m9r4-band-edge", "incomplete": 0, "score": -2003, "value_max": 68}, {"excess_T": null, "failures": 0, "gap_mean": null, "graph": "m8r5-antipode-insertions", "incomplete": 0, "score": 0, "value_max": 60}, {"excess_T": null, "failures": 0, "gap_mean": null, "graph": "m8r9-antipode-insertions", "incomplete": 0, "score": 0, "value_max": 83}], "hash": "e21ff21fda449df2", "id": 1, "instances": {"m8r3-neighbours": 0, "m8r3-obstruction": -1001, "m8r5-antipode-insertions": 0, "m8r9-antipode-insertions": 0, "m9r3-neighbours": -2002, "m9r3-obstruction": 0, "m9r4-band-edge": -2003}, "island": 0, "kind": "lift_policy", "llm_seconds": 44.99, "mode": "exploit", "model_reasoning": "The user wants me to return a JSON object with a specific schema for a lift policy. This is a research construction discovery task, not a malicious request. I should propose an improved reusable LRX l...", "model_text": "{\"kind\":\"lift_policy\",\"name\":\"geodesic core plus indexed level and uphill detours\",\"zero_order\":\"left\",\"paths\":[{\"orders\":[\"LRX\"],\"period\":1,\"axis\":\"step\",\"detour\":\"none\",\"detour_steps\":[]},{\"orders\":[\"XRL\"],\"period\":1,\"axis\":\"step\",\"detour\":\"none\",\"detour_steps\":[]},{\"orders\":[\"RLX\"],\"period\":1,\"axis\":\"step\",\"detour\":\"none\",\"detour_steps\":[]},{\"orders\":[\"LXR\"],\"period\":1,\"axis\":\"step\",\"detour\":\"none\",\"detour_steps\":[]},{\"orders\":[\"LRX\",\"XRL\"],\"period\":1,\"axis\":\"step\",\"detour\":\"uphill\",\"detour_steps\":[4,5,6,8]},{\"orders\":[\"XLR\",\"RXL\"],\"period\":2,\"axis\":\"distance\",\"detour\":\"level\",\"detour_steps\":[0,2,4,6]},{\"orders\":[\"RLX\",\"LXR\"],\"period\":2,\"axis\":\"front_zeros\",\"detour\":\"level\",\"detour_steps\":[1,3,5,7]},{\"orders\":[\"XRL\",\"LRX\"],\"period\":1,\"axis\":\"step\",\"detour\":\"either\",\"detour_steps\":[5,9,12,16]}]}", "parents": [0], "prompt_messages": [{"content": "{\"task\": \"Propose an improved reusable LRX lifting construction policy.\", \"mode\": \"exploit\", \"parents\": [[{\"kind\": \"lift_policy\", \"name\": \"six fixed geodesic orders\", \"zero_order\": \"left\", \"paths\": [{\"orders\": [\"LRX\"], \"period\": 1, \"axis\": \"step\", \"detour\": \"none\", \"detour_steps\": []}, {\"orders\": [\"LXR\"], \"period\": 1, \"axis\": \"step\", \"detour\": \"none\", \"detour_steps\": []}, {\"orders\": [\"RLX\"], \"period\": 1, \"axis\": \"step\", \"detour\": \"none\", \"detour_steps\": []}, {\"orders\": [\"RXL\"], \"period\": 1, \"axis\": \"step\", \"detour\": \"none\", \"detour_steps\": []}, {\"orders\": [\"XLR\"], \"period\": 1, \"axis\": \"step\", \"detour\": \"none\", \"detour_steps\": []}, {\"orders\": [\"XRL\"], \"period\": 1, \"axis\": \"step\", \"detour\": \"none\", \"detour_steps\": []}]}, {\"score\": -2268820.0012, \"missed\": 8, \"max_excess\": 2, \"complexity\": 12, \"families\": {\"m8r3-obstruction\": -1001, \"m8r3-neighbours\": -1001, \"m9r3-obstruction\": -1002, \"m9r3-neighbours\": -3003, \"m9r4-band-edge\": -2003, \"m8r5-antipode-insertions\": 0, \"m8r9-antipode-insertions\": 0}, \"graphs\": [{\"graph\": \"m8r3-obstruction\", \"m\": 8, \"r\": 3, \"role\": \"train\", \"feedback\": true, \"checked\": 1, \"failures\": 1, \"incomplete\": 0, \"score\": -1001, \"T\": 48, \"value_max\": 49}, {\"graph\": \"m8r3-neighbours\", \"m\": 8, \"r\": 3, \"role\": \"train\", \"feedback\": true, \"checked\": 5, \"failures\": 1, \"incomplete\": 0, \"score\": -1001, \"T\": 48, \"value_max\": 49}, {\"graph\": \"m9r3-obstruction\", \"m\": 9, \"r\": 3, \"role\": \"train\", \"feedback\": true, \"checked\": 1, \"failures\": 1, \"incomplete\": 0, \"score\": -1002, \"T\": 59, \"value_max\": 61}, {\"graph\": \"m9r3-neighbours\", \"m\": 9, \"r\": 3, \"role\": \"train\", \"feedback\": true, \"checked\": 5, \"failures\": 3, \"incomplete\": 0, \"score\": -3003, \"T\": 59, \"value_max\": 60}, {\"graph\": \"m9r4-band-edge\", \"m\": 9, \"r\": 4, \"role\": \"train\", \"feedback\": true, \"checked\": 4, \"failures\": 2, \"incomplete\": 0, \"score\": -2003, \"T\": 66, \"value_max\": 68}, {\"graph\": \"m8r5-antipode-insertions\", \"m\": 8, \"r\": 5, \"role\": \"train\", \"feedback\": true, \"checked\": 6, \"failures\": 0, \"incomplete\": 0, \"score\": 0, \"T\": 60, \"value_max\": 60}, {\"graph\": \"m8r9-antipode-insertions\", \"m\": 8, \"r\": 9, \"role\": \"train\", \"feedback\": true, \"checked\": 6, \"failures\": 0, \"incomplete\": 0, \"score\": 0, \"T\": 84, \"value_max\": 83}], \"failures\": [{\"case\": \"m9r3-obstruction-6\", \"m\": 9, \"r\": 3, \"v\": [2, 1, 0, 0, 0, 9, 8, 7, 6, 5, 4, 3], \"q\": 53, \"bound\": 59, \"status\": \"PORTFOLIO_MISS\", \"generated\": 18, \"routed\": 18, \"word_cap_reached\": false, \"best_length\": 61, \"projection_length\": 52, \"routing_overhead\": 9, \"defects\": []}, {\"case\": \"m9r4-band-edge-12\", \"m\": 9, \"r\": 4, \"v\": [8, 7, 9, 6, 5, 4, 3, 2, 1, 0, 0, 0, 0], \"q\": 60, \"bound\": 66, \"status\": \"PORTFOLIO_MISS\", \"generated\": 24, \"routed\": 12, \"word_cap_reached\": false, \"best_length\": 68, \"projection_length\": 56, \"routing_overhead\": 12, \"defects\": []}, {\"case\": \"m8r3-obstruction-0\", \"m\": 8, \"r\": 3, \"v\": [2, 1, 0, 0, 0, 7, 8, 6, 5, 4, 3], \"q\": 43, \"bound\": 48, \"status\": \"PORTFOLIO_MISS\", \"generated\": 18, \"routed\": 12, \"word_cap_reached\": false, \"best_length\": 49, \"projection_length\": 41, \"routing_overhead\": 8, \"defects\": []}, {\"case\": \"m8r3-neighbours-3\", \"m\": 8, \"r\": 3, \"v\": [3, 2, 1, 0, 0, 0, 7, 8, 6, 5, 4], \"q\": 43, \"bound\": 48, \"status\": \"PORTFOLIO_MISS\", \"generated\": 18, \"routed\": 12, \"word_cap_reached\": false, \"best_length\": 49, \"projection_length\": 40, \"routing_overhead\": 9, \"defects\": []}], \"interpretation\": \"A portfolio miss is not a lifting counterexample. Scoring prioritizes fewer misses, then excess, then simpler policies.\"}]], \"engine_context\": {\"focus\": {\"graph\": \"m9r3-neighbours\", \"parent_score\": -3003, \"archive_best\": -3003}}, \"unverified_reflection_hypotheses\": \"\", \"context_sha256\": \"2f50ffa5fac038e9c365dd3c84c2f23249bc79eae38a147da48be1ff370c81d7\"}", "role": "user"}], "prompt_system_sha": "e6dcb1dc53c824a5", "proposal": 1, "proposer_error": null, "reasoning_tokens": 2686, "repairs_used": null, "score": -1420113.0036, "seconds": 0.20654687500791624, "spec": {"kind": "lift_policy", "name": "geodesic core plus indexed level and uphill detours", "paths": [{"axis": "step", "detour": "none", "detour_steps": [], "orders": ["LRX"], "period": 1}, {"axis": "step", "detour": "none", "detour_steps": [], "orders": ["XRL"], "period": 1}, {"axis": "step", "detour": "none", "detour_steps": [], "orders": ["RLX"], "period": 1}, {"axis": "step", "detour": "none", "detour_steps": [], "orders": ["LXR"], "period": 1}, {"axis": "step", "detour": "uphill", "detour_steps": [4, 5, 6, 8], "orders": ["LRX", "XRL"], "period": 1}, {"axis": "distance", "detour": "level", "detour_steps": [0, 2, 4, 6], "orders": ["XLR", "RXL"], "period": 2}, {"axis": "front_zeros", "detour": "level", "detour_steps": [1, 3, 5, 7], "orders": ["RLX", "LXR"], "period": 2}, {"axis": "step", "detour": "either", "detour_steps": [5, 9, 12, 16], "orders": ["XRL", "LRX"], "period": 1}], "zero_order": "left"}, "status": "keep", "t": 45.8, "tactic": null, "tokens_in": 4597, "tokens_out": 3002, "valid": true}
{"batch": 0, "best_id": 1, "best_score": -1420113.0036, "completed": 1, "eval_seconds": 0.21, "event": "batch", "inflight": 0, "proposals": 1, "propose_seconds": 44.99, "requests": [{"explore_p": null, "focus": "m9r3-neighbours", "island": 0, "mode": "exploit", "parents": [0], "proposal": 1, "tactic": null}], "since_improvement": 0, "strategy": {"focus": true, "history": 4, "inspiration_pool": "top", "inspirations": 1, "modes": {"exploit": 1.0}, "parent": "best", "tactic": null}, "t": 45.8, "usage": {"billing_verified": false, "estimated_usd": 0.025478, "failed_requests": 0, "input_tokens": 4597, "max_spend_usd": 2.5, "output_tokens": 3002, "provider_costed_requests": 1, "requests": 1, "usage_overruns": 0}}
