{"cost_usd": 0.015574, "error": null, "event": "reflection", "llm_seconds": 5.87, "prompt_messages": [{"content": "{\"task\": \"strategy\", \"allowed_kinds\": [\"lift_policy\"], \"proposals\": 9, \"remaining_proposals\": 3, \"best\": [{\"spec\": {\"kind\": \"lift_policy\", \"name\": \"left zeros, step-five uphill, distance band repair\", \"zero_order\": \"left\", \"paths\": [{\"orders\": [\"LRX\"], \"period\": 1, \"axis\": \"step\", \"detour\": \"none\", \"detour_steps\": []}, {\"orders\": [\"XRL\"], \"period\": 1, \"axis\": \"step\", \"detour\": \"none\", \"detour_steps\": []}, {\"orders\": [\"RLX\"], \"period\": 1, \"axis\": \"step\", \"detour\": \"none\", \"detour_steps\": []}, {\"orders\": [\"LXR\"], \"period\": 1, \"axis\": \"step\", \"detour\": \"none\", \"detour_steps\": []}, {\"orders\": [\"LRX\"], \"period\": 1, \"axis\": \"step\", \"detour\": \"uphill\", \"detour_steps\": [5]}, {\"orders\": [\"RLX\"], \"period\": 1, \"axis\": \"step\", \"detour\": \"uphill\", \"detour_steps\": [5]}, {\"orders\": [\"XLR\", \"RXL\"], \"period\": 4, \"axis\": \"distance\", \"detour\": \"uphill\", \"detour_steps\": [5]}, {\"orders\": [\"XLR\", \"RXL\"], \"period\": 2, \"axis\": \"distance\", \"detour\": \"level\", \"detour_steps\": [0, 2, 4, 6]}]}, \"feedback\": {\"score\": -1134409.0025, \"missed\": 4, \"max_excess\": 1, \"complexity\": 25, \"families\": {\"m8r3-obstruction\": -1001, \"m8r3-neighbours\": -1001, \"m9r3-obstruction\": 0, \"m9r3-neighbours\": -2002, \"m9r4-band-edge\": 0, \"m8r5-antipode-insertions\": 0, \"m8r9-antipode-insertions\": 0}, \"graphs\": [{\"graph\": \"m8r3-obstruction\", \"m\": 8, \"r\": 3, \"role\": \"train\", \"feedback\": true, \"checked\": 1, \"failures\": 1, \"incomplete\": 0, \"score\": -1001, \"T\": 48, \"value_max\": 49}, {\"graph\": \"m8r3-neighbours\", \"m\": 8, \"r\": 3, \"role\": \"train\", \"feedback\": true, \"checked\": 5, \"failures\": 1, \"incomplete\": 0, \"score\": -1001, \"T\": 48, \"value_max\": 49}, {\"graph\": \"m9r3-obstruction\", \"m\": 9, \"r\": 3, \"role\": \"train\", \"feedback\": true, \"checked\": 1, \"failures\": 0, \"incomplete\": 0, \"score\": 0, \"T\": 59, \"value_max\": 59}, {\"graph\": \"m9r3-neighbours\", \"m\": 9, \"r\": 3, \"role\": \"train\", \"feedback\": true, \"checked\": 5, \"failures\": 2, \"incomplete\": 0, \"score\": -2002, \"T\": 59, \"value_max\": 60}, {\"graph\": \"m9r4-band-edge\", \"m\": 9, \"r\": 4, \"role\": \"train\", \"feedback\": true, \"checked\": 4, \"failures\": 0, \"incomplete\": 0, \"score\": 0, \"T\": 66, \"value_max\": 66}, {\"graph\": \"m8r5-antipode-insertions\", \"m\": 8, \"r\": 5, \"role\": \"train\", \"feedback\": true, \"checked\": 6, \"failures\": 0, \"incomplete\": 0, \"score\": 0, \"T\": 60, \"value_max\": 60}, {\"graph\": \"m8r9-antipode-insertions\", \"m\": 8, \"r\": 9, \"role\": \"train\", \"feedback\": true, \"checked\": 6, \"failures\": 0, \"incomplete\": 0, \"score\": 0, \"T\": 84, \"value_max\": 83}], \"failures\": [{\"case\": \"m8r3-obstruction-0\", \"m\": 8, \"r\": 3, \"v\": [2, 1, 0, 0, 0, 7, 8, 6, 5, 4, 3], \"q\": 43, \"bound\": 48, \"status\": \"PORTFOLIO_MISS\", \"generated\": 45, \"routed\": 27, \"word_cap_reached\": false, \"best_length\": 49, \"projection_length\": 41, \"routing_overhead\": 8, \"defects\": []}, {\"case\": \"m8r3-neighbours-3\", \"m\": 8, \"r\": 3, \"v\": [3, 2, 1, 0, 0, 0, 7, 8, 6, 5, 4], \"q\": 43, \"bound\": 48, \"status\": \"PORTFOLIO_MISS\", \"generated\": 45, \"routed\": 21, \"word_cap_reached\": false, \"best_length\": 49, \"projection_length\": 40, \"routing_overhead\": 9, \"defects\": []}, {\"case\": \"m9r3-neighbours-7\", \"m\": 9, \"r\": 3, \"v\": [1, 0, 0, 0, 9, 8, 7, 6, 5, 4, 3, 2], \"q\": 53, \"bound\": 59, \"status\": \"PORTFOLIO_MISS\", \"generated\": 45, \"routed\": 27, \"word_cap_reached\": false, \"best_length\": 60, \"projection_length\": 51, \"routing_overhead\": 9, \"defects\": []}, {\"case\": \"m9r3-neighbours-11\", \"m\": 9, \"r\": 3, \"v\": [1, 2, 0, 0, 0, 9, 8, 7, 6, 5, 4, 3], \"q\": 53, \"bound\": 59, \"status\": \"PORTFOLIO_MISS\", \"generated\": 45, \"routed\": 36, \"word_cap_reached\": false, \"best_length\": 60, \"projection_length\": 51, \"routing_overhead\": 9, \"defects\": []}], \"interpretation\": \"A portfolio miss is not a lifting counterexample. Scoring prioritizes fewer misses, then excess, then simpler policies.\"}}], \"recent_attempts\": [{\"id\": 9, \"mode\": \"explore\", \"parents\": [5], \"status\": \"discard\", \"score\": -1985918.003, \"parent_score\": -1134409.0028, \"problem_graphs\": [{\"graph\": \"m8r3-obstruction\", \"score\": -1001, \"failures\": 1}, {\"graph\": \"m8r3-neighbours\", \"score\": -1001, \"failures\": 1}, {\"graph\": \"m9r3-obstruction\", \"score\": -1002, \"failures\": 1}, {\"graph\": \"m9r3-neighbours\", \"score\": -2002, \"failures\": 2}]}, {\"id\": 8, \"mode\": \"exploit\", \"parents\": [1], \"status\": \"discard\", \"score\": -2268821.0024, \"parent_score\": -1420113.0036, \"problem_graphs\": [{\"graph\": \"m8r3-obstruction\", \"score\": -1002, \"failures\": 1}, {\"graph\": \"m8r3-neighbours\", \"score\": -2002, \"failures\": 2}, {\"graph\": \"m9r3-obstruction\", \"score\": -1002, \"failures\": 1}, {\"graph\": \"m9r3-neighbours\", \"score\": -3003, \"failures\": 3}]}, {\"id\": 7, \"mode\": \"exploit\", \"parents\": [3], \"status\": \"discard\", \"score\": -2268819.0029, \"parent_score\": -1134409.0025, \"problem_graphs\": [{\"graph\": \"m8r3-obstruction\", \"score\": -1001, \"failures\": 1}, {\"graph\": \"m8r3-neighbours\", \"score\": -1001, \"failures\": 1}, {\"graph\": \"m9r3-obstruction\", \"score\": -1002, \"failures\": 1}, {\"graph\": \"m9r3-neighbours\", \"score\": -3003, \"failures\": 3}]}, {\"id\": 6, \"mode\": \"exploit\", \"parents\": [3], \"status\": \"discard\", \"score\": -2271622.0027, \"parent_score\": -1134409.0025, \"problem_graphs\": [{\"graph\": \"m8r3-obstruction\", \"score\": -1003, \"failures\": 1}, {\"graph\": \"m8r3-neighbours\", \"score\": -2002, \"failures\": 2}, {\"graph\": \"m9r3-obstruction\", \"score\": -1002, \"failures\": 1}, {\"graph\": \"m9r3-neighbours\", \"score\": -3003, \"failures\": 3}], \"focus\": \"m8r3-neighbours\"}, {\"id\": 5, \"mode\": \"exploit\", \"parents\": [3], \"status\": \"discard\", \"score\": -1134409.0028, \"parent_score\": -1134409.0025, \"problem_graphs\": [{\"graph\": \"m8r3-obstruction\", \"score\": -1001, \"failures\": 1}, {\"graph\": \"m8r3-neighbours\", \"score\": -1001, \"failures\": 1}, {\"graph\": \"m9r3-neighbours\", \"score\": -2002, \"failures\": 2}], \"focus\": \"m8r3-neighbours\"}, {\"id\": 4, \"mode\": \"exploit\", \"parents\": [3], \"status\": \"discard\", \"score\": -1700213.0027, \"parent_score\": -1134409.0025, \"problem_graphs\": [{\"graph\": \"m8r3-obstruction\", \"score\": -1001, \"failures\": 1}, {\"graph\": \"m8r3-neighbours\", \"score\": -1001, \"failures\": 1}, {\"graph\": \"m9r3-neighbours\", \"score\": -2002, \"failures\": 2}, {\"graph\": \"m9r4-band-edge\", \"score\": -2002, \"failures\": 2}], \"focus\": \"m8r3-neighbours\"}, {\"id\": 3, \"mode\": \"exploit\", \"parents\": [1], \"status\": \"keep\", \"score\": -1134409.0025, \"parent_score\": -1420113.0036, \"problem_graphs\": [{\"graph\": \"m8r3-obstruction\", \"score\": -1001, \"failures\": 1}, {\"graph\": \"m8r3-neighbours\", \"score\": -1001, \"failures\": 1}, {\"graph\": \"m9r3-neighbours\", \"score\": -2002, \"failures\": 2}], \"focus\": \"m9r4-band-edge\"}, {\"id\": 2, \"mode\": \"exploit\", \"parents\": [1], \"status\": \"discard\", \"score\": -1988721.0025, \"parent_score\": -1420113.0036, \"problem_graphs\": [{\"graph\": \"m8r3-obstruction\", \"score\": -1001, \"failures\": 1}, {\"graph\": \"m8r3-neighbours\", \"score\": -1001, \"failures\": 1}, {\"graph\": \"m9r3-obstruction\", \"score\": -1002, \"failures\": 1}, {\"graph\": \"m9r3-neighbours\", \"score\": -4007, \"failures\": 4}], \"focus\": \"m9r4-band-edge\"}], \"current_insights\": [], \"current_strategy\": {\"parent\": \"front\", \"modes\": {\"exploit\": 0.25, \"explore\": 0.45, \"edit\": 0.3}, \"inspirations\": 2, \"inspiration_pool\": \"random\", \"history\": 6, \"focus\": false, \"tactic\": \"Plateau: six best-parent exploits did not beat -1134409 with 4 misses. Leave that parent. Prefer front diversity and edits that change zero_order, axis, period, or detour type rather than only step-5 uphill. Keep portfolios small. Target reusable coordination of descents with zero routing; do not encode individual vectors. Finite misses are portfolio misses only.\"}, \"strategy_history\": [{\"strategy\": {\"parent\": \"best\", \"modes\": {\"exploit\": 1.0}, \"inspirations\": 1, \"inspiration_pool\": \"top\", \"history\": 4, \"focus\": true, \"tactic\": null}, \"start\": -2268820.0012, \"end\": -1134409.0025, \"delta\": 1134410.9987, \"J\": 0.288675, \"proposals\": 3}, {\"strategy\": {\"parent\": \"best\", \"modes\": {\"exploit\": 1.0}, \"inspirations\": 1, \"inspiration_pool\": \"top\", \"history\": 4, \"focus\": true, \"tactic\": null}, \"start\": -1134409.0025, \"end\": -1134409.0025, \"delta\": 0.0, \"J\": 0.0, \"proposals\": 6}, {\"strategy\": {\"parent\": \"front\", \"modes\": {\"exploit\": 0.25, \"explore\": 0.45, \"edit\": 0.3}, \"inspirations\": 2, \"inspiration_pool\": \"random\", \"history\": 6, \"focus\": false, \"tactic\": \"Plateau: six best-parent exploits did not beat -1134409 with 4 misses. Leave that parent. Prefer front diversity and edits that change zero_order, axis, period, or detour type rather than only step-5 uphill. Keep portfolios small. Target reusable coordination of descents with zero routing; do not encode individual vectors. Finite misses are portfolio misses only.\"}, \"start\": -1134409.0025, \"end\": -1134409.0025, \"delta\": 0.0, \"J\": 0.0, \"proposals\": 9}], \"population\": {\"archive\": 10, \"best_score\": -1134409.0025, \"median_score\": -1988721.0025, \"front_size\": 3, \"modes\": {\"exploit\": {\"n\": 8, \"keep\": 2, \"invalid\": 0}, \"explore\": {\"n\": 1, \"keep\": 0, \"invalid\": 0}}}}", "role": "user"}], "prompt_system_sha": "91c18bde5bc0dd76", "proposals": 9, "strategy": {"focus": true, "history": 3, "inspiration_pool": "top", "inspirations": 1, "modes": {"edit": 0.6, "exploit": 0.15, "explore": 0.25}, "parent": "random", "tactic": "Front diversity and best-parent exploit both plateaued at 4 misses. Sample random archive parents and edit zero_order, axis, and detour type together, not only step-5 uphill. Keep portfolios small. Coordinate descents with zero routing; no per-vector exceptions. Finite misses are portfolio misses only."}, "t": 338.0, "task": "strategy", "text": "{\"parent\":\"random\",\"modes\":{\"exploit\":0.15,\"explore\":0.25,\"edit\":0.6},\"inspirations\":1,\"inspiration_pool\":\"top\",\"history\":3,\"focus\":true,\"tactic\":\"Front diversity and best-parent exploit both plateaued at 4 misses. Sample random archive parents and edit zero_order, axis, and detour type together, not only step-5 uphill. Keep portfolios small. Coordinate descents with zero routing; no per-vector exceptions. Finite misses are portfolio misses only.\"}", "tokens_in": 6593, "tokens_out": 398}
