{"attempts": null, "batch": 2, "context": ["focus", "history", "inspirations"], "cost_source": "provider", "cost_usd": 0.027268, "event": "candidate", "explore_p": null, "feasible": false, "feedback": {"complexity": 25, "failures": [{"best_length": 49, "bound": 48, "case": "m8r3-obstruction-0", "defects": [], "generated": 45, "m": 8, "projection_length": 41, "q": 43, "r": 3, "routed": 27, "routing_overhead": 8, "status": "PORTFOLIO_MISS", "v": [2, 1, 0, 0, 0, 7, 8, 6, 5, 4, 3], "word_cap_reached": false}, {"best_length": 49, "bound": 48, "case": "m8r3-neighbours-3", "defects": [], "generated": 45, "m": 8, "projection_length": 40, "q": 43, "r": 3, "routed": 21, "routing_overhead": 9, "status": "PORTFOLIO_MISS", "v": [3, 2, 1, 0, 0, 0, 7, 8, 6, 5, 4], "word_cap_reached": false}, {"best_length": 60, "bound": 59, "case": "m9r3-neighbours-7", "defects": [], "generated": 45, "m": 9, "projection_length": 51, "q": 53, "r": 3, "routed": 27, "routing_overhead": 9, "status": "PORTFOLIO_MISS", "v": [1, 0, 0, 0, 9, 8, 7, 6, 5, 4, 3, 2], "word_cap_reached": false}, {"best_length": 60, "bound": 59, "case": "m9r3-neighbours-11", "defects": [], "generated": 45, "m": 9, "projection_length": 51, "q": 53, "r": 3, "routed": 36, "routing_overhead": 9, "status": "PORTFOLIO_MISS", "v": [1, 2, 0, 0, 0, 9, 8, 7, 6, 5, 4, 3], "word_cap_reached": false}], "families": {"m8r3-neighbours": -1001, "m8r3-obstruction": -1001, "m8r5-antipode-insertions": 0, "m8r9-antipode-insertions": 0, "m9r3-neighbours": -2002, "m9r3-obstruction": 0, "m9r4-band-edge": 0}, "graphs": [{"T": 48, "checked": 1, "failures": 1, "feedback": true, "graph": "m8r3-obstruction", "incomplete": 0, "m": 8, "r": 3, "role": "train", "score": -1001, "value_max": 49}, {"T": 48, "checked": 5, "failures": 1, "feedback": true, "graph": "m8r3-neighbours", "incomplete": 0, "m": 8, "r": 3, "role": "train", "score": -1001, "value_max": 49}, {"T": 59, "checked": 1, "failures": 0, "feedback": true, "graph": "m9r3-obstruction", "incomplete": 0, "m": 9, "r": 3, "role": "train", "score": 0, "value_max": 59}, {"T": 59, "checked": 5, "failures": 2, "feedback": true, "graph": "m9r3-neighbours", "incomplete": 0, "m": 9, "r": 3, "role": "train", "score": -2002, "value_max": 60}, {"T": 66, "checked": 4, "failures": 0, "feedback": true, "graph": "m9r4-band-edge", "incomplete": 0, "m": 9, "r": 4, "role": "train", "score": 0, "value_max": 66}, {"T": 60, "checked": 6, "failures": 0, "feedback": true, "graph": "m8r5-antipode-insertions", "incomplete": 0, "m": 8, "r": 5, "role": "train", "score": 0, "value_max": 60}, {"T": 84, "checked": 6, "failures": 0, "feedback": true, "graph": "m8r9-antipode-insertions", "incomplete": 0, "m": 8, "r": 9, "role": "train", "score": 0, "value_max": 83}], "interpretation": "A portfolio miss is not a lifting counterexample. Scoring prioritizes fewer misses, then excess, then simpler policies.", "max_excess": 1, "missed": 4, "score": -1134409.0025}, "finish_reason": "stop", "focus": "m9r4-band-edge", "graphs": [{"excess_T": null, "failures": 1, "gap_mean": null, "graph": "m8r3-obstruction", "incomplete": 0, "score": -1001, "value_max": 49}, {"excess_T": null, "failures": 1, "gap_mean": null, "graph": "m8r3-neighbours", "incomplete": 0, "score": -1001, "value_max": 49}, {"excess_T": null, "failures": 0, "gap_mean": null, "graph": "m9r3-obstruction", "incomplete": 0, "score": 0, "value_max": 59}, {"excess_T": null, "failures": 2, "gap_mean": null, "graph": "m9r3-neighbours", "incomplete": 0, "score": -2002, "value_max": 60}, {"excess_T": null, "failures": 0, "gap_mean": null, "graph": "m9r4-band-edge", "incomplete": 0, "score": 0, "value_max": 66}, {"excess_T": null, "failures": 0, "gap_mean": null, "graph": "m8r5-antipode-insertions", "incomplete": 0, "score": 0, "value_max": 60}, {"excess_T": null, "failures": 0, "gap_mean": null, "graph": "m8r9-antipode-insertions", "incomplete": 0, "score": 0, "value_max": 83}], "hash": "7e7c102248da0306", "id": 3, "instances": {"m8r3-neighbours": -1001, "m8r3-obstruction": -1001, "m8r5-antipode-insertions": 0, "m8r9-antipode-insertions": 0, "m9r3-neighbours": -2002, "m9r3-obstruction": 0, "m9r4-band-edge": 0}, "island": 0, "kind": "lift_policy", "llm_seconds": 35.36, "mode": "exploit", "model_reasoning": "The user wants me to return a JSON object with a specific schema for a lift policy. This is a research construction discovery task, not a disallowed topic. I should propose an improved reusable LRX li...", "model_text": "{\"kind\":\"lift_policy\",\"name\":\"left zeros, step-five uphill, distance band repair\",\"zero_order\":\"left\",\"paths\":[{\"orders\":[\"LRX\"],\"period\":1,\"axis\":\"step\",\"detour\":\"none\",\"detour_steps\":[]},{\"orders\":[\"XRL\"],\"period\":1,\"axis\":\"step\",\"detour\":\"none\",\"detour_steps\":[]},{\"orders\":[\"RLX\"],\"period\":1,\"axis\":\"step\",\"detour\":\"none\",\"detour_steps\":[]},{\"orders\":[\"LXR\"],\"period\":1,\"axis\":\"step\",\"detour\":\"none\",\"detour_steps\":[]},{\"orders\":[\"LRX\"],\"period\":1,\"axis\":\"step\",\"detour\":\"uphill\",\"detour_steps\":[5]},{\"orders\":[\"RLX\"],\"period\":1,\"axis\":\"step\",\"detour\":\"uphill\",\"detour_steps\":[5]},{\"orders\":[\"XLR\",\"RXL\"],\"period\":4,\"axis\":\"distance\",\"detour\":\"uphill\",\"detour_steps\":[5]},{\"orders\":[\"XLR\",\"RXL\"],\"period\":2,\"axis\":\"distance\",\"detour\":\"level\",\"detour_steps\":[0,2,4,6]}]}", "parents": [1], "prompt_messages": [{"content": "{\"task\": \"Propose an improved reusable LRX lifting construction policy.\", \"mode\": \"exploit\", \"parents\": [[{\"kind\": \"lift_policy\", \"name\": \"geodesic core plus indexed level and uphill detours\", \"zero_order\": \"left\", \"paths\": [{\"orders\": [\"LRX\"], \"period\": 1, \"axis\": \"step\", \"detour\": \"none\", \"detour_steps\": []}, {\"orders\": [\"XRL\"], \"period\": 1, \"axis\": \"step\", \"detour\": \"none\", \"detour_steps\": []}, {\"orders\": [\"RLX\"], \"period\": 1, \"axis\": \"step\", \"detour\": \"none\", \"detour_steps\": []}, {\"orders\": [\"LXR\"], \"period\": 1, \"axis\": \"step\", \"detour\": \"none\", \"detour_steps\": []}, {\"orders\": [\"LRX\", \"XRL\"], \"period\": 1, \"axis\": \"step\", \"detour\": \"uphill\", \"detour_steps\": [4, 5, 6, 8]}, {\"orders\": [\"XLR\", \"RXL\"], \"period\": 2, \"axis\": \"distance\", \"detour\": \"level\", \"detour_steps\": [0, 2, 4, 6]}, {\"orders\": [\"RLX\", \"LXR\"], \"period\": 2, \"axis\": \"front_zeros\", \"detour\": \"level\", \"detour_steps\": [1, 3, 5, 7]}, {\"orders\": [\"XRL\", \"LRX\"], \"period\": 1, \"axis\": \"step\", \"detour\": \"either\", \"detour_steps\": [5, 9, 12, 16]}]}, {\"score\": -1420113.0036, \"missed\": 5, \"max_excess\": 2, \"complexity\": 36, \"families\": {\"m8r3-obstruction\": -1001, \"m8r3-neighbours\": 0, \"m9r3-obstruction\": 0, \"m9r3-neighbours\": -2002, \"m9r4-band-edge\": -2003, \"m8r5-antipode-insertions\": 0, \"m8r9-antipode-insertions\": 0}, \"graphs\": [{\"graph\": \"m8r3-obstruction\", \"m\": 8, \"r\": 3, \"role\": \"train\", \"feedback\": true, \"checked\": 1, \"failures\": 1, \"incomplete\": 0, \"score\": -1001, \"T\": 48, \"value_max\": 49}, {\"graph\": \"m8r3-neighbours\", \"m\": 8, \"r\": 3, \"role\": \"train\", \"feedback\": true, \"checked\": 5, \"failures\": 0, \"incomplete\": 0, \"score\": 0, \"T\": 48, \"value_max\": 48}, {\"graph\": \"m9r3-obstruction\", \"m\": 9, \"r\": 3, \"role\": \"train\", \"feedback\": true, \"checked\": 1, \"failures\": 0, \"incomplete\": 0, \"score\": 0, \"T\": 59, \"value_max\": 59}, {\"graph\": \"m9r3-neighbours\", \"m\": 9, \"r\": 3, \"role\": \"train\", \"feedback\": true, \"checked\": 5, \"failures\": 2, \"incomplete\": 0, \"score\": -2002, \"T\": 59, \"value_max\": 60}, {\"graph\": \"m9r4-band-edge\", \"m\": 9, \"r\": 4, \"role\": \"train\", \"feedback\": true, \"checked\": 4, \"failures\": 2, \"incomplete\": 0, \"score\": -2003, \"T\": 66, \"value_max\": 68}, {\"graph\": \"m8r5-antipode-insertions\", \"m\": 8, \"r\": 5, \"role\": \"train\", \"feedback\": true, \"checked\": 6, \"failures\": 0, \"incomplete\": 0, \"score\": 0, \"T\": 60, \"value_max\": 60}, {\"graph\": \"m8r9-antipode-insertions\", \"m\": 8, \"r\": 9, \"role\": \"train\", \"feedback\": true, \"checked\": 6, \"failures\": 0, \"incomplete\": 0, \"score\": 0, \"T\": 84, \"value_max\": 83}], \"failures\": [{\"case\": \"m9r4-band-edge-12\", \"m\": 9, \"r\": 4, \"v\": [8, 7, 9, 6, 5, 4, 3, 2, 1, 0, 0, 0, 0], \"q\": 60, \"bound\": 66, \"status\": \"PORTFOLIO_MISS\", \"generated\": 96, \"routed\": 48, \"word_cap_reached\": false, \"best_length\": 68, \"projection_length\": 56, \"routing_overhead\": 12, \"defects\": []}, {\"case\": \"m8r3-obstruction-0\", \"m\": 8, \"r\": 3, \"v\": [2, 1, 0, 0, 0, 7, 8, 6, 5, 4, 3], \"q\": 43, \"bound\": 48, \"status\": \"PORTFOLIO_MISS\", \"generated\": 72, \"routed\": 45, \"word_cap_reached\": false, \"best_length\": 49, \"projection_length\": 41, \"routing_overhead\": 8, \"defects\": []}, {\"case\": \"m9r3-neighbours-7\", \"m\": 9, \"r\": 3, \"v\": [1, 0, 0, 0, 9, 8, 7, 6, 5, 4, 3, 2], \"q\": 53, \"bound\": 59, \"status\": \"PORTFOLIO_MISS\", \"generated\": 72, \"routed\": 54, \"word_cap_reached\": false, \"best_length\": 60, \"projection_length\": 51, \"routing_overhead\": 9, \"defects\": []}, {\"case\": \"m9r3-neighbours-11\", \"m\": 9, \"r\": 3, \"v\": [1, 2, 0, 0, 0, 9, 8, 7, 6, 5, 4, 3], \"q\": 53, \"bound\": 59, \"status\": \"PORTFOLIO_MISS\", \"generated\": 72, \"routed\": 60, \"word_cap_reached\": false, \"best_length\": 60, \"projection_length\": 51, \"routing_overhead\": 9, \"defects\": []}], \"interpretation\": \"A portfolio miss is not a lifting counterexample. Scoring prioritizes fewer misses, then excess, then simpler policies.\"}]], \"engine_context\": {\"history\": [{\"id\": 2, \"mode\": \"exploit\", \"parents\": [1], \"status\": \"discard\", \"score\": -1988721.0025, \"parent_score\": -1420113.0036, \"problem_graphs\": [{\"graph\": \"m8r3-obstruction\", \"score\": -1001, \"failures\": 1}, {\"graph\": \"m8r3-neighbours\", \"score\": -1001, \"failures\": 1}, {\"graph\": \"m9r3-obstruction\", \"score\": -1002, \"failures\": 1}, {\"graph\": \"m9r3-neighbours\", \"score\": -4007, \"failures\": 4}], \"focus\": \"m9r4-band-edge\"}, {\"id\": 1, \"mode\": \"exploit\", \"parents\": [0], \"status\": \"keep\", \"score\": -1420113.0036, \"parent_score\": -2268820.0012, \"problem_graphs\": [{\"graph\": \"m8r3-obstruction\", \"score\": -1001, \"failures\": 1}, {\"graph\": \"m9r3-neighbours\", \"score\": -2002, \"failures\": 2}, {\"graph\": \"m9r4-band-edge\", \"score\": -2003, \"failures\": 2}], \"focus\": \"m9r3-neighbours\"}], \"inspirations\": [{\"id\": 2, \"score\": -1988721.0025, \"graph_scores\": {\"m8r3-obstruction\": -1001, \"m8r3-neighbours\": -1001, \"m9r3-obstruction\": -1002, \"m9r3-neighbours\": -4007, \"m9r4-band-edge\": 0, \"m8r5-antipode-insertions\": 0, \"m8r9-antipode-insertions\": 0}, \"spec\": {\"kind\": \"lift_policy\", \"name\": \"distance-timed uphill at five plus level zeros\", \"zero_order\": \"distance_low\", \"paths\": [{\"orders\": [\"LRX\"], \"period\": 1, \"axis\": \"step\", \"detour\": \"none\", \"detour_steps\": []}, {\"orders\": [\"XRL\"], \"period\": 1, \"axis\": \"step\", \"detour\": \"none\", \"detour_steps\": []}, {\"orders\": [\"RLX\"], \"period\": 1, \"axis\": \"step\", \"detour\": \"none\", \"detour_steps\": []}, {\"orders\": [\"XLR\"], \"period\": 1, \"axis\": \"step\", \"detour\": \"none\", \"detour_steps\": []}, {\"orders\": [\"LRX\"], \"period\": 1, \"axis\": \"step\", \"detour\": \"uphill\", \"detour_steps\": [5]}, {\"orders\": [\"RLX\"], \"period\": 1, \"axis\": \"step\", \"detour\": \"uphill\", \"detour_steps\": [5]}, {\"orders\": [\"XLR\", \"RXL\"], \"period\": 4, \"axis\": \"distance\", \"detour\": \"uphill\", \"detour_steps\": [5]}, {\"orders\": [\"RXL\", \"LXR\"], \"period\": 3, \"axis\": \"distance\", \"detour\": \"level\", \"detour_steps\": [2, 8, 14, 20]}]}}], \"focus\": {\"graph\": \"m9r4-band-edge\", \"parent_score\": -2003, \"archive_best\": 0}}, \"unverified_reflection_hypotheses\": \"\", \"context_sha256\": \"2f50ffa5fac038e9c365dd3c84c2f23249bc79eae38a147da48be1ff370c81d7\"}", "role": "user"}], "prompt_system_sha": "e6dcb1dc53c824a5", "proposal": 3, "proposer_error": null, "reasoning_tokens": 2709, "repairs_used": null, "score": -1134409.0025, "seconds": 0.16104304100736044, "spec": {"kind": "lift_policy", "name": "left zeros, step-five uphill, distance band repair", "paths": [{"axis": "step", "detour": "none", "detour_steps": [], "orders": ["LRX"], "period": 1}, {"axis": "step", "detour": "none", "detour_steps": [], "orders": ["XRL"], "period": 1}, {"axis": "step", "detour": "none", "detour_steps": [], "orders": ["RLX"], "period": 1}, {"axis": "step", "detour": "none", "detour_steps": [], "orders": ["LXR"], "period": 1}, {"axis": "step", "detour": "uphill", "detour_steps": [5], "orders": ["LRX"], "period": 1}, {"axis": "step", "detour": "uphill", "detour_steps": [5], "orders": ["RLX"], "period": 1}, {"axis": "distance", "detour": "uphill", "detour_steps": [5], "orders": ["XLR", "RXL"], "period": 4}, {"axis": "distance", "detour": "level", "detour_steps": [0, 2, 4, 6], "orders": ["XLR", "RXL"], "period": 2}], "zero_order": "left"}, "status": "keep", "t": 126.48, "tactic": null, "tokens_in": 5492, "tokens_out": 3002, "valid": true}
{"batch": 2, "best_id": 3, "best_score": -1134409.0025, "completed": 3, "eval_seconds": 0.16, "event": "batch", "inflight": 0, "proposals": 3, "propose_seconds": 35.36, "requests": [{"explore_p": null, "focus": "m9r4-band-edge", "island": 0, "mode": "exploit", "parents": [1], "proposal": 3, "tactic": null}], "since_improvement": 1, "strategy": {"focus": true, "history": 4, "inspiration_pool": "top", "inspirations": 1, "modes": {"exploit": 1.0}, "parent": "best", "tactic": null}, "t": 126.48, "usage": {"billing_verified": false, "estimated_usd": 0.079766, "failed_requests": 0, "input_tokens": 15319, "max_spend_usd": 2.5, "output_tokens": 9052, "provider_costed_requests": 3, "requests": 3, "usage_overruns": 0}}
{"J": 0.288675, "delta": 1134410.9987, "end": -1134409.0025, "event": "strategy_window", "proposals": 3, "start": -2268820.0012, "strategy": {"focus": true, "history": 4, "inspiration_pool": "top", "inspirations": 1, "modes": {"exploit": 1.0}, "parent": "best", "tactic": null}, "t": 126.48}
